,Created at,User ID,Text
0,2022-06-27 02:32:06+00:00,1541247973249671168,Thank you to the incredible local organizers who put together a powerful grassroots gathering in Salem on Friday. I was honored to stand in solidarity &amp; community with you. We will continue to fight to protect our rights &amp; we made it clear that #WeWontGoBack. https://t.co/jNrKgnVfIM
1,2022-06-24 15:51:19+00:00,1540361939112538112,"I am devastated the Supreme Court has overturned the Roe v. Wade decision this morning. If you are in need of care, please go to https://t.co/yMwRPcEjlC or call your local Planned Parenthood health center, independent clinic, or abortion fund. Please read my full statement below: https://t.co/wPRBbK5EMi"
2,2022-06-11 20:41:40+00:00,1535723964302929920,Thank you to the organizers behind this powerful #MarchForOurLives event in Sherwood! Your commitment to making your voices heard is inspiring. We must listen to young people who are calling on Congress to pass common sense gun safety legislation. We can't let them down. https://t.co/SFm1xfenml
3,2022-06-07 17:52:18+00:00,1534231792181317632,So proud to have @emilyslist support as we work to win this critical seat in November! I know #OR06 is ready to elect a reproductive rights champion to Congress. https://t.co/6vi2QlRcFh
4,2022-05-18 05:11:20+00:00,1526792529256935424,"Thank you to every single person who made this victory possible tonight! I am ready to win this seat in November &amp; work to expand access to abortion care, tackle the climate crisis, &amp; lower the cost of prescription drugs. Join me: https://t.co/YgBuRrU9Hu"
5,2022-05-17 20:36:06+00:00,1526662868791308288,"RT @LCVoters: It's primary election day in Oregon!

#LCVAF is thrilled to support the following candidates who will bring their commitment…"
6,2022-05-17 19:30:37+00:00,1526646390310326272,"Today is the day! I am proud to be endorsed by over 100 Oregon elected officials, community leaders, &amp; progressive organizations like @PPact, @OLCV, @oregoneducation &amp; so many more. If you haven't dropped off your ballot yet, you have until 8 pm PT: https://t.co/uBYbWpfTfF"
7,2022-05-16 22:52:51+00:00,1526334894137147392,"Team Salinas is out in full force these last few days reminding folks to get their ballots in! Tomorrow is your last day to: 
1. Mail back your ballot. Your ballot MUST be postmarked by tomorrow. 
2. Drop off your ballot at an official drop box by 8 pm PT: https://t.co/u7O7SR6idm https://t.co/v65IFXOzeX"
8,2022-05-16 18:52:31+00:00,1526274414152626177,"We are heartbroken by this anti-Black, racially motivated domestic terrorist attack. We call out the urgent need to confront the threat of extreme white nationalism combined with weak gun laws that led to these horrific incidents. We will not stand by silently. https://t.co/Mmun2EAmYp"
9,2022-05-14 23:21:00+00:00,1525617204036677632,"If you know me, you know this: I am an unapologetic fighter for abortion access. We are not going back, so let me say it loud: #BansOffOurBodies https://t.co/skOg7mYGgO"
10,2022-05-14 19:35:24+00:00,1525560429581172737,Don't forget that this Tuesday (5/17) is the last day to return your ballot to vote in the primary! I had so much fun kicking off a canvass this morning w/ @chelseaking4or. Our team is pumped to get out the vote this weekend! #OR06 https://t.co/7mUYUuDMpU
11,2022-05-13 23:03:28+00:00,1525250402555334656,"RT @SEIULocal503: Have you voted yet? If not, you have until Tuesday to have your ballot postmarked or placed in a dropbox by 8 p.m. You ca…"
12,2022-05-13 19:53:22+00:00,1525202560797134848,"As chair of the House Committee on Health Care, I held big pharmaceutical companies accountable &amp; passed legislation that lowered the cost of prescription drugs. In Congress, I am going to make sure working families have access to affordable health care.
https://t.co/27Tpe39zRD"
13,2022-05-13 19:51:10+00:00,1525202009975975936,RT @TurnoutPAC: Andrea Salinas (@AndreaRSalinas) — who helped Oregon pass one of the strongest abortion rights laws in the country — for th…
14,2022-05-12 21:52:53+00:00,1524870253020188672,"RT @jstreetdotorg: In #OR06, we are proud to endorse @AndreaRSalinas.
Learn more at https://t.co/VN4gwXVyq0. https://t.co/JjG2V27KXk"
15,2022-05-12 18:14:53+00:00,1524815392064974868,"Access to abortion determines people's ability to care for existing children, to remain financially autonomous and to dictate our future well-being. We should all be fighting for our futures and the right to abortion care.
https://t.co/OzTornmfOu"
16,2022-05-11 14:11:01+00:00,1524391630169538560,RT @seiu49: Unions and community orgs are united behind @AndreaRSalinas b/c she is a champion for workers! She knows the challenges we face…
17,2022-05-11 13:29:20+00:00,1524381139745476609,"I am so proud to have earned Senator Warren's endorsement. #OR06 deserves a progressive fighter who will work to expand abortion access, lower the cost of prescription drugs, &amp; tackle the climate crisis. I am ready to be that leader. Join me: https://t.co/3ccfWSsR64 https://t.co/bhjmNKnADk"
18,2022-05-11 02:44:38+00:00,1524218898207313920,We are 1 week away from Election Day &amp; our volunteers have been doing an incredible job getting out the vote! People know there's so much at stake this election &amp; they want a pro-choice champion in Congress. Interested in volunteering? Sign up here: https://t.co/gxQPvhcQM2 https://t.co/UoxBcKLHWd
19,2022-05-08 03:34:50+00:00,1523144366537146368,"RT @BrianEttling: When canvassing today, I told people 'I know @AndreaRSalinas. She has been extremely helpful in my #climate organizing &amp;…"
20,2022-05-08 03:34:44+00:00,1523144342306627585,"RT @BrianEttling: For #ClimateAction today, I canvassed in SW Portland for my friend and OR Congressional District 6 Democratic candidate @…"
21,2022-05-08 03:33:59+00:00,1523144154708013056,RT @tlanepowers: GOTV for @AndreaRSalinas in Garden Home &amp; Metzger today! Voters are catching on to the fact that she’s the best choice for…
22,2022-05-06 19:58:39+00:00,1522667175512662023,"RT @ClinicLilith: Our staff is here to provide safe, compassionate abortion care to every patient that comes through our doors. No one shou…"
23,2022-05-06 16:26:02+00:00,1522613669938425859,"I am thrilled to have earned the endorsement of @electprogress. They have a strong record of fighting for working families &amp; I look forward to joining them in their mission to expand access to abortion care, tackle the climate crisis, &amp; make health care affordable &amp; accessible. https://t.co/usHYH5b4iG"
24,2022-05-06 03:54:51+00:00,1522424629939171329,"Thank you to the @OLMV for hosting tonight's civil rights candidate forum! In Congress, I will continue to be a strong progressive voice for communities of color. I appreciate you creating space for these types of important discussions! https://t.co/320G54NADg"
25,2022-05-04 22:22:14+00:00,1521978533391716352,"When Trump looked to dismantle access to abortion, I helped Oregon pass the strongest reproductive rights law in the country. Now, I am the only candidate in the #OR06 race endorsed by @PPact. Can you help me get my pro-choice message to voters? https://t.co/L5JlastweD https://t.co/5iB6I1wKT0"
26,2022-05-04 19:35:59+00:00,1521936696807370752,"Thank you for your support, @seiu49! I am so proud to have earned your endorsement. I have a record of fighting for Oregon working families &amp; I will continue to advocate on behalf of working people in Congress. #OR06 https://t.co/htUiee1gof"
27,2022-05-03 16:46:13+00:00,1521531585060872193,"Following my statement, I wanted to make a few things very clear. Abortion is still legal &amp; is still your constitutional right. But yesterday's leak revealed that the court seems prepared to end the constitutional right to abortion. I hope everyone is taking care of themselves. https://t.co/XPCXNFblZu"
28,2022-05-03 13:26:21+00:00,1521481288045285381,"RT @PPFA: Planned Parenthood health centers are open and we will continue to provide care, and will keep fighting to ensure you have the he…"
29,2022-05-03 01:54:39+00:00,1521307217969963010,I am absolutely devastated to hear the Supreme Court has overturned the Roe v. Wade decision. Read my full statement below. And please consider making a generous contribution to the National Abortion Federation to support abortion providers: https://t.co/z175ltLAFj https://t.co/7Z2vtNH5yU
30,2022-04-27 17:59:13+00:00,1519375630923485184,"I am so proud to have earned the endorsement of the @wweek! They said: ""She’s a strong choice who deserves the nomination."" #OR06
https://t.co/HgW0mLwlLP"
31,2022-04-27 16:18:52+00:00,1519350374825484289,Congratulations to the Sherwood High School Percussion Ensemble who just won the Percussion Scholastic Open World Championships on Saturday! You represent the best of Oregon &amp; we are so proud of this amazing accomplishment✨🥁 @sherwoodbands #spewgi
32,2022-04-26 17:44:26+00:00,1519009523662409729,"Thanks to everyone who came to our meet-and-greets &amp; canvass launches this weekend! It was great talking to folks &amp; answering questions in Salem, McMinnville, &amp; Beaverton. Special shout out to Rep. Bonamici for knocking on doors &amp; getting people excited about talking to voters! https://t.co/NJ9cvxQIxN"
33,2022-04-25 00:20:21+00:00,1518384381001289728,"Excited to have earned the endorsement of the Yamhill County News-Register! ""We think [her experience] makes Salinas best prepared to hit the ground running in Congress. Others widely agree, as she has been picking up most of the major endorsements.""
https://t.co/SQroqyUdwb"
34,2022-04-21 16:39:49+00:00,1517181321830813706,Thank you to the @tualatinchamb3r for having me at their Key Leaders Series breakfast this morning! It was wonderful to meet some of our great Tualatin business &amp; community leaders &amp; learn about important issues. https://t.co/TmR8Udnegw
35,2022-04-19 17:34:01+00:00,1516470185707724800,"If you know me, you know this: I’m an unapologetic fighter for abortion access. That’s why I’m excited to release my second TV ad featuring my work to help pass one of the strongest reproductive rights laws in the country. 

Take a look👇 https://t.co/FFkcSIvXJS"
36,2022-04-18 14:58:58+00:00,1516068776193650690,"Big news! The Oregonian Editorial Board has endorsed my campaign for Congress, saying “Democrats are best served by selecting Salinas.” Will you help me by retweeting this? #OR06 https://t.co/g1RHCtVaVZ"
37,2022-04-14 17:41:50+00:00,1514660214779224090,"Team Salinas was out in full force this past weekend knocking on doors &amp; talking to voters! We love our volunteers 💜 Want to join us this weekend? Sign up below👇 

4/16 10 AM -- https://t.co/T7XP6KnPZX
4/16 1 PM -- https://t.co/L9GnIkcc9p https://t.co/Y1z6PwDUbO"
38,2022-04-12 03:08:37+00:00,1513715684437479425,RT @craigauster: There's lots of folks running in #OR06. Some have their own wealth or billionaire backers. But only ONE is a lifelong lead…
39,2022-04-11 23:09:54+00:00,1513655610163621889,RT @NikkiGoldschein: Rep @AndreaRSalinas is THE Congresswoman the people of #OR06 deserve if they want to have a representative who will fi…
40,2022-04-11 23:04:51+00:00,1513654337494392835,I also wanted to share my personal statement in response to House Majority PAC's nearly $1M ad buy in the #OR06 Democratic primary for Carrick Flynn. Read my full statement here: https://t.co/RG0TweUEAJ
41,2022-04-11 22:03:34+00:00,1513638914900172801,I have put out the following statement along with five other Democratic candidates in the OR-06 race in response to House Majority PAC’s nearly $1 million ad buy. We are united in our condemnation of this unprecedented and inappropriate attempt to influence Oregon voters. #OR06 https://t.co/G5hWdumBCf
42,2022-04-11 19:42:20+00:00,1513603375916482564,"I learned how to fight for what’s right from my dad, who sacrificed everything for me &amp; my sister. Now I am running for Congress to make sure my daughter &amp; her generation have a stronger future. When I get to DC, I will continue to deliver for Oregon working families. #OR06 https://t.co/tVmcHzoBx6"
43,2022-04-06 19:19:06+00:00,1511785587782701063,"I am honored to have earned the support of @KateBrownForOR in my campaign to represent #OR06. Governor Brown has been one of the most progressive leaders in the nation in the fight for clean energy, reproductive health care, &amp; education. Thrilled to have her on Team Salinas! https://t.co/vBPjSefjsP"
44,2022-04-05 17:42:13+00:00,1511398820202090512,"A big THANK YOU to everyone who knocked doors with Team Salinas this past weekend! We couldn't do this without you. Want to join us to talk to voters? Sign up👇

4/9 10 am --  https://t.co/cwVxZDNMwk
4/9 1 pm -- https://t.co/HlGNe45mYp
4/10 12 pm -- https://t.co/crPkxVurRT https://t.co/LrnJJ2h2y9"
45,2022-04-05 17:36:46+00:00,1511397445518954506,"RT @Vegalteno: The work at @latinovictoryus never ends! We are always trying to elect ""the first"" as it is now the case in Oregon @AndreaRS…"
46,2022-04-05 17:36:31+00:00,1511397382868582402,RT @tlanepowers: Oh hey look it’s a brand new congressional district! Talking to Garden Home folks about voting @AndreaRSalinas for #OR6. #…
47,2022-04-05 17:36:15+00:00,1511397316153982980,"RT @latinovictoryus: 31 million strong, Latinas have grown into a powerful demographic that has the power to influence national and local e…"
48,2022-03-31 23:16:30+00:00,1509671004406272010,"I'm running for Congress to fight for working families, &amp; I'm proud to be endorsed by @PPact, @OLCV, @seiu49, @SEIULocal503, @ufcw555, @nwcarpenters, @oregoneducation &amp; so many more. Can you chip in right now before our big deadline tonight at 9 pm PT? https://t.co/cCAKeQdZ7U"
49,2022-03-31 22:58:27+00:00,1509666463161806864,RT @OregonStand: The Stand for Children Salem chapter is excited to announce our endorsement for Representative @AndreaRSalinas for Congres…
50,2022-03-23 22:23:38+00:00,1506758597509742592,"Join us this Saturday (10 am &amp; 1 pm shift) to knock doors! We will be meeting at Pilkington Park. Sign up now &amp; help us talk to voters about the issues that matter:

10 am shift -- https://t.co/wVehbxDPqW

1 pm shift -- https://t.co/6aFZ849Ieh"
51,2022-03-22 19:19:48+00:00,1506349946013827074,Proud of the work @SaveYamhill is doing to #RecallBerschauer. Yamhill County -- Don't forget to #VoteYes in the recall election today and drop off your ballot in an official dropbox by 8 pm.
52,2022-03-22 19:10:32+00:00,1506347613754310657,"RT @CaseyKulla: Today is the last day to drop off your ballot in the recall election of Yamhill County Commissioner Lindsay Berschauer. 
De…"
53,2022-03-18 18:03:47+00:00,1504881263378792451,@alexismcgill Thank you so much for your support!
54,2022-03-18 18:03:32+00:00,1504881200673951746,"I want to make this clear: as a Member of Congress, I will be on the frontlines fighting to protect and advance reproductive health care, including enshrining the right to choose into law. I am so proud to have earned the support of Planned Parenthood Action Fund. https://t.co/7hPZE9ueFr"
55,2022-03-15 21:20:40+00:00,1503843647946571777,"Join Team Salinas for our first canvass launch this Saturday at noon at West Waluga Park☀️We have less than 7 weeks until voters start receiving ballots, &amp; we need your help to reach as many voters as possible🗳️ Training will be provided. Sign up here: https://t.co/Yf2dRLTPpO"
56,2022-03-12 19:39:52+00:00,1502731115995430913,"RT @comm_civic_life: #Oregon has one of the largest Slavic immigrant populations, many of whom are Ukrainian. We believe everyone deserves…"
57,2022-03-04 22:50:50+00:00,1499880072567611393,"RT @JasonForBend: House Bill 4123 has passed the House and Senate! To effectively address houselessness, we need to lead with compassion, a…"
58,2022-03-03 20:37:57+00:00,1499484243021348886,"RT @FairShotOR: Thank you to the Oregon lawmakers who fought tirelessly to see this bill over the finish line, especially chief sponsors @A…"
59,2022-03-03 20:36:23+00:00,1499483851520819226,RT @DreaValderrama: Appreciations to my colleagues @djgrayber @KhanhPhamForOR @alonsonhli_leon @AndreaRSalinas for championing SB 1543 Univ…
60,2022-03-03 20:36:06+00:00,1499483778686730247,Farmworker overtime bill on to the Governor's desk! https://t.co/1UOE9oYCzC
61,2022-03-03 18:33:14+00:00,1499452856235020292,"I see you, you matter and indeed you are loved. #ProtectTransKids https://t.co/gCLrMMHutb"
62,2022-03-02 17:34:12+00:00,1499075612564094980,I'm thrilled to announce that I've been endorsed by Rep. Suzanne Bonamici in my race to represent #OR06! She has fought tirelessly for the people of Washington &amp; Yamhill Counties. I'm honored to have earned her confidence &amp; support in my campaign to represent these communities.
63,2022-03-01 23:21:58+00:00,1498800744446660608,"RT @ORHouseDems: ¡Por fin! 

Si no fuera por el trabajo de los campesinos, no tendriamos comida sobre la mesa. Lo justo es que estos trabaj…"
64,2022-03-01 23:10:51+00:00,1498797946824888320,"As a first generation Latina, and the daughter of a long line of farmworkers on both sides of my family, I was proud to champion and co-carry the Farmworker Overtime bill this morning. On to the Senate! #ORHouseDems #ThisIsOurShot #PCUNoregon https://t.co/5PWd0XuMSS"
65,2022-03-01 00:45:21+00:00,1498459339937308673,RT @FairShotOR: And #UniversalLegalRepresentation continues forward! Many thanks to our Senators for supporting a program that has already…
66,2022-02-28 23:37:11+00:00,1498442185020116995,Thank you @SaveYamhill for having me yesterday at your incredible event! The work you’ve done to fight extremism is inspiring &amp; you’re a shining example of what’s possible when you organize your communities. You can support their work here: https://t.co/GA2xC0V8OR https://t.co/LKqDizR3ho
67,2022-02-24 21:40:59+00:00,1496963390241075209,I condemn the actions of Russia &amp; its aggressive acts of war on a sovereign democratic nation. I support the Biden administration’s actions to unite our NATO allies in response to Putin’s unilateral attack on innocent lives. I stand with the people of Ukraine.
68,2022-02-18 20:37:59+00:00,1494773210713255936,"@andreat7676 Ha-ha! Yes, same person just smaller 80s hair!"
69,2022-02-18 20:33:58+00:00,1494772197956616193,RT @ORHouseDems: ¡Oigan! ¿Verdad que debemos de pagar a las familias trabajadoras lo q merecen por el trabajo que hacen? House Bill 4002 es…
70,2022-02-18 20:33:39+00:00,1494772117925101568,"RT @ORHouseDems: Working families deserve to be paid for their work. You work, you get paid. But since 1938 our farmworkers have been exclu…"
71,2022-02-17 22:09:55+00:00,1494433958821511179,RT @latinovictoryus: We proudly endorse Andrea Salinas for Oregon’s 6th Congressional District. @AndreaRSalinas has a proven track record a…
72,2022-02-04 16:12:59+00:00,1489633089865359362,"RT @tomkloosterman: Exciting news from @PODERPAC to close out the week!

✔️ New branding 
✔️ New website 
✔️ First endorsed candidates of t…"
73,2022-02-04 16:11:51+00:00,1489632806489755648,"I am proud to announce that @PODERPAC, who is dedicated to electing pro-choice Democratic Latinas, has endorsed me in my race to represent #OR06! As a member of Congress, I intend to protect and advance reproductive health care, including enshrining the right to choose into law. https://t.co/CsJ4qBEDiZ"
74,2022-01-27 21:41:47+00:00,1486816731842502658,RT @craigauster: A new district in Oregon means an opportunity to elect a new champion for climate and environmental justice from the Beave…
75,2022-01-27 21:38:28+00:00,1486815898820177924,Big news: @LCVoters has endorsed our campaign! Their work is instrumental in our fight against the climate crisis &amp; I am honored to be recognized by them as the candidate in this race who is a true climate champion. https://t.co/8jdcB9fFWb
76,2022-01-27 21:37:37+00:00,1486815683388194816,"RT @OLCV: 👏🏽@AndreaRSalinas' strong values paired with her experience fighting for everyday people, our communities, and our climate, make…"
77,2022-01-27 04:18:50+00:00,1486554264180719616,"I had an amazing day touring Yamhill County w/ @CaseyKulla! We had conversations about infrastructure, affordable housing &amp; childcare, economic development, &amp; more. Thank you to everyone who joined the conversations across the county — from Newberg to Grand Ronde Tribal HQ. https://t.co/hB0vLw7JYz"
78,2022-01-20 19:58:03+00:00,1484253912727052288,Endorsement Alert: Governor Barbara Roberts has endorsed me in my run for Congress! I am so grateful to have earned the support of Governor Roberts. Can you join Governor Roberts in supporting my historic campaign? https://t.co/Bb9FIz5AO9
79,2022-01-17 20:53:50+00:00,1483180786907947012,"In honor of #MLKDay &amp; Dr. King's legacy, we must stop suppressing the voices of Black &amp; Brown communities, change the filibuster, &amp; pass the John Lewis Voting Rights Advancement Act &amp; the Freedom to Vote Act. Our democracy and our sacred right to vote is at stake."
80,2022-01-06 21:03:52+00:00,1479197044438757376,"Today we're reminded that the foundation of our democracy is under attack by those who undermine our elections &amp; suppress the vote. I'm fiercely committed to protecting our democratic institutions &amp; fighting for a more just, inclusive, &amp; strong democracy. https://t.co/bDKHW3N5wO"
81,2021-12-12 03:37:34+00:00,1469874040898670599,It's time for McKenzie-Willamette Medical Center management to put community before profits! I stand with the frontline workers at MWMC. https://t.co/OLcVCeLc4o
82,2021-12-09 00:20:55+00:00,1468737388604116994,"I'm running to represent working families in Congress and fight for policies that support them. I'm proud of my record of delivering for Oregonians on issues like lowering prescription drug prices. I want to continue this work in Washington. 
https://t.co/w1xaR2OhTQ"
83,2021-12-06 19:56:19+00:00,1467946021678301184,RT @JeffMerkley: Congress must codify Roe v. Wade in federal law. We must protect abortion rights in all 50 states. And we can't allow the…
84,2021-12-02 00:01:07+00:00,1466195688631324675,"This is more than just an endorsement of my values -- it’s an endorsement of the grassroots commitment to our campaign. We’re fighting for bold, progressive values; for every working family; and for every child that hopes for a brighter future. Join us?
https://t.co/kKg2896ciQ"
85,2021-12-02 00:00:48+00:00,1466195607354150914,"BOLD Democrats chair @RubenGallego said: “At a time when our nation needs transformational leaders in Washington, BOLD PAC is proud to stand with Andrea because she shares our values, is committed to putting families first, and is running a strong campaign that can win.”"
86,2021-12-02 00:00:32+00:00,1466195540064944128,"Did you hear the big news?  This morning, the @BOLDDems — the campaign arm of the Congressional Hispanic Caucus — announced their endorsement of our campaign!
https://t.co/kgv92ai8bH"
87,2021-11-19 19:33:33+00:00,1461779698195836928,"Kyle Rittenhouse carried a gun across state lines and two people died at his hands. I am heartbroken at this verdict. America, we must do better. https://t.co/gFUAYfYPVX"
88,2021-11-19 15:43:20+00:00,1461721764266872835,"It's long past time for Oregon to right this historic wrong and make sure that the essential workers who put food on our shelves and tables are afforded the same rights as other workers in our communities. #orpol #orleg

https://t.co/7DvoHXoDWl"
89,2021-11-16 01:18:40+00:00,1460416997800382464,Thank you @OLCV for this honor. I'll never stop fighting for our environment and climate. #orpol https://t.co/E1c3JiMFDE
90,2021-11-16 01:05:50+00:00,1460413769947901954,"Today we watched Joe Biden sign the historic Infrastructure bill, which will create good jobs and improve the safety of our roads &amp; bridges. Now we need to make sure Congress lowers the cost of living, increases access to care, and fights climate change. https://t.co/No4rlaUDOL"
91,2021-11-11 18:36:02+00:00,1458866122233507843,"We must ensure the best health care we can give them, including mental and behavioral health; better support in the transition to civilian employment; and a commitment to diplomacy and global engagement so that war is a last resort and limited in scope—not first and forever."
92,2021-11-11 18:36:02+00:00,1458866121059147777,"But gratitude alone doesn't pay the bills or heal old wounds. So, when I go to Congress, I'll also demand that our country honor its veterans."
93,2021-11-11 18:36:01+00:00,1458866119503073284,"On this Veterans Day, I'm thinking of my father, Roberto, and honoring the millions of men and women who served with him, and before him and after him. They deserve our deepest gratitude. https://t.co/5Po21R1Zku"
94,2021-11-10 19:08:40+00:00,1458511945712078849,"The actions by the Newberg school board yesterday, firing Superintendent Joe Morelock under the cover of a late-night meeting, is the latest affront to our students' safety.  

https://t.co/7GVqcKie7f"
95,2021-11-10 19:08:40+00:00,1458511944369901568,"I stand with students in Newberg who deserve a quality public education that's free from racism and homophobia. As a mom, I understand how important it is that our students feel safe and supported in their community, and l know all parents want the same for their kids."
96,2021-11-10 18:32:15+00:00,1458502782013435905,"RT @ClackamasDems: Aside from usual failing grades for GOP legislators, we're proud of near perfect environmental scorecard marks @OLCV gav…"
97,2021-11-09 22:12:36+00:00,1458195846743216132,RT @djgrayber: Fantastic news! I’m proud to support my friend and fellow Rep sister as she takes this leap to serve Oregonians in the 6th C…
