,Created at,User ID,Text
92,2020-10-21 01:31:48+00:00,1318726650440404993,"🚨BREAKING🚨: Today’s new poll from ABC News shows that this is a two-point race.

We have exactly two weeks to replace Thom Tillis and flip the Senate.

Join our team today to help us get the job done: https://t.co/eelO6dzAqQ"
93,2020-10-20 23:56:14+00:00,1318702598581530627,"What a day! Loved talking with folks in Carrboro about the importance of this election, with early voting lines around the block. Then topped it off by visiting Matthew’s Chocolates in Hillsborough—a sweet way to end the day! https://t.co/6Wj7JyBVxb"
94,2020-10-20 20:58:34+00:00,1318657885853913094,"Sen. Tillis has stood with Washington Republicans and Big Pharma—not North Carolinians struggling to afford medications due to the high cost of prescription drugs.

It’s time to elect a Senator who will work for the people of NC.

https://t.co/AFVzsHUxaw"
95,2020-10-20 15:54:42+00:00,1318581417127890944,"It’s official: our race is the final TOSS-UP of this election cycle.

Control of the Senate hinges on North Carolina, so we’re looking to folks like you to sign up, chip in, and help us flip this seat. 

We only have 14 more days. Let’s go: https://t.co/xtqCBDbypT https://t.co/iaAzOlKX1K"
96,2020-10-20 13:12:24+00:00,1318540572253147136,"Pretty incredible seeing a record number of North Carolinians head to the polls. If you haven’t yet, I encourage you to take advantage of early voting and do so! Democracy is not a spectator sport—and this is our moment to make our voices heard. https://t.co/arf75uCJDd"
97,2020-10-20 00:54:17+00:00,1318354820923854848,"This is it: we have 15 DAYS until Election Day.

NC is known for razor-thin elections—and if you’ve been waiting to get involved, now’s the moment.

There’s no time to waste as we work to replace Thom Tillis and flip this Senate seat. Let’s do this: https://t.co/3Ufq2q6rXo"
98,2020-10-19 23:20:43+00:00,1318331272654131200,"Sen. Tillis’ Senate seat has been an empty chair for North Carolinians for the past six years. Stacy's experienced this firsthand—even when she reached out to share her experience as a constituent, she was met with silence.

North Carolinians deserve better. https://t.co/tLwg6cq8qY"
99,2020-10-19 20:45:38+00:00,1318292245632684034,"For years, Sen. Tillis has been on a mission to reduce health care for women and families in our state. I’m proud to stand with @PPact and @NARAL as we fight for all North Carolinians to receive quality, affordable care. https://t.co/MHq2Z1bifs"
