,Created at,User ID,Text
0,2022-06-21 18:15:12+00:00,1539310984749142019,https://t.co/NeOCPjM7TS
1,2022-06-08 15:59:54+00:00,1534565894851923968,https://t.co/bRXoRIIvtg
2,2022-06-07 22:52:51+00:00,1534307428312829952,"Today is the day! Visit https://t.co/hn7dbGdbpv to find your polling place, locate a Vote Center, or find a drop box near you! If you want to mail your ballot, make sure it is postmarked today. https://t.co/PE58KEaMRN"
3,2022-06-06 04:37:19+00:00,1533669341274591237,It was great to be at Santa Cruz Pride today! #HappyPride https://t.co/5J89X7SaYJ
4,2022-05-30 22:52:28+00:00,1531408228843544576,Every Memorial Day we honor those who have lost their lives serving in the United States armed forces. May we remember their sacrifices. https://t.co/pho7mU5Vlt
5,2022-05-30 22:52:05+00:00,1531408130772377601,https://t.co/sYB4v5nwKm
6,2022-05-23 19:18:24+00:00,1528817640956825600,Today is the last day to register to vote and received your mail-in-ballot. Register online at https://t.co/9YTwv2wlAd. You can register and vote on the same day in person if you miss today's deadline. https://t.co/vUvqJRP8WK
7,2022-05-23 16:37:29+00:00,1528777146675523584,Monterey County Elections has announced a list of mobile voting locations leading up to the June Primary on June 7. https://t.co/81WdovSBDd
8,2022-05-22 04:23:24+00:00,1528230017783607296,Great to attend the Boulder Creek Business Association’s dinner and silent auction tonight! https://t.co/aWrrouqsEC
9,2022-05-19 19:50:34+00:00,1527376183486164992,"“Having grown up on the Central Coast, you also realize and appreciate the obligations and the responsibilities to protect that beauty,” Panetta said. 
https://t.co/viXggpUKXz"
10,2022-05-13 19:15:29+00:00,1525193030776393728,May is Asian/Pacific American Heritage Month. May was chosen to commemorate the immigration of the first Japanese to the U.S. and to mark the completion of the transcontinental railroad (the majority of the workers who laid the tracks were Chinese immigrants). https://t.co/oBeBhTb5EI
11,2022-05-12 19:32:57+00:00,1524835037639634944,"A sincere thank you to the @mcweekly for their endorsement. 

""We’re...enthusiastic about re-electing Jimmy Panetta, who is steadfast in his support for critical Central Coast issues...He is accessible and devoted to providing constituent services.""

https://t.co/Zz1D2Maq1j"
12,2022-05-10 17:17:17+00:00,1524076119535673344,"Election season has officially begun, starting Monday when ballots started arriving in mailboxes!

https://t.co/qXIZVGl4YZ"
13,2022-05-08 19:11:13+00:00,1523380016062423045,What a great evening joining the Paso Robles and Templeton Chamber of Commerce 2022 Annual Gala and Awards Dinner. Congratulations to Pat Bland - “Paso Roblan of the Year”! https://t.co/TOCLuy3gr4
14,2022-05-02 19:58:28+00:00,1521217579259375616,Thank you to everyone who joined us in San Jose yesterday for our May Day Meet and Greet with @RepAnnaEshoo and @RepZoeLofgren. It was great to see everyone - especially Assemblymember @Evan_Low. What a wonderful day! https://t.co/a6Ab9xdrR2
15,2022-04-22 01:34:48+00:00,1517315952353824768,"Thank you to Congressman Salud Carbajal,  the SLO County Democratic Party, the Atascadero Democratic Club, and the Paso Robles Democratic Club for hosting such a wonderful meet and greet in Paso Robles! https://t.co/qyFCSYIQLT"
16,2022-03-30 01:20:26+00:00,1508977415791382531,I am honored to have received 100% on the League of Conservation Voters National Environmental Scorecard. @LCVoters  has been leading the fight for a healthy environment for 50+ years. https://t.co/gccBqwy4Jx
17,2022-03-21 22:12:41+00:00,1506031065294548994,"Thank you to everyone who came out on Saturday in spite of the rain! A special thank you to our host Lora Lee Martin, all of our sponsors, and the Democratic Women's Club of Santa Cruz County. https://t.co/lqel83dy59"
18,2022-02-05 19:57:42+00:00,1490052028533334016,"Great article written by Emma Brown of Carmel High School! 

https://t.co/b5TyIRLX2R"
19,2022-02-01 19:48:20+00:00,1488600123512737794,"Congressman Jimmy Panetta speaks with BenitoLink about the new congressional districts, goals he hopes to achieve in his last year representing San Benito County, federal funding opportunities for the county and efforts to reopen San Justo Reservoir.
https://t.co/SMxvUqadLX"
20,2022-01-13 22:01:42+00:00,1481748314047483905,"“Although the shape of our district has changed, it will not change my dedication and desire to enhance the lives and ensure the livelihoods of my constituents by making the federal government work for them.”
https://t.co/mrh2ZfTcR9"
21,2021-12-27 23:17:30+00:00,1475606794982494210,RT @ksbw: Rep. Jimmy Panetta announces run for re-election in new district https://t.co/oaieISbRwW
22,2021-12-27 22:27:12+00:00,1475594139790020608,Proud to announce my re-elect campaign to continue my work for the people of the Central Coast! The new 19th Congressional District has much of my current district and a few new communities. Looking forward to getting out to the new CD19 in 2022 so I can continue to serve you! https://t.co/MDlwuV7nWJ
23,2021-10-21 23:27:47+00:00,1451329397210828802,Thank you to the @mcweekly readers for your support! https://t.co/5iVDolLJTd
24,2021-09-17 22:19:37+00:00,1438991054376603653,Thank you to everyone in Santa Cruz County who came out for our event last night! https://t.co/Rf74kruuJH
25,2021-09-14 17:45:14+00:00,1437834842142482437,"Today is CA Recall Election Day, and we need to make sure that every eligible voter has voted “no” on the recall ballot before the end of the day so we can keep Governor Newsom in office. 
https://t.co/tDUR1T4wrp"
26,2021-07-17 17:08:35+00:00,1416444735380594688,"There’s no denying that the pandemic has taken a financial toll on many across the nation. That’s why passing the American Rescue Plan, including an important expansion of the Child Tax Credit, was a much needed relief for working families. https://t.co/D7Oi6t2PHe"
27,2021-06-14 17:33:36+00:00,1404492230614601729,"Happy Pride Month! This month and every month, I stand in full support of protecting and expanding the rights of LGBTQ Americans. Add your name today to join me in telling the Senate to pass the Equality Act.

https://t.co/gnJ48hAtzH"
28,2021-03-17 00:04:09+00:00,1371975605609062403,"The #AmericanRescuePlan will help put our economy back on track, get vaccines in arms, and provide people with much needed support.  https://t.co/b0MMSiQx53"
29,2021-03-11 23:41:10+00:00,1370157883074043904,Serving in Congress is one of the greatest honors of my life — it’s a duty that I don’t take lightly. My goal is simple: to preserve our values and improve the quality of life of the residents of the Central Coast of California.  https://t.co/i4AeXY4jxo
30,2021-02-16 00:01:33+00:00,1361465705992912901,https://t.co/9h2AiK5pKf
31,2021-02-03 00:51:45+00:00,1356767296602001409,https://t.co/ZdQcnbSjWf
32,2021-01-26 01:37:15+00:00,1353879644039049216,Some very important and meaningful firsts.  It was an honor to be a part of such a historical day.  https://t.co/nV2JhBguuy
33,2021-01-20 21:57:06+00:00,1352012299872002050,@youngNfamous1 Hi!  We would like to talk with you more about HR 25.  Would you please DM us your email?
34,2021-01-20 21:53:51+00:00,1352011483949879297,@b00kn3rd79 Hi! We would like to contact you to talk further about HR 25. Would you DM us your email address?
35,2021-01-06 23:58:17+00:00,1346969369310494723,REP. PANETTA TAKES OATH OF OFFICE FOR 117th CONGRESS https://t.co/XwSZgbc0BB
36,2020-12-31 20:24:13+00:00,1344741167779389440,"Tonight at midnight is our end of year filing deadline, and I am asking for your support so that we can finish this year strong.  If you are able, please consider contributing to the campaign by our deadline at midnight tonight.  https://t.co/RACsgysq4m"
37,2020-12-25 10:19:45+00:00,1342414721509588994,https://t.co/dsc1hbbLDB
38,2020-12-25 08:04:03+00:00,1342380574938255366,Congratulations Senator Padilla!  https://t.co/2EdSTX6H0z
39,2020-12-15 22:52:23+00:00,1338980252270219265,"Thank you @kollerv for casting our electoral college vote for the 20th Congressional District!  A political scientist by training, he has worked on every presidential campaign since 2004 in Monterey County and in several swing states.  https://t.co/NO4OAh3Ztg"
40,2020-12-11 07:02:56+00:00,1337291762054823936,https://t.co/yhfkeWy8Cj
41,2020-12-04 20:26:25+00:00,1334957249475710976,"“As a chief deputy whip, Congressman Panetta will serve on the powerful House Democratic Steering and Policy Committee, which recommends committee assignments to the Democratic Caucus and helps shape the House policy agenda.""  https://t.co/ocdhZ5yeLT"
42,2020-11-27 00:19:30+00:00,1332116803124817922,"I hope everyone has a safe and healthy Thanksgiving. 
 Please continue to take the proper precautions to slow the spread of COVID-19.  https://t.co/jycmJI95tu"
43,2020-11-20 23:31:56+00:00,1329930505928654849,"Again, thank you for the support.  I look forward to continuing to represent you in Congress!  https://t.co/gCkTuW1wPt"
44,2020-11-12 04:09:13+00:00,1326738796042280960,Happy Veterans Day! https://t.co/vsrsKf1Xth
45,2020-11-09 21:23:23+00:00,1325911889935675397,Right here in my own District!  Thank you to everyone who worked so hard this election to make sure every vote gets counted.  https://t.co/dMXOnKWine
46,2020-11-09 21:21:56+00:00,1325911526197272576,https://t.co/VfyQlaYc4o
47,2020-11-04 21:12:00+00:00,1324097087307304960,Thank you for your vote and your support.  It is my honor to continue to represent the Central Coast of California in Congress. https://t.co/usG1cjq2k6
48,2020-11-03 23:18:39+00:00,1323766568841457664,"Today is Election Day and there are 162,117 ballots left to be cast in the 20th Congressional District.  The polls and drop box locations will close today at 8:00PM.  If you have not already, please get out and vote!  https://t.co/xhq1cMxpc7 https://t.co/ZiUGpmYUPn"
49,2020-11-01 08:36:49+00:00,1322819872372322306,3 days to go!  Great day to be out walking precincts with great company! https://t.co/pSdJnGiChe
50,2020-11-01 08:34:23+00:00,1322819261648154629,Thank you to @ksbw TV Action News 8 for your election coverage!  https://t.co/Ur9lkRvf41
51,2020-10-29 19:23:48+00:00,1321895530394386437,Thanks for having me on the show to discuss issues impacting the Central Coast.  https://t.co/jcB70qNZMB
52,2020-10-29 19:19:16+00:00,1321894390034411521,Please join friends and supporters for the final fundraiser for the 2020 election!  https://t.co/AgtxAbHhif https://t.co/LdVnFz2Yim
53,2020-10-27 04:55:45+00:00,1320952300089733120,https://t.co/3uOIF5DOWy
54,2020-10-25 05:43:37+00:00,1320239571456589824,"Election Day is right around the corner so please be sure to vote!  Voting is critical and we all are responsible for making a change.  #GOTV
https://t.co/JSd9r4kMRG"
55,2020-10-25 05:41:29+00:00,1320239033646084097,I am honored to be endorsed by @VetsForRL. https://t.co/T5uHQm8CJB
56,2020-10-25 01:16:13+00:00,1320172280614318082,"I support the Biden Care Plan and stand with @SEIU2015. I look forward to working with them and, hopefully, a Biden-Harris Admin, to support our #caregivers. Time to invest in #LongTermCare! https://t.co/ZAc811z3cn"
57,2020-10-23 21:28:15+00:00,1319752520869105664,I hope you can join us TONIGHT for one of my last virtual receptions before the election! https://t.co/BneWZGia9B
58,2020-10-23 19:18:41+00:00,1319719915813621760,https://t.co/TJ0ZUKPnTi
59,2020-10-21 06:31:45+00:00,1318802135602008067,Did you miss yesterday’s voter registration deadline?  That’s okay!  You can still register to vote for in-person voting on Election Day.  https://t.co/KNbHshX86X https://t.co/pVe0IL2ZC0
60,2020-10-21 06:29:45+00:00,1318801631610167297,https://t.co/P7b5ggguJG
61,2020-10-18 07:47:24+00:00,1317734008625639425,"In honor of LGBT History Month, I am proud to be endorsed by Bay Area Municipal Elections Committee (@BAYMEC) 

I am also excited to have Co-Chair of the Congressional LGBTQ+ Equality Caucus, Congressman @RepSeanMaloney, join me on Monday, October 26th for a a virtual reception. https://t.co/kN9QwZ7HPS"
62,2020-10-16 19:19:40+00:00,1317183445655695361,"I will be joining local activist @NathanielSawye8 for a conversation via Zoom this Monday, October 19th at 5:00pm.  Be sure to tune in!  https://t.co/EKlmsAznDf"
63,2020-10-15 05:45:07+00:00,1316616070225035271,I cast my ballot today!  Please make sure to vote and make sure to vote early! https://t.co/W8THWE2RBZ
64,2020-10-15 05:43:29+00:00,1316615661439787009,Thank you to Martine Watkins for having me on your show!  https://t.co/tnXNSkdFYR
65,2020-10-14 20:00:08+00:00,1316468854000820225,"Thank you to LIUNA Local 270 for endorsing my campaign. 
 I am honored by your support. https://t.co/c91QokdN3m"
66,2020-10-09 21:29:10+00:00,1314679319705210880,I am proud to be supported by the @mcweekly.  https://t.co/ivtnxXitD1
67,2020-10-09 21:24:28+00:00,1314678138253664256,"I am honored to receive 100% on the @FPAction scorecard for my work to support Central Coast farmers and farmworkers while keeping food healthy, safe, and affordable.  https://t.co/8bNJTkwazy"
68,2020-10-09 21:14:55+00:00,1314675737522176001,Thank you to the Silicon Valley Stonewall Democrats for endorsing my campaign.  https://t.co/j7HDLGWr3Z
69,2020-10-09 21:11:58+00:00,1314674993037414400,"Join myself, @AsmRobertRivas, @AsmMarkStone, and local County Democratic Parties as we mobilize on Zoom to flip Arizona from Red to Blue by electing @JoeBiden/@KamalaHarris to the White House and @CaptMarkKelly to the U.S. Senate.  https://t.co/3bxq1XyxIx https://t.co/yTZPvvYXsS"
70,2020-10-09 20:42:18+00:00,1314667528069677056,"Once again, @UNITEHERE483 honored me with their endorsement to be their representative in the U.S. Congress.  With that support, I look forward to continuing to fight for the service industry employees on the Central Coast.  https://t.co/kXgCgujD81"
71,2020-10-09 20:37:32+00:00,1314666326779031552,Thank you to @yorkschool and the Activism Club for putting on the election forum this last week.  I appreciate your interest and involvement in politics and the great questions from the student body. https://t.co/zqsWwzY8eK
72,2020-10-07 20:53:52+00:00,1313945663831379968,"Nice recognition right here at home in Seaside, California!  https://t.co/ycxkBZ9SML"
73,2020-10-07 20:49:29+00:00,1313944560838426624,https://t.co/6VxorH2wkd
74,2020-10-02 20:06:08+00:00,1312121710091497472,Thank you to the @AWAction_News (AWA) for endorsing my campaign.  The goal of the AWA is to champion causes that alleviate the suffering of animals - Helping Animals Helps Us All. https://t.co/m3mqGvbbrG
75,2020-10-02 20:01:28+00:00,1312120536441384960,https://t.co/XLtKjaXPg2
76,2020-09-16 01:58:55+00:00,1306049898597421056,"Grateful to have received the @Everytown for Gun Safety Action Fund endorsement.  Everytown is a movement of Americans working together to end gun violence and build safer communities.  #GunSenseMajority
 https://t.co/gWmyTlnfuq"
77,2020-09-09 23:44:34+00:00,1303841758598459393,Thank you to the @LCVoters Action Fund for endorsing my campaign.  https://t.co/knBPMlY8NG https://t.co/MBmw5R910b
78,2020-09-07 20:13:11+00:00,1303063788732575744,"Today, let’s honor and celebrate the contributions of America’s working people.  https://t.co/gPMk9cCK3Y"
79,2020-09-02 21:15:50+00:00,1301267615281676289,"Honored to be awarded the 2020 Moms Demand Action Gun Sense Candidate distinction.  Moms Demand Action is part of Everytown for Gun Safety, and is the nation’s largest grassroots volunteer network working to end gun violence in America.

 https://t.co/Ockol5SXpu https://t.co/Lh27Myi7d0"
80,2020-09-01 18:39:58+00:00,1300866002867990528,Today is National Poll Worker Recruitment Day.  The U.S. Election Assistance Commission designated this day to encourage potential poll workers to sign up to Help America Vote in 2020.  https://t.co/PopzgZ5us1
81,2020-08-27 22:58:55+00:00,1299119230256726017,I am honored to have received the endorsement of the @CSALC_Org. https://t.co/rBDglqVKec
82,2020-08-27 01:58:43+00:00,1298802089120763906,Today is Women's Equality Day which marks 100 years since Congress passed the 19th Amendment granting women the right to vote.  https://t.co/1sKnl9PBnY
83,2020-08-21 01:09:59+00:00,1296615500047212544,"Tonight is the last night of the #DemConvention and you won't want to miss it.  Guest speakers will include: @CoryBooker, @PeteButtigieg, @GavinNewsom, @KeishaBottoms, @SenatorBaldwin, @SenDuckworth, @ChrisCoons, @AndrewYang, and @JoeBiden.   https://t.co/3FsxNPkWwA"
84,2020-08-20 00:31:37+00:00,1296243454398226438,"Tonight marks the third night of the #DemConvention.  Guest speakers will include:  @ewarren, @TeamPelosi, @HillaryClinton, @GovEvers, @GovMLG, @GabbyGiffords, @KamalaHarris, and @BarackObama.  https://t.co/3FsxNPkWwA"
85,2020-08-19 22:25:17+00:00,1296211661066391553,The @USPS is a critical and cost-effective way for Americans to receive and send mail.  Can I count on you to join me in support of the USPS?  https://t.co/Oa0kMYWUPt https://t.co/AoYoIxKGSm
86,2020-08-19 17:52:35+00:00,1296143035093274625,Electoral College forms - it’s getting very real! https://t.co/Qr6kIsPE4Z
87,2020-08-19 00:09:44+00:00,1295875562209021952,"Please tune in to the second night of the #DemConvention to listen to guest speakers: former Acting U.S. Attorney General @SallyQYates, Senate Democratic Leader @SenSchumer, Former Secretary of State @JohnKerry, @AOC, @RepLBR, @BillClinton, and @DrBiden.  https://t.co/3FsxNPkWwA"
88,2020-08-18 00:23:19+00:00,1295516589366812672,The 2020 Democratic National Convention is a four-night event starting tonight from 6-8pm PT. Be sure to tune in to watch the Democratic Party formally nominate Joe Biden and Kamala Harris as the next president and vice president of the United States.  https://t.co/3FsxNPkWwA
89,2020-08-14 21:35:11+00:00,1294387115694813184,Thank you to the California Labor Federation AFL-CIO for their endorsement.  The California Labor Federation is dedicated to promoting and defending the interests of working people and their families for the betterment of California’s communities. https://t.co/QsqgjzyEVt
90,2020-08-12 17:17:06+00:00,1293597389693915136,"SALINAS, CA – Today, Jimmy Panetta, Representative of California’s 20th Congressional District, released the following statement endorsing the Democratic Party ticket of @JoeBiden for president and @KamalaHarris for vice president: #BidenHarris2020 https://t.co/KctMSfOpiH"
91,2020-08-06 22:17:58+00:00,1291498780127145985,Today is the 55th anniversary of the Voting Rights Act. This act prohibits racial discrimination in voting and was championed by the late Representative John Lewis. There is no better way to celebrate this anniversary than by registering to vote.  https://t.co/Ay4njCQ3tF
92,2020-08-06 19:25:46+00:00,1291455444578209792,"Vote-by-mail is a safe, secure way to cast your ballot this November.  https://t.co/9Yzo8OdDxA"
93,2020-07-21 23:40:15+00:00,1285721281351081987,"OUR ANNUAL SUMMER PARTY HAS GONE VIRTUAL!

Please join hosts Jennifer Rosenthal, and Kate &amp; Richard Rosenthal with special guest Secretary Leon Panetta for a virtual event in support of Congressman Jimmy Panetta.  https://t.co/Rj5qqI7c8a https://t.co/Bu9nSck3pJ"
94,2020-07-14 19:30:30+00:00,1283121712393891840,It's critical that we all wear a mask.  https://t.co/1SoyoZpYGE
95,2020-07-14 07:23:56+00:00,1282938867453005824,"California has expanded vote-by-mail in order to offer a safe, convenient, and secure way to vote amid concerns about the spread of COVID-19.

Register today to make your voice heard this November.
https://t.co/LGrt5Owb1M"
96,2020-07-09 16:08:00+00:00,1281258815334170624,"Surgeon General Jerome Adams: “Please, I’m begging you, wear a face covering.” Let’s listen to the experts.  https://t.co/Vgy3rEBgfZ"
97,2020-07-05 00:15:02+00:00,1279569438602231808,Happy Fourth of July!  https://t.co/9o9JpIQ9CV
98,2020-06-11 22:19:59+00:00,1271205566736527360,Happy Pride Month!  https://t.co/OrhHOacbZE
99,2020-06-10 06:11:20+00:00,1270599407591776260,"There is a new grant available for very small businesses (1-20 employees) in City of Monterey. It is available for a limited time, click here for more information: https://t.co/xfN7va4mbX"
