,Created at,User ID,Text
0,2022-06-25 00:04:08+00:00,1540485958646243329,"We are not slaves to the state. We own our bodies. Personal Liberty lost ground today, but despots only win when we let them."
1,2022-06-25 00:04:07+00:00,1540485956725346304,Clarence Thomas isn’t even being discreet about it. He wants to grant government the authority to reinstate draconian policing of our personal lives. If you don’t want Big Brother and Sharia in your life you should be worried about this decision.
2,2022-06-25 00:04:06+00:00,1540485954246434816,"Roe was never just about abortion. “Killing babies” was merely an emotional wedge to force reversal of progress on a fundamental question. How much authority does government have to regulate and criminalize the most intimate decisions in our lives? 
https://t.co/YJpIIY2Rhm"
3,2022-06-17 17:37:51+00:00,1537852034497617920,"The chickens that have been fed with cannabis will sell for a higher price at the farm’s restaurant, he added... his chicken would go for double. There are no traces of cannabinoids in the chicken meat or its eggs…”"
4,2022-06-17 17:37:51+00:00,1537852033386135552,"“Cannabis-supplemented chickens tended to experience fewer cases of avian bronchitis, and the quality of their meat – judged by the composition of protein, fat and moisture, as well as its tenderness – was also superior…"
5,2022-06-17 17:37:51+00:00,1537852032249364483,Victimless crimes are state tyranny and get in the way of free and fair markets.
6,2022-06-17 17:37:50+00:00,1537852030689198080,"This is yet another reason why we need federal action and clarity on cannabis/hemp legalization and regulation. American farmers and consumers are missing out on opportunities other countries are already benefiting from and capitalizing on. 
https://t.co/x3BYIIh8tK"
7,2022-06-11 20:00:02+00:00,1535713487976124417,If you live in the Metro East and want one of @chipforcongress’ signs—please shoot me message. Let’s get these out and in some yards to show our support! https://t.co/94E0PO4F9T
8,2022-06-11 19:27:52+00:00,1535705394252857344,Chip’s record of accomplishment set him apart as an experienced leader and collaborator. He is ready to be part of government of the people—that works for the people—and not just the wealthy few. Chip has always been and will continue to advocate and  fight for working families.
9,2022-06-11 19:27:51+00:00,1535705390029094913,"I’m proud to endorse @chipforcongress for Illinois’ 12th Congressional District. As a fellow veteran I know he has what it takes to work hard and meet the unique challenges our diverse and predominantly rural district has. 
https://t.co/NaTgljXDfC"
10,2022-05-30 13:46:34+00:00,1531270846483992577,All gave some—some gave all. Today we remember. https://t.co/r6XMkLG4jt
11,2022-05-29 19:21:16+00:00,1530992691496075266,"The Food and Agriculture Organization of the United Nations said in April that Russia’s war on Ukraine was mostly responsible for the 17.1% rise in the price of wheat, barley, corn and other grains.”"
12,2022-05-29 19:21:15+00:00,1530992687901511682,“Russia’s war on Ukraine has caused a ripple effect across the globe: It has disrupted supply chains and contributed to the surge in rising fuel prices and scarcity of grains and fertilizer…
13,2022-05-29 19:21:15+00:00,1530992685816881155,Our food security shouldn’t be threatened by the whims of a fascist thug on the other side of the globe.
14,2022-05-29 19:21:15+00:00,1530992684328013824,"The current crisis must be resolved, but going forward we must look to diversify and build resiliencency in our domestic food production. Government must work with farmers and processors to build local capacity."
15,2022-05-29 19:21:14+00:00,1530992681970802688,"The blood of tens of thousands of combatants and innocent civilians are already dripping from the hands of Putin. As the war drags on the death toll will rise as global food shortages and costs mount. We must stay vigilant at home and abroad. 
https://t.co/GZxVw12YAs"
16,2022-05-27 16:59:35+00:00,1530232259822997505,@amyklobuchar If 18-year-olds can enlist in the US military and fight and die for their county in uniform with an M4 they sure should be able to buy alcohol. CHANGE THE LAW.
17,2022-05-24 21:40:14+00:00,1529215724274712576,"Your political plastic needs to be on private—not public right-of-way—ground. You’re just making yourself look bad. 

If you see unlawfully placed signage please contact the appropriate local authorities. Happy campaigning!"
18,2022-05-24 18:28:19+00:00,1529167424502870016,Dear political candidates that are either oblivious to the law or don’t think it pertains to them—you can’t plant your signage wherever the hell you want. https://t.co/XhnM8XzQjs
19,2022-05-21 16:47:00+00:00,1528054763765506048,@Jaquebelle @thedailybeast I was thinking the same thing. We were chatting about who all had one after work yesterday. It’s on my short list of things to get done—after I get my knee fixed first though.
20,2022-05-20 03:16:50+00:00,1527488490446921743,"Get your vote in to determine who will be on the ballot in November. It’s not too late to register or request to vote by mail. Vote early and vote often. That’s how we enact the change we want to see. 

More info can be found at the following link: 

https://t.co/AytvghSrQ6"
21,2022-05-20 03:16:49+00:00,1527488488408502272,"Early voting started today! It’s an honor to be on the ballot for the third year in a row, but this time as a precinct committee person and a candidate for county board. I’m asking for your support and am thankful for the opportunity to work for my community as a public servant. https://t.co/KhJKpGcgcb"
22,2022-05-18 02:49:14+00:00,1526756770491899905,@JackMurphyRGR What a sad excuse for an insecure pretty boy that never served a day in his life.
23,2022-05-15 23:28:12+00:00,1525981404961685506,"The solution to a bad guy with a gun isn’t a good guy with a gun. The issue is the bad guy having a gun at all.  

“Buffalo white supremacist, 18, threatened a school shooting last year and was given psychiatric treatment - but still legally bought three guns.”"
24,2022-05-15 23:28:12+00:00,1525981402818301954,"My heart goes out to@the victims and their families. Another horrific shooting by a violent radical extremist shows us once again—we don’t have an “assault weapon” problem in America. We have a firearm access, radicalization, and mental health problem. 
https://t.co/z25qAX3LPq"
25,2022-05-12 12:29:01+00:00,1524728348433387522,@mechmannfr @thehill I’m running for St. Clair County Board this cycle. I’m helping Chip Merkel in his campaign for the 12th Congressional District.
26,2022-05-11 02:25:37+00:00,1524214111365701632,"@thehill What happened to the party of, “The best government is that which governs least”? That’s right—the American Taliban took control."
27,2022-05-06 13:00:21+00:00,1522561909651816450,"When models are cost prohibitive—the market shifts. A decentralized economy fueled by innovation in the pursuit of added value isn’t a perfect system, but like democracy—its still the best one out there."
28,2022-05-06 13:00:20+00:00,1522561906262921221,"Screaming and demeaning doesn’t change peoples minds and how we do things. Once again—it’s the market and the free exchange of goods, services, and ideas that will push us towards change."
29,2022-05-06 13:00:20+00:00,1522561904627134466,"A system dependent on the importation of materials to grow food might be efficient now, but it lacks resiliency and longterm sustainability. This lack of depth will lead to food scarcity, upheaval, and loss of life in the coming years just as it did in in the MENA during 2012."
30,2022-05-06 13:00:20+00:00,1522561902584418305,"I took plenty of flak for not embracing such rhetoric, pushing radical and unattainable ideas, and pursuing government overreach when I ran for congress. How we grow our food needs to change, but centralized planning and socialism isn’t the answer."
31,2022-05-06 13:00:19+00:00,1522561900889968640,"There are elements on the extreme wings that like to embrace centralized control and authoritarianism when it suits their agenda. 
https://t.co/gzD7CLwJOI"
32,2022-05-04 13:31:35+00:00,1521844992473452544,"These rights, too, cannot be justified under the Court’s approach in Justice Alito’s draft opinion.”"
33,2022-05-04 13:31:35+00:00,1521844991114555392,"…the right of parents to control the upbringing of their children, the right of competent adults to refuse medical care, and the right of consenting adults to engage in same-sex sexual activity under the liberty of the due process clause."
34,2022-05-04 13:31:34+00:00,1521844989608747009,"But this right cannot be found in the text, the original meaning, or tradition. Likewise, the Court has protected the right to procreate, the right to custody of one’s children, the right to keep the family together,…"
35,2022-05-04 13:31:34+00:00,1521844988149223425,"It wasn’t until 1967, in Loving v. Virginia, and 2015, in Obergefell v. Hodges, that the Court protected a constitutional right to marry striking down laws prohibiting interracial marriage in the former case and laws forbidding same-sex marriage in the latter."
36,2022-05-04 13:31:33+00:00,1521844986702094336,"I expect that after Roe is overruled some states will quickly pass laws prohibiting types of contraceptives that act after conception, like the IUD and the morning-after-pill. Under Justice Alito’s reasoning, those laws too would be constitutional. Or consider the right to marry."
37,2022-05-04 13:31:33+00:00,1521844985498415105,"It, too, is not a right in the text of the Constitution or contemplated when the document was ratified or that was historically protected."
38,2022-05-04 13:31:33+00:00,1521844984143564801,"“…it was not until 1965, in Griswold v. Connecticut, that the Court held that the Constitution protects a right to purchase and use contraceptives…"
39,2022-05-04 13:31:33+00:00,1521844982814064641,The more power government is granted the more levers zealots have to pull to control and regulate our lives. This SCOTUS opinion does just that and the reverberations will shatter more than most even know.
40,2022-05-04 13:31:32+00:00,1521844981396299781,"Unless you want the American Taliban looking over your shoulder, regulating  your bedroom, controlling your doctor’s office, watching your uterus, and erasing your parental rights you should be appalled and scared."
41,2022-05-04 13:31:32+00:00,1521844979299201024,"I don’t care if you call yourself pro-choice, pro-life, anti-choice, pro-birth, or any other splattering of loaded phrases."
42,2022-05-04 13:31:31+00:00,1521844977952858113,What he fails to mention is that we are far removed from the America of the 1700s when women were essentially legal property of their husbands with zero rights. Reversion to such a tyrannical state is not an option.
43,2022-05-04 13:31:31+00:00,1521844976778371073,"Justice Alito is right on one point. This right was not explicitly included in the text of the Constitution, was not protected by the original meaning of the Constitution, and was not traditionally safeguarded as a constitutional right."
44,2022-05-04 13:31:31+00:00,1521844975436275715,We have the autonomy to modify our bodies. We certainly have the inalienable right to decide if and when we reproduce. Nothing is more natural and foundational than that.
45,2022-05-04 13:31:31+00:00,1521844974190481408,"Erasing a natural right codified by nearly five decades of judicial precedent says we don’t. 

Justice Alito is wrong. We own our bodies. We have the sovereignty to determine what we put in our bodies. We have the authority to dictate what we do to our bodies."
46,2022-05-04 13:31:30+00:00,1521844972839911434,"It’s in 3rd amendment, the 4th, the 14th, and in boldface italics in the preamble. We either own our bodies or we don’t. We either have the power to determine what we do with our bodies or we don’t."
47,2022-05-04 13:31:30+00:00,1521844971413946368,He claims that almost five decades a group of five justices nominated by Republicans presidents along with two nominated by Democrats made up a right. Make no mistake—the right to privacy—of self determination—of personal Liberty is embedded throughout the US Constitution.
48,2022-05-04 13:31:29+00:00,1521844969111175168,"This SCOTUS decision is about much more than just abortion now. Justice Alito’s draft legal opinion is a frontal attack on personal Liberty. 
https://t.co/iKbqn0z3j9"
49,2022-05-02 23:52:05+00:00,1521276371766591488,"@richardhursttho @AOC I wasn’t born with a silver spoon in my mouth. The only thing I’ve ever been entitled to is working for everything I want in life, which right now is mostly a pile of IOUs and hope for the future."
50,2022-05-02 23:48:01+00:00,1521275347446255618,"@richardhursttho @AOC Capitalism isn’t the problem. A lack of fair markets, the erosion of collective bargaining, and the kleptocracy that is our federal government is. Demonizing capitalism isn’t the answer especially when it is being portrayed as something it isn’t."
51,2022-05-02 23:42:55+00:00,1521274065775992834,"@richardhursttho @AOC You couldn’t be more wrong. Nothing in my life has ever been easy. I’ve lost money two years in a row on hemp. If it weren’t for my VA disability benefit I would’ve declared bankruptcy in 2020. I’m working two full time jobs, up to be eyeballs in debt, and work everyday."
52,2022-05-02 17:03:04+00:00,1521173436726493185,@drippydrippyea @AOC Experience ≠ Competence
53,2022-05-02 13:54:59+00:00,1521126106400796673,"@richardhursttho @AOC I am being part of the solution. Circle back with me on November 9th and tell me how well this “Eat the Rich” narrative pans out for us during the midterm elections.

We either fix or distance ourselves from the capitalism hating extreme wing or we will continue to lose ground."
54,2022-04-30 03:18:47+00:00,1520241224434683904,"Uihlein and his wife, Elizabeth Uihlein, the company’s chief executive, have assets worth $4 billion, according to Bloomberg’s estimates. They previously gave $1 million to a political organization that backs Bailey’s campaign.”"
55,2022-04-30 03:18:46+00:00,1520241222916653057,"Another is state Sen. Darren Bailey (R), who has received $2.5 million from Richard Uihlein, the billionaire owner of Uline, a business supply store…"
56,2022-04-30 03:18:46+00:00,1520241221352177664,"Griffin, the wealthiest man in Illinois, lands in 53rd place on Forbes’s list of the wealthiest people in the world, at an estimated $26.7 billion…"
57,2022-04-30 03:18:46+00:00,1520241219947089920,"“One of those candidates, Aurora Mayor Richard Irvin (R), has attracted $20 million in contributions from Ken Griffin, the chief executive of the investment firm Citadel…"
58,2022-04-30 03:18:45+00:00,1520241217514409986,"Welcome to the Land of Lincoln—where governance is increasingly less about substance and everything about how deep your pockets or your friends’ pockets are. 
https://t.co/QcUWg3rMiP"
59,2022-04-30 02:58:32+00:00,1520236127738769408,"@AOC You could just delete your account and create your own platform, but that would take an understanding of business and how the marketplace actually works."
60,2022-04-28 12:04:32+00:00,1519648758136553475,@NikkiHaley No hardworking American should have to personally finance their post secondary education. Period.
61,2022-04-22 12:58:42+00:00,1517488061310984195,Considering he’s done more for the people of Ukraine than most political hacks out there—I’ll accept the label. Haters are gonna hate. People that make shit happen don’t have time for that.
62,2022-04-22 12:58:41+00:00,1517488058970644480,"I’ve been called a Musk fanboy. I don’t care that he routinely triggers the reactionary rage machine and doesn’t pass every progressive litmus test. 
https://t.co/SfSY7yVZg3"
63,2022-04-21 19:17:48+00:00,1517221077222580227,@PatrickMurphyPA Congratulations @PatrickMurphyPA! Keep fighting for us and our future.
64,2022-04-08 02:35:45+00:00,1512257864336822293,"@RepCawthorn @elonmusk Newsflash: @elonmusk isn’t a fascist, an insurrectionist, or a partisan hack like you. He’s not on your team."
65,2022-04-07 12:37:21+00:00,1512046870973005824,@kylegriffin1 The party connected to McCarthyism  is now connected to Putinism. Bravo GOP! 🙄
66,2022-04-05 16:56:38+00:00,1511387345769095174,@SoCalOrBust Doing more with less and trying to solve every problem nail with a military hammer only works for so long.
67,2022-04-05 00:32:00+00:00,1511139556476977152,"@laurenboebert @elonmusk Call me crazy, but I don’t think @elonmusk is pro-fascist. I’d love to know what he really thinks about you and I got a hunch you won’t like it."
68,2022-03-31 19:04:52+00:00,1509607678175289353,@Hooshfest @mchooyah We didn’t have monsters. The GWOT was fueled by these. https://t.co/g66uTfx2TW
69,2022-03-31 19:01:45+00:00,1509606893261664265,@EarthConcepts @mchooyah I’m simply pointing out hypocrisy one fake outrage at a time. https://t.co/lg5d3z8L0S
70,2022-03-30 23:21:39+00:00,1509309912454676486,"@mchooyah If it was a punisher skull, but blue and yellow would that trigger you more or less?"
71,2022-03-19 19:57:39+00:00,1505272305949229056,@joncoopertweets Russias’s ministry of propaganda would and probably does.
72,2022-03-19 19:54:52+00:00,1505271608159707145,…So total Canadian imports have grown by more than double the amount XL would have carried.”
73,2022-03-19 19:54:52+00:00,1505271606645506050,"“The amount of oil that would have flowed through XL, 830,000 barrels per day, equates to about 303 million barrels per year. From 2008 to 2021, Canadian oil imports to the United States rose by 672 million barrels per year…"
74,2022-03-19 19:54:51+00:00,1505271605202673668,"Facts—regardless of how inconvenient they are to one’s narrative—should drive policy—not emotional knee jerk reactions fueled by bias. 
https://t.co/3MCIW8CjOF"
75,2022-03-13 02:43:25+00:00,1502837707428483075,@SoCalOrBust WTF is wrong with that guy?
76,2022-03-13 01:09:57+00:00,1502814186556035078,"It was a cold, but fun filled morning with my fellow St. Clair County IL Democrats! Getting together with good friends and hitting the streets again was just what 2022 needed. Happy St. Patrick’s Day a few days early! ☘️ https://t.co/KDi6nmiOFd"
77,2022-03-04 23:08:02+00:00,1499884399558635520,Petitions are due tomorrow morning. If you live in Freeburg Precinct 1 or St. Clair County Board District 21 and would like to sign my petitions—please shoot me a message. I’ve also got petitions for all endorsed county and state wide candidates as well. It’s time to get to work! https://t.co/gpWtZ7Kfes
78,2022-03-03 20:28:03+00:00,1499481754180198405,@RepBost plays politics—that’s all he’s done most of his life. He’s a careerist and loves pretending he cares about fiscal discipline when it fits his narrative. If you want war you better be prepared to pay the costs—especially the ones shouldered by those that actually fought.
79,2022-03-03 20:28:03+00:00,1499481751873363970,"As a veteran that lived downwind of burn-pits and flew through their toxic clouds throughout Iraq—I am deeply disappointed by this development, but am not surprised. 

https://t.co/k2P37a5OOH"
80,2022-03-02 21:54:21+00:00,1499141081132376069,"The hypocrisy and irrationality couldn’t be more apparent. 

And we wonder why rural America isn’t voting for democrats anymore.

As for me—I’ll be keeping my AR-15 and defending my family and flock from four legged predators and two legged fascists with it."
81,2022-03-02 21:54:20+00:00,1499141079924457475,This prohibition obsession is ridiculous especially now with what’s going on in the world. I see the same people applauding Ukraine for arming their people to fight fascists with fully automatic weapons mock Americans for owning semiautomatic rifles.
82,2022-03-02 21:54:20+00:00,1499141078473183234,"Cute joke, but it’s not funny. A shotgun with the right ammo will do more damage than an “assault rifle.” The vast majority of gun deaths are committed by semiautomatic, more prolific, and much cheaper handguns. 
https://t.co/fGXh7bNr5Y"
83,2022-03-02 17:43:25+00:00,1499077931502608386,"The Russian people have a history of cutting off the head when they are marched off to their deaths and humiliated in war while they suffer at home. 

""We were told we would be greeted with open arms, but they call us fascists.”"
84,2022-03-02 17:43:24+00:00,1499077929913012225,"I know that Russia is a kleptocratic fascist dictatorship with a make believe democratic process, but I don’t see how Putin recovers from this.
https://t.co/MtBvNSZ9pU"
85,2022-03-01 17:33:41+00:00,1498713096470384644,"""But at the same time he's being compelled by God. He went into Ukraine, but that wasn't his goal. His goal was to move against Israel, ultimately."""
86,2022-03-01 17:33:41+00:00,1498713094893228037,Praying for the end of the world is the surest way to bring it about. This fight isn’t preordained. That’s fatalism and at its heart is defeatism. Pat isn’t helping. Don’t be like Pat.
87,2022-03-01 17:33:40+00:00,1498713093278474244,"The only thing sadder than this loon coming out of retirement to run his falsely prophetic mouth is the fact that Putin can’t even afford to pay him for the propaganda services. Putin deserves zero justification for the horrors he’s unleashed.
https://t.co/bfYllT16oc"
88,2022-02-28 17:17:33+00:00,1498346646610055170,"Putin: I do what I want. I’ve got nukes!

The Free World: Hold my beer while I erase your economy. 
https://t.co/i4vJmArNf1"
89,2022-02-28 14:12:44+00:00,1498300135792590850,@AdamKinzinger It’s working out about as well as his vacation to Mexico did.
90,2022-02-28 05:45:16+00:00,1498172428169658372,The Red Army annihilated Hitler’s forces when they underestimated the weather. Eight decades later and the same mud is stopping another fascist pig. This is why you pay attention in history class kids. https://t.co/EnsGESnkk0
91,2022-02-27 20:50:24+00:00,1498037826411274242,This is pure awesomeness! https://t.co/1nPX3ddNxn
92,2022-02-27 20:49:53+00:00,1498037696538853385,@AdamKinzinger This is epic!
93,2022-02-23 13:57:22+00:00,1496484330490716164,@JackMurphyRGR It may be worth asking—when did Tucker become a fascist dictator fanboy?
94,2022-02-23 04:18:09+00:00,1496338564765954048,"“‘I knew Putin very well. I got along with him great. He liked me. I liked him,’ Trump said. ‘I mean, you know, he's a tough cookie, got a lot of the great charm and a lot of pride. But the way he — and he loves his country, you know? He loves his country.’”"
95,2022-02-23 04:18:08+00:00,1496338563197247488,"Fascists flock together. Turn the clock back about a century and ask yourself if the same man would praise the occupation of the Sudetenland. The parallels are uncannily similar. 
https://t.co/MeGahuBh2m"
96,2022-02-21 23:45:33+00:00,1495907576659202049,"and sooner or later the chief of some prevailing faction, more able or more fortunate than his competitors, turns this disposition to the purposes of his own elevation, on the ruins of Public Liberty.”"
97,2022-02-21 23:45:32+00:00,1495907570573352971,"But this leads at length to a more formal and permanent despotism. The disorders and miseries, which result, gradually incline the minds of men to seek security and repose in the absolute power of an individual;…"
98,2022-02-21 23:45:30+00:00,1495907562407006211,"“The alternate domination of one faction over another, sharpened by the spirit of revenge, natural to party dissension, which in different ages and countries has perpetrated the most horrid enormities, is itself a frightful despotism…"
99,2022-02-21 23:45:26+00:00,1495907546011475970,"Today is a day we should reflect on those that came before us and fought to form a more perfect union. The work isn’t done and the threats to our great experiment in self government are no less pressing. 

Happy #PresidentsDay! 

https://t.co/8bcU8xeMrP"
