,Created at,User ID,Text
0,2022-06-27 14:40:56+00:00,1541431389345546240,Buddy Bobby Lord Mayor must step up and tell Biden to STOP printing money to stop the Biden inflation. Bobby tell us you will vote to shut Biden inflation money printing presses. Tell us you’ll vote down 10% inflation &amp; no-oil-drilling $7.00 gas prices. Tell us Drill Baby Drill.
1,2022-06-27 14:36:09+00:00,1541430188256333824,“…The Prices are Too Damned High…” Buddy Bobby Lord Mayor must address this #1 concern in my USCongress District 42. The voters want “THE Family Man” Trustee Briscoe to stop the Biden money printing press NOW! My voters are tired of 10% inflation and $7.00 gas prices.  Step Up!
2,2022-06-26 22:57:12+00:00,1541193892082491392,@Michele714 @RobertGarcia Yup. Buddy Bobby Lord Mayor!!!
3,2022-06-25 23:28:04+00:00,1540839270268645377,"@LongBeachMayor @LongBeachParks @CindyAllenLBC Buddy Bobby Lord Mayor NO NO NO~thank the hard working taxpayers of our LBCity who paid for the fun &amp; frivolity. Parks &amp; Rec did not pay for water park. TAXPAYERS paid for every single last thing in this city. And half our residents pay NO income tax at all, not a cent. Go figure"
4,2022-06-25 16:00:01+00:00,1540726517566537731,Buddy Bobby Lord Mayor you must confess…….this is the United STATES of America. Each STATE is sovereign over itself; if ya don’t like the STATE rules move! You must confess you have NO say telling your hated nemesis TX how to run their state for their residents. Focus on CA!
5,2022-06-25 15:16:37+00:00,1540715596215595010,"@RobertGarcia Buddy Bobby Lord Mayor you must tune up your game! PLEASE focus on the #1 voter concern: Biden inflation!
“…The Prices are Too Damned High…” Trustee Briscoe is the education Congressman focused on Parent Rights &amp; Family Safety. You must stop the Co-Ed boys/girls Wilson showers!"
6,2022-06-25 00:13:49+00:00,1540488396732129280,@LongBeachMayor Buddy Bobby Lord Mayor tell the truth. You speak for LBCity residents and the extreme wing of your party. You have said you represent democrats. Trustee Briscoe represents ALL voters including Independents &amp; moderate Democrats. Bobby you are too extreme for USCongress District 42
7,2022-06-24 23:59:25+00:00,1540484772866142210,@RobertGarcia Buddy Bobby Lord Mayor you know nothing is changing in CA abortion laws. Everything same with most wide open access in US. Are YOU contemplating restrictive CA changes; do you plan to reduce access?? Is your protest against your own state? Or you minding the business of Texans?
8,2022-06-24 23:53:17+00:00,1540483228410060800,"Buddy Bobby Lord Mayor PLEASE spread the word that Monkey Pox is a singular community disease spread at this time easily controlled by a vaccine. Bobby, tell the community , “…take the shot if yer gonna take the risk…” please be as diligent about Monkey Pox as your COVID claims"
9,2022-06-22 14:36:05+00:00,1539618231664537601,"@MartinA41573803 The LBPort is a separate utility from LBCity municipal operations. LBCity cannot “profit” from harbor ops, only charge for admin overhead expense in city. The port provides jobs and some city income. Bargaining unit is the shipping owners vs. port unions, they negotiate/bargain."
10,2022-06-22 04:49:50+00:00,1539470696023093248,Long Beach harbor is one of the busiest in the world &amp; is the gateway of most imports with L.A. The harbor is run by the Harbor Commission packed with political appointees. These political folks must run the place for maximum supply chain efficiency. The nation is depending on em
11,2022-06-22 04:41:04+00:00,1539468487550066689,LBCity Section 8 HUD rules require their rent subsidized tenants be charged AVERAGE rent in each zip code. Buddy Bobby Lord Mayor is refusing to obey federal rent rules. Bobby is cheating tenants out of access to great housing. He’s forcing poor people into downtown poverty!
12,2022-06-19 21:57:44+00:00,1538642212757442560,"Happy Fathers Day from the USCongress 42nd candidate Trustee John Briscoe. 
THE Family Man…..with children…..wife 47 years….and weekly church worship!  He’s One of Us!"
13,2022-06-19 03:47:09+00:00,1538367755409166336,"@RobertGarcia Buddy Bobby Lord Mayor MUST negotiate in good faith with LBCity employees to pay a living wage = +10% inflation raise TODAY! Workers Unite, don’t get cheated outta your pay from Biden inflation. Vote Briscoe USCongress 42. Get your raise today!"
14,2022-06-19 03:43:11+00:00,1538366757433331713,@RobertGarcia Buddy Bobby Lord Mayor is too extreme radical telling us he represents only Democrats. Trustee Briscoe is THE Family Man! representing Independent &amp; moderate Democrats……John Briscoe = He’s One of Us!
15,2022-06-18 00:30:49+00:00,1537955959997227009,@clarkwilliams1 @lunaforsheriff Buddy Bobby Lord Mayor &amp; Chief Luna are too extreme radical. Vote for sane moderate common sense candidates like THE Family Man Trustee Briscoe in November!
16,2022-06-18 00:28:32+00:00,1537955384895279105,@lunaforsheriff @AP Chief Luna is a man who knows how to take STAND DOWN orders from Buddy Bobby Lord Mayor. Have officers watch Metro looters &amp; rioters ride into LBCity to Burn-Baby-Burn!! Luna&amp;Bobby are too extreme radical. Vote common sense Family Man Briscoe in November.
17,2022-06-16 17:10:27+00:00,1537482751443537920,"Buddy Bobby Lord Mayor read our USHistory. Progressives are the CA Republicans who passed initiative &amp; recall laws in 1920s. Trustee Briscoe is THE Common Sense Progressive for freedom, liberty &amp; right to have a small businesses. Vote John Briscoe November."
18,2022-06-16 17:01:20+00:00,1537480454558797826,"Buddy Bobby Lord Mayor look at your unused traffic infrastructure. EMPTY bike lanes. EMPTY buses. EMPTY Metro cars (except homeless). All EMPTY, unused &amp; very expensive PLA Prevailing Wage built. Common Sense Progressive Trustee Briscoe says, “…The Prices are Too Damned High…!"
19,2022-06-16 16:56:38+00:00,1537479273652465664,@RobertGarcia Buddy Bobby Lord Mayor fails our USCongress residents with his FAILURE to recognize “…The Prices are Too Damned High…” Biden +10% price increases are killing our families. We don’t need cute empty bike lanes~we need groceries we can afford! Vote Family Man Trustee Briscoe NOV!!
20,2022-06-16 16:34:47+00:00,1537473774856986624,Buddy Bobby Lord Mayor of LBCity is too radical &amp; extreme for the common sense voters ~USCongress 42. Say NO to Biden New Green Deal. NO more abortion clinics. Moderate Trustee Briscoe is the right fit for our 50% Hispanic Family Man district! Vote John Briscoe in November 2022!
21,2022-06-14 22:32:07+00:00,1536838923908878337,"@LongBeachMayor Buddy Bobby Lord Mayor PLEASE give the people what they want! The kids need flat rectangular play fields for soccer, lacrosse, field hockey &amp; football. LBCity is bereft of what team sports require &amp; it ain’t cute swing sets! Use bond $ for needed youth play infrastructure today!!"
22,2022-06-12 20:58:52+00:00,1536090683894734849,"@YnotDebPauly Dear Deb:
Do you have any contacts with Tom Fitton???
Judicial watch.  Thx."
23,2022-06-12 20:56:06+00:00,1536089984905510913,"@lopez4congress @Loco4LongBeach @RobertGarcia Well yes!
Of course.  The Nicole option!!!
But make your vote really count. Vote for Trustee Briscoe!!!"
24,2022-06-12 17:02:01+00:00,1536031078263058432,"@lopez4congress @Loco4LongBeach @RobertGarcia The man CLEARLY said “…don’t vote for Garcia…”
What about his post is unclear?
What He Said. 
If not Buddy Bobby then it must be that moderate 4 times re-elected Trustee John Briscoe."
25,2022-06-12 16:59:08+00:00,1536030350412898306,"@lopez4congress @Loco4LongBeach @RobertGarcia He said don’t vote for Buddy Bobby Lord Mayor ……… leaving that kind hearted Trustee Briscoe!
Vote for John Briscoe THE FAMILY MAN ……. and only moderate in the race for USCongress 42!!"
26,2022-06-12 16:15:21+00:00,1536019334069334016,@Loco4LongBeach @lopez4congress @RobertGarcia What He Says:   don’t vote for Garcia. Vote for the June primary winner Trustee Briscoe USCongress 42 in November.  THE FAMILY MAN!  “…The Prices are Too Damned High…” we can’t survive with $7.00 gasoline &amp; 50% higher food prices. Everybody a +10% raise NOW for the inflation!!!
27,2022-06-12 15:45:23+00:00,1536011793310437376,"Buddy Bobby Lord Mayor pay your LBCity employees a living wage today! You don’t need to wait for negotiations, City can unilaterally pay employees more whenever anytime. Pay +10% more just to keep workers even. Help them pay for $7.00 gasoline with a 10% living wage increase NOW!"
28,2022-06-12 15:40:37+00:00,1536010594133807110,Buddy Bobby Lord Mayor will be Mayor no more but he’s Mayor NOW. Bobby you must give all LBCity employees an immediate +10% raise NOW to make up for lost buying power due to inflation. YOUR employees have a -10% pay cut if you don’t act immediately! Pay LBCity a living wage today
29,2022-06-12 15:36:28+00:00,1536009546409185282,Buddy Bobby Lord Mayor is wondering how to beat Trustee Briscoe…THE FAMILY MAN in November. Bobby must leave his expensive mansion and visit ordinary people having to pay extraordinary inflation prices. Bobby: “…The Prices are Too Damned High…” Please listen to my voters!!
30,2022-06-12 15:31:32+00:00,1536008306732322816,Buddy Bobby Lord Mayor stated his priorities. They don’t include “…The Prices are Too Damned High…” REALLY!  The single most important thing on all minds is how to pay for $7.00 gasoline? How to pay for $8.00 per pound hamburger &amp; 50% higher food prices. Bobby has no concerns!
31,2022-06-12 00:37:31+00:00,1535783319161274369,@Susan_Shelley Well yes!  It’s a parcel tax. Manhattan Beach voters ain’t stoooopid!
32,2022-06-12 00:26:21+00:00,1535780510676373504,"@RobertGarcia @POTUS Buddy Bobby Lord Mayor hopes @POTUS is a better vote soothsayer than inflation manager who told us 10% price increases were false, transitory, “just a little”, finally “inflation is good, everybody gets a raise”…a raise in prices like $7.00 gas! “ThePrices are Too Damned High”"
33,2022-06-12 00:19:34+00:00,1535778801375817728,"@RobertGarcia @lunaforsheriff Buddy Bobby Lord Mayor wants a sycophant for sheriff. Bobby wants a man who does what he’s told including STAND DOWN! orders to let LBCity burn baby burn! Luna made his officers watch rioters get offa Metro to rob, pillage and loot. NO to the Luna &amp; Bobby cabal of criminal mayhem"
34,2022-06-10 04:38:01+00:00,1535119067287195648,Ladies &amp; Gentlemen: Buddy Bobby Lord Mayor won 44% of the vote on a microscopic turnout + energized Long Beach friends. Only 25% of Republicans bothered to vote. AGH! Briscoe will earn moderate Democrat+Independent votes to get 50% in November. Vote Moderate Briscoe in November!
35,2022-06-10 04:33:41+00:00,1535117978575941633,Buddy Bobby Lord Mayor and his foul “F” word potty mouth on FB is a danger to children. What kind of man thinks it’s OK to use four letter expletives on a social media used by kids?  Trustee Briscoe is The Family Man! He’s one of us! Vote Briscoe November.
36,2022-06-10 04:28:34+00:00,1535116688303063040,Buddy Bobby Lord Mayor is too extreme for USCongress 42. Bobby promises to represent only Democrats. Trustee Briscoe represents more Independent &amp; moderate Democrats than Republicans (only 16% in 42). “…The Prices are Too Damned High…” Don’t let Bobby distract you. Vote Briscoe
37,2022-06-09 22:20:01+00:00,1535023940984512512,"@LongBeachMayor @LBCityCollege Congratulations to all graduates. Bobby &amp; I both instruct at CSULB. We know the life and work and time you invest to earn your degree!
Now that you’re out you’ll have lots of time ti vote for Trustee John Briscoe in November!!!"
38,2022-06-09 14:13:42+00:00,1534901553236041728,"@RealOmarNavarro Congrats!!!
The voter turnout count is so small we can both knock on every door literally. I also won in the 42nd!!!
I plan to represent ALL residents not just democrat voters as my opponent Buddy Bobby Lord Mayor says he will do !!"
39,2022-06-09 12:53:02+00:00,1534881253236715522,@Redistrict @CookPolitical Buddy Bobby Lord Mayor was anointed to run against Christina by all the media including a LATimes article that failed to mention any other candidate besides the Garcias. WRONG! Briscoe prevailed. As he’ll do November for ALL voters not just Democrats. Vote for Briscoe!!!
40,2022-06-09 04:47:10+00:00,1534758981016510464,@DemMaj4Israel @RobertGarcia Buddy Bobby Lord Mayor has won top spot against education candidate Trustee Briscoe. It is a battle between partisan extremist Democrat party only Bobby and the moderate Briscoe serving ALL voters including Independents &amp; Democrats too. I earned more Dem&amp;NPP votes then Republican
41,2022-06-09 01:44:53+00:00,1534713110623158272,@sarasadhwani @MekahloNBCLA @RobertGarcia @AsmGarcia @NBCLA Trustee Briscoe earned half his votes from Democrat &amp; No Political Party voters. Briscoe represents ALL residents not a narrow parochial single party like Buddy Bobby Lord Mayor. “…The Prices are Too Damned High…” Vote Briscoe in November!!
42,2022-06-09 01:41:47+00:00,1534712329895497730,"@MekahloNBCLA @RobertGarcia @AsmGarcia @NBCLA For the record Trustee Briscoe was not “surprised” at his historic win. The district is 50% Democrat registration, only 16% Republican. Briscoe earned half his votes from Democrat &amp; No Party voters! Briscoe represents ALL residents not just one narrow party. Vote Briscoe in Nov!"
43,2022-06-09 01:27:43+00:00,1534708787474583558,@RobertGarcia Buddy Bobby Lord Mayor is running to represent his extreme version of democrat party only politics. Trustee Briscoe is running to represent ALL party &amp; NO political voters! We ALL join Briscoe say’n “…The Prices are Too Damned High…” no more $7.00 gal gas &amp; 50% + food prices!!
44,2022-06-08 13:38:23+00:00,1534530277740904450,@Click_CA @RobertGarcia @USProgressives @HispanicCaucus @LGBTEqCaucus Watch no more! Trustee Briscoe has earned the votes and hearts of the district to be on the November ballot. “…The Prices are Too Damned High…” Briscoe is the Family Man. Fighting for Paarnt Rights &amp; Family Safety. Vote for John Briscoe In November.
45,2022-06-08 13:32:59+00:00,1534528920539672576,"@Elex_Michaelson @RobertGarcia Not really……..
Buddy Bobby Lord Mayor must face the fact that 56% of the voters voted NO to his campaign. It does not take a village to raise a candidate. It takes 50%+one vote. My job is to bring over the 56% that said NO. Vote Trustee Briscoe in November!"
46,2022-06-08 13:22:45+00:00,1534526347220881408,@EricPierceFTW The vote of little value relates to Buddy Bobby Lord Mayor….not the overall act of voting.
47,2022-06-08 13:21:00+00:00,1534525903446810626,@cacollegegop Well……thank you indeed!
48,2022-06-08 00:36:37+00:00,1534333542708088832,"@JarredCuellar @RobertGarcia I recommend you vote for Trustee John Briscoe TODAY!!
The Family Man. “…The Prices are Too Damned High…”, Parent Rights, Family Safety.  Vote Briscoe for your better future!"
49,2022-06-08 00:31:06+00:00,1534332153126846465,"@lbtransit Buddy Bobby Lord Mayor knows TANSTAAFL….there ain’t no such thing as a free lunch….
The bus rides are not free. We taxpayers are paying for them to drive around most of the time 85% empty. Bobby’s brilliance! Let’s fill the empty buses at least one day with free rider voters!"
50,2022-06-08 00:24:50+00:00,1534330575443529728,"@EricPierceFTW Who is gonna pay for yet another holiday off???
The voters ?
Oh!  
You want employers to subsidize citizen voting rights!!!  Sad Sad Sad day when voting has do little value. Add value to your vote!! Vote for Trustee John Briscoe today!!"
51,2022-06-08 00:21:01+00:00,1534329617149964289,@lamoonfacedgirl @RobertGarcia Buddy Bobby Lord Mayor will be doubly delighted when you vote for Trustee Briscoe! The Family Man. He’s One of Us. The education candidate 16 years re-elected school board. Family Safety. Parent Choice. Everything you want for your children &amp; grandchildren. Vote Briscoe today!
52,2022-06-08 00:16:39+00:00,1534328518695342081,@RobertGarcia @nytimes Buddy Bobby Lord Mayor is once again coddled and beloved by Fake News New York Times. The NYT = article no mention of Trustee Briscoe. PPP…..Hiss Poor Paper with no investigation when Trustee Briscoe wins the primary along with Bobby. How many other NYT stories are as shoddy??
53,2022-06-07 05:41:25+00:00,1534047860328566784,"@RobertGarcia @SenGonzalez_33 @MaryZendejasLB Buddy Bobby Lord Mayor advocates high density low income tiny apartment ghettos. Look at Bobby’s city in the background. Giant city blocks of towering acres of apartments with mary a tree in sight, Lord Mayor where’s our green tall tree canopy to shade and shield us? Not LBCity!!"
54,2022-06-07 05:35:53+00:00,1534046468310388737,"@RobertGarcia @ZoeLofgren Buddy Bobby Lord Mayor represents only the most extreme and far out political positions. Bobby proudly trots out his out-of-touch viewpoints. The Family Man, Trustee Briscoe represents independent and moderate residents. He is one of us!  Vote John Briscoe Tuesday!"
55,2022-06-07 05:30:07+00:00,1534045013822164993,"@RobertGarcia Buddy Bobby Lord Mayor needs to learn US history. Teddy Roosevelt invented “Progressive”….1920s CARepublicans installed initiative, recall Progressive programs. YES! Bobby is promoting Republican programs and concepts. Life, Liberty, Right to Property=the new Lord Mayor!!!"
56,2022-06-05 02:45:03+00:00,1533278697985175552,"@RobertGarcia @david_darmofal @_photocam Buddy Bobby Lord Mayor is apparently unable to express himself without foul potty mouth expletives. SHAME. Bobby, minor children read Twitter. Trustee Briscoe is the education candidate, he cares about children , he’s the FAMILY man! Shut the foul pie hole please, for the kids."
57,2022-06-04 22:07:17+00:00,1533208794997501952,@LongBeachMayor @MaryZendejasLB @DLBA @RecordBoxTruck Buddy Bobby Lord Mayor is taking a grand tour of his devastated riot burned downtown LBCity. Plus Bobby’s using his graffiti filled public park in his TV commercial. Bobby has followed his hero Gascon leading us to crime and ruin. People hated his “stand-down” order. Agh!!
58,2022-06-04 05:09:57+00:00,1532952775587291137,"@435_project @AjaforCongress @RepYoungKim @RealOmarNavarro @RepSteel @amyphanwest @ErrolWebber @brianlmaryott Ohhhhhh……. Now I see. By virtue of odd cell phone screen display my phone provided a display that put CA42 next to Navarro. Honorable John Briscoe, Trustee…..is the candidate for Congress 42. This post suggests another candidate. You were &amp; are correct. On to victory both!!"
59,2022-06-02 23:05:58+00:00,1532498790287958018,"@LongBeachMayor Buddy Bobby Lord Mayor &amp; Trustee Briscoe agree on few items, except we both agree GET the jab! Get your Covid shots to avoid serious illness on breakthrough Covid. Increase your chance of a healthy &amp; wealthy life with full vaccination of all family members. Bobby &amp; Briscoe agree!"
60,2022-06-02 23:00:57+00:00,1532497524895780870,"@RealOmarNavarro Dear fellow traveler,  the listing I saw had 42, just say’n. I know and you know we are 42nd and 43rd. Just did not want voters to get confused searching all over where to vote for YOU…………and of course……..me! Onto victory June 7!!"
61,2022-06-02 16:13:08+00:00,1532394895825985540,"@RobertGarcia Buddy Bobby Lord Mayor wants a British/German single sole unilateral rule making body=one size fits all country. No room in Bobbyland for individual States Rights and opinions. Only Bobby’s way or the highway from D.C. No Lord Mayor, you do not get to dictate everybody!!"
62,2022-05-30 04:14:05+00:00,1531126779837964288,@RobertGarcia Buddy Bobby Lord Mayor has bad science facts. Cloth face diapers &amp; cheap paper masks that filter down to 3 microns when COVID is a tiny 1 micron count as “science” to our Bobby. He wants useless face diapers &amp; schools closed again. STOP Bobby’s voodoo hysteria. Science only!!
63,2022-05-29 21:44:55+00:00,1531028841589723136,@435_project @AjaforCongress @RepYoungKim @RealOmarNavarro @RepSteel @amyphanwest @ErrolWebber @brianlmaryott The Aja Smith post clearly said 42.  Clearly an error by Aja. I just do not want anyone confused. I need every single bite possible. Only 16% Republican  district!!!
64,2022-05-29 19:01:25+00:00,1530987695547133952,@TonyVPessolano @435_project @AjaforCongress @RepYoungKim @RealOmarNavarro @RepSteel @amyphanwest @ErrolWebber @brianlmaryott I believe I saw 42…….and yes I need every single vote I can garner running against Buddy Bobby Lord Mayor &amp; the termed-out ten too-long-years-in-office Assemblywoman Christina Garcia. “….The Prices are To Damned High!….” vote for Trustee John Briscoe June 7 &amp; November 3 ! ! !
65,2022-05-29 02:33:11+00:00,1530738998561284096,"@ErrolWebber Errol:  l live in HBCity and see your sign all over. It’s hard for me to read your “W” in the name. Is it razor blades to symbolize tax cuts? It almost looks like a piece of film. Just say’n. Too late to change for 7 June, but consider for November."
66,2022-05-29 02:29:41+00:00,1530738118864736256,@DLBA DTLB is Buddy Bobby Lord Mayor’s pet project. DTLB is a scam to make business owners pay extra taxes for services LBCity should provide free. Bobby wants to make everybody pay extra for special assessment districts! This is guaranteed when Bobby gives all employees a 10% raise!!!
67,2022-05-28 03:36:42+00:00,1530392592763920384,@435_project @AjaforCongress @RepYoungKim @RealOmarNavarro @RepSteel @amyphanwest @ErrolWebber @brianlmaryott Al Navarro is NOT. NOT. NOT a candidate for USCongress 42nd District. Trustee John Briscoe is the single sole and only Republican on the ballot. “…The Prices are Too Damned High!…” vote Briscoe June 7th #2 in the ballot!!!!!
68,2022-05-27 17:12:10+00:00,1530235426526867456,"@LongBeachMayor @RobertGarcia @DLBA Buddy Bobby Lord Mayor:  pay your city employees an immediate +10% raise TODAY to make-up for the Biden-Harris inflation.  If you fail to raise all LBCity wages +10% you have failed the living minimum wage test.  Stop stealing employee wages by not paying +10% today, here and NOW"
69,2022-05-27 17:10:22+00:00,1530234973403242498,"@LongBeachMayor @RobertGarcia @DLBA Buddy Bobby Lord Mayor, Downtown LB DLBA is a special taxing assessment district whereby business owners are stuck with higher tax bills to keep streets cleaned.........and now apparently fun &amp; frivolity too!  I pay extra taxes on two separate commercial units; should be free!"
70,2022-05-24 17:38:43+00:00,1529154944888197125,"@RobertGarcia Buddy Bobby Lord Mayor: there is no filibuster in the House of Representatives you are running for, not a single word of it for the House. Constitution DOES say the Senators can make up their own rules of conduct.  Those rules call for cloture. Buddy Bobby: run for Senate!!"
71,2022-05-24 17:31:41+00:00,1529153172446384133,"@melissajoifox @RobertGarcia The LATimes endorsed Buddy Bobby Lord Mayor for Congress 42 without a mention of the other six candidates. FAKE RIGGED NEWS!  LATimes never called the campaigns or apparently even looked at websites, but you can and should: https://t.co/DKjSWL2wfD"
72,2022-05-24 17:22:31+00:00,1529150867391188992,"@RobertGarcia Buddy Hobby Lord Mayor is posturing &amp; virtue signaling again. Pregnancy termination &amp; birth control access could not be more open. In CA there=no change. Don’t let Bobby distract you!! Trustee Briscoe says, “…The Prices are Too Damned High!…” make Bobby pay LBCity workers +10%."
73,2022-05-24 00:33:39+00:00,1528896978909732864,"@RobertGarcia @lgbtequalitypac @BOLDDems @electprogress @LALabor @CaliforniaLabor Don’t be distracted by Buddy Bobby Lord Mayor. Trustee Briscoe says, “…The Prices are Too Damned High!…”
It’s all about inflation ripping 10% outta your paycheck. Let’s see Lord Mayor give all his LBCity employees the +10% raise they need just to stay even!!!"
74,2022-05-24 00:30:04+00:00,1528896076983324672,"@WaysandMeansGOP @HouseGOP Trustee Briscoe says, “…The Prices are Too Damned High!…”"
75,2022-05-22 00:37:48+00:00,1528173247472078848,"@LongBeachMayor @RobertGarcia @LBFD Buddy Bobby Lord Mayor must demand new LBFD recruits be trained on statutory duty to inspect, cite, enforce ALL health, safety, fire codes in LBUSD. LBFD does not. Children are in unsafe, unsanitary, and illegal facilities due to HizHonor failure to supervise our LBFD. FAILURE!"
76,2022-05-22 00:29:35+00:00,1528171177188831232,"@RobertGarcia @LALabor @CaliforniaLabor Buddy Bobby HizHonor Lord Mayor must be advocating for a fair living wage for all his union supporters. YES to a universal +10% raise for all union workers to make up for Biden-Harris inflation. 
“…The Prices are Too Damned High…” Dear Bobby say it: +ten percent now for all ! !"
77,2022-05-22 00:25:29+00:00,1528170146291847168,"@RobertGarcia @MayorPTflores @DeniseLopezDiaz @lizfromsela @JRGonzalezSELA Buddy Bobby HizHonor Lord Mayor must immediately pay his city employees +10% more wages to make up for ten percent stolen from paychecks by Biden-Harris inflation:
“…The Prices are Too Damned High…”
Bobby, pay LBCity workers what they’re worth!"
78,2022-05-22 00:11:14+00:00,1528166560027660288,"@LongBeachPost Buddy Bobby HizHonor Lord Mayor has left a trail of tears and broken burned businesses from his failure to stop the fire bomb rioters. Police told to stand down watched metro line looters flood LBCity with evil on their minds, burn baby burn!!!"
