,Created at,User ID,Text
0,2022-04-29 15:50:43+00:00,1520068068218707969,"People who take out college loans are largely from the middle class &amp; up, not the poor. If I had a vote, I'd say skip the college loan forgive idea and use the money for programs for more disadvantaged folks. And, yes, I know how loans feel; took me 13 years to pay off mine."
1,2022-04-06 01:08:20+00:00,1511511086301859843,@Kiserem Possibly. But not too many know about Balch Springs....or who its former council members were.
2,2022-04-05 14:56:43+00:00,1511357168498401284,"Just want to follow up last tweet with a BIG thanks to all my supporters. Love you! And love democracy. It works. BTW, I am signing off this acct. You can follow me at Kathleen Cordelia Bailey for pol views &amp; about my work. Yours truly, KCB"
3,2022-04-05 14:29:13+00:00,1511350247074709505,"I lost the primary. Feels weird ‘cause winner didn’t campaign; rec’d no $, spent no $ (per FEC filings); no speeches, endorsements, or Dem org backing; minimal online presence. Yet got name recognition to get 11k votes. Mysterious to me. -KCB"
4,2022-03-01 15:15:28+00:00,1498678311807029255,"Am upset about Health Protection Act vote not just because I’m pro-choice. Bill never had a chance as written. (And no, Manchin wouldn't have made difference.) If Congress really cares about the issue, present a bill that enshrines Roe."
5,2022-03-01 13:09:45+00:00,1498646677120557060,RT @TXDisabledDems: Our candidates (tagged below) pledged we'll be top of mind &amp; have seats at the table &amp; they need your support! Vote for…
6,2022-03-01 12:40:00+00:00,1498639187377020933,"It’s Election Day! Who are you taking with you to vote in the Democratic Primary before 7 pm today? DM us if you have any questions about casting your ballot!

#OnwardUpward #Election2022 https://t.co/4aV4QMWqxR"
7,2022-02-28 15:09:29+00:00,1498314418362454017,"Some folks have asked me about my past experiences in  US Government working to combat disinformation. You might be interested in excellent set of video reports by The New York Times on the subject. It is from 2018, but is highly relevant today.
https://t.co/gGqzRamNF8"
8,2022-02-28 14:36:43+00:00,1498306172465647617,Costs of school closings have been enormous. Time to restart learning and end family disruption. Most costs being borne less affluent. Most illness now among unvaccinated who choose to accept the risk. Masks are still wise. Let's move forward.
9,2022-02-28 14:25:03+00:00,1498303238378082319,"George Floyd continues to matter in so many ways. Here's some good news: more &amp; more officers trained in best practices, including how to intervene when they know something is plain wrong.
https://t.co/vKv3JJekZV"
10,2022-02-28 14:19:33+00:00,1498301852902899716,"Germany and EU are getting tough. TBH, I didn't expect it, but am grateful that they're bolstering Ukraine and NATO. And the increase in Germany's military spending to 2%? Well, Putin accomplished something no amount of Western political pressure ever did."
11,2022-02-28 14:16:32+00:00,1498301092664385549,"Putin puts nukes on alert; Biden's response: calm. Compare with Trump's blustering ""my button's bigger than yours"" response to N. Korea. Thankfully we have experience, competence, and a steady hand now."
12,2022-02-28 00:06:29+00:00,1498087171785469955,"Thinking about the folks sleeping in subways, soldiers battling uneven odds, proud people assaulted because they chose democracy over tyranny. We should support Ukraine, and help Taiwan ready itself too. Xi may be smarter than Putin, but is just as much an autocrat. https://t.co/yFhcvI1G8Y"
13,2022-02-26 21:14:35+00:00,1497681525722259466,"Black history is American history. Today, I reflect on Freedman’s Cemetery, which memorializes the life &amp; struggles of African-Americans in Dallas. We must ensure our communities have the resources needed to continue to preserve these monuments in the future. #BlackHistoryMonth https://t.co/0DfTAwPcvu"
14,2022-02-26 15:22:13+00:00,1497592846085414912,Thank you! I love the photo. Appreciate the Blue &amp; Yellow too. Solidarity!
15,2022-02-25 22:21:23+00:00,1497335947242917892,Today is the last day of early voting! Have you made your plan to vote yet? #OnwardUpward https://t.co/RE2Nm52aIX
16,2022-02-25 20:57:07+00:00,1497314738711277577,"Voters, it is REALLY important that you hear what Trump and rightwing commentators say about Russian invasion of Ukraine. Trump called Putin ""smart"" and trumpist talking heads echo same. Shameful.-KCB
https://t.co/q4nLfBmlLP"
17,2022-02-25 20:38:26+00:00,1497310036619530240,"Very happy with nominee to fill SCOTUS seat, Ketanji Brown Jackson. She had all the credentials you'd want for such an important role—from Harvard cum laude to public defender and federal judge. And, she's been confirmed by Senate 3 times!!-KCB
https://t.co/Q8i0yXzjlk"
18,2022-02-25 14:16:53+00:00,1497214018246819842,"RT @texasdemocrats: Hoy es el ultimo dia para votar temprano! 🗳 #txlege 

☎️  ¿Preguntas? 1-844-TX-VOTES
📍Averigüe donde votar en: https://…"
19,2022-02-25 00:46:29+00:00,1497010076145565696,An election eve message from https://t.co/IH7NnznXfW. For voting info see https://t.co/dVgO4Gtg46. https://t.co/IVoFEfplpp
20,2022-02-24 23:09:50+00:00,1496985750063271936,There are just 2 more chances to vote in Dem primary election. Tomorrow = last day of early voting; Election Day is March 1. Made your plans yet to vote for Kathleen Cordelia Bailey for US Congress CD-05?? Voting info is at https://t.co/dVgO4Gtg46 or DM us. https://t.co/gx3PKiUVCG
21,2022-02-24 15:17:55+00:00,1496866991344336896,People ask me how to reach more compromise and get Washington to work. Here's an idea in the works. Cornyn wants legislation to support mental health crisis intervention. So do Dems. USA needs this. Let's get it done...together. I know how to work in a bipartisan way! -KCB
22,2022-02-24 15:13:59+00:00,1496865998955290625,"I used to think that Putin had something on Trump that made him subservient. Yesterday T said that P is ""savvy"" for having claimed eastern Ukraine. Truth is that Trump actually admires the authoritarian and his unilateral invasion of another nation. Shameful.-KCB"
23,2022-02-24 15:10:50+00:00,1496865209285324800,"@persisting2017 We talk to lots of farmers on lands of different sizes and outputs. Some problems are same for all; others = specialized. I benefit greatly from understanding issues across all sectors of agriculture because it is so important to USA, and to TX especially. Thanks for reply!-KCB"
24,2022-02-23 21:24:32+00:00,1496596864732385282,"We had a fantastic day campaigning in Mineola, Texas. We looked around the town, checked out some businesses, attended the Kiwanis club chili cook off, and visited a farm to talk about agricultural issues. https://t.co/E0g8uwMWXs"
25,2022-02-22 19:05:17+00:00,1496199431993102346,https://t.co/y0Dkw4ot9b
26,2022-02-22 17:57:03+00:00,1496182261926047748,"Columbia expanded access to abortion yesterday, when Court legalized it up to 24th week of pregnancy. Joins Argentina, Uruguay, Mexico in liberalizing. Texas shamefully continues assault on women's choice and rights to reproductive healthcare.-KCB"
27,2022-02-22 15:45:05+00:00,1496149049510141969,"Remember Texas, Lance Gooden voted AGAINST bipartisan infrastructure bill that provides ≅$5 bn/5 yrs for EV charging stations. And TX is to get largest amount, over $60 m. One more example how Gooden doesn't fight for TX.-KCB
https://t.co/cvlkuUateU"
28,2022-02-22 15:34:29+00:00,1496146384751317003,"Lance Gooden says he ""welcomes"" an Ottawa-style gridlock protest by truckers in Washington DC. Mask mandates are already falling as the country reopens, so why encourage chaos? To disrupt state-of-union speech? Help Putin by redirecting attention? Gooden is no good for USA.-KCB"
29,2022-02-21 04:57:44+00:00,1495623751320444928,RT @LaCreole32: Stand with Kathleen folks.. She has some great ideas &amp; truly love the State of Texas. Don’t vote with ur eyes but with ur b…
30,2022-02-18 22:48:43+00:00,1494806109575647234,Another GREAT Endorsement! https://t.co/YzMeF1qDeG
31,2022-02-18 18:14:51+00:00,1494737188273246212,Great push card! https://t.co/ZVJcTe340m
32,2022-02-18 15:36:51+00:00,1494697429018554371,"Some say that repairing the Electoral Count Act of 1887 is a ruse to keep from passing the Freedom to Vote Act. I disagree. Both=essential, but the ECA is easier &amp; more urgent. We can't allow ""faithless electors"" to determine presidential elections.-KCB
https://t.co/BVsKxS3btZ"
33,2022-02-17 18:10:20+00:00,1494373663554031617,@jlondon81 We're flattered Lance has turned his attention to us prior to the primary. We'll have plenty to say to him when the time comes. We're focusing on our current election right now. &amp; we know he's just trying to deflect attention from the investigation on him for insider trading.
34,2022-02-16 14:30:37+00:00,1493955982044639236,@jhetertainment Thank you!
35,2022-02-14 18:01:27+00:00,1493284264888225792,"RT @texasdemocrats: Early voting for the March 1st Democratic Primary starts TODAY! 🗳

Make your plan to vote to avoid long lines on Electi…"
36,2022-02-13 20:46:59+00:00,1492963537752363012,@melajessi_1 Thanks! We'll DM you.
37,2022-02-13 18:41:09+00:00,1492931867183620099,"100,000+ in US die from overdoses each year, more than car from crash &amp; gun combined. Having experienced a family member’s addiction to oxycontin, I believe most treatments don’t work. I think we should spend more $ on ideas in Stanford-Lancet Commission.
https://t.co/LSKw9uDeHx"
38,2022-02-13 18:15:06+00:00,1492925314833526786,A FABULOUS endorsement! https://t.co/YVbMPJIu7E
39,2022-02-13 16:16:32+00:00,1492895473639829505,"RT @ActiVoteUS: @KCBailey2022 shared her views with voters! Do you believe what she believes? 🗳️🗳️

#plotyourpolitics &amp; find out⁉️
👉 https:…"
40,2022-02-11 22:18:09+00:00,1492261703077216261,"Did you know Kathleen was the first social scientist ever hired by the LLNL?

She served in multiple administrations as a social scientist and is committed to paving a way for other women to become scientists in our government on this #InternationalDayofWomenAndGirlsInScience https://t.co/mnDWMdcuyS"
41,2022-02-11 21:28:03+00:00,1492249096492564480,"We had a great conversation yesterday about the issues that matter most to Texans in CD5 and we look forward to future community discussions.

Check out all of our events and volunteer opportunities at https://t.co/5hqftVhrOT
#OnwardUpward https://t.co/55I4pU3w2j"
42,2022-02-11 19:47:06+00:00,1492223687927414792,@younganimater35 Absolutely! We're happy to answer any questions. Feel free to DM us here! We can also send you our email address over DM if you'd prefer.
43,2022-02-09 16:39:36+00:00,1491451728436559872,"More about the important USPS bill that got 79% of House vote yesterday (120 Repubs joined 222 Dems). Of course, among the 92 nay-sayers was Lance Gooden. Does he want USA to have good mail service? -KCB"
44,2022-02-09 16:29:22+00:00,1491449152332771333,"""The House approved the measure 342 to 92."" Sounds like ancient history to get such support, but it is the margin for the vote on the US Postal Service bill approved yesterday, and there's a bipartisan one in Sen too. USPS is worth saving/improving, so this is a happy story!-KCB"
45,2022-02-09 16:13:15+00:00,1491445096788946946,"I don't often praise McConnell, but I give him credit for speaking out forcefully on RNC ostracizing Cheney &amp; Kinzinger, and for calling 1/6 what it was, a ""violent insurrection"", not ""political discourse"". McCarthy on the other hand... -KCB
https://t.co/PYwrYfWbBH"
46,2022-02-08 23:08:07+00:00,1491187115711168514,"Be like Abbe! Join Team KCB! Sign up now at https://t.co/mY9lxwz827 
#OnwardUpward https://t.co/yTtTOUf8RV"
47,2022-02-08 23:05:30+00:00,1491186455406071810,"RT @txchristabelle: Hey TX 5, you can have a better advocate with @KCBailey2022 as your Congresswoman. Give her a follow and help her out a…"
48,2022-02-08 23:05:03+00:00,1491186341614616577,"Mark your calendar for our East Texas Tour Virtual Meet and Greet with Kathleen Bailey this week!

Bring your questions and meet your next Congresswoman on Thursday, Febraury 10, at 6 pm! We'll send you more information once you RSVP at https://t.co/eFV2mH933Y
#OnwardUpward https://t.co/LvRjw4S5S9"
49,2022-02-07 16:31:27+00:00,1490724900339867648,More endorsements! https://t.co/lc9bed0IcU
50,2022-02-07 14:27:48+00:00,1490693785545760768,"Independent bill on climate part of BBB would be about $555 bn over 10 yrs. Elements: tax credits on alternative energy, subsidies for buying energy efficient devices, infrastructure (improving grids, etc), and R&amp;D on tech to de-pollute. Even Manchin likes it. Let's do it! -KCB"
51,2022-02-07 14:21:57+00:00,1490692309763166216,https://t.co/gxLbnif1cA
52,2022-02-04 21:06:54+00:00,1489707056051494912,Brief Takes: Gun Violence https://t.co/WPNaJ1qQMp via @YouTube
53,2022-02-04 20:04:43+00:00,1489691408407703555,"There is no way that violence and desecration can ever be ""legitimate public discourse."" And Cheney is spot on: Repubs are hostages to trump. Censuring her and Kinzinger is cowardice to Nth degree.https://t.co/MSQpkxTU7v"
54,2022-02-03 16:51:55+00:00,1489280499386355718,"First scientists wrote to object to disinformation on spotify, then some artists followed by taking their music down. Good. We need leadership from all communities to fight disinformation, not just from officials and bureaucracies. -KCB
https://t.co/dek5mdn1x3"
55,2022-02-03 16:41:11+00:00,1489277797499645964,"Sec'y of Army Christine Wormuth says soldiers who refuse vaccination will be dismissed because US readiness depends on soldiers who are ready to fight and who won't jeopardize others. Makes sense. -KCB
https://t.co/NPojgocq40"
56,2022-02-02 15:17:23+00:00,1488894323810783241,https://t.co/I5CPjEMLjo
57,2022-02-01 23:42:04+00:00,1488658940468645896,"To celebrate #BlackHistoryMonth this year, we encourage you to take a trip to Tyler to visit the Texas African American History Museum to see photos, art, and local history. Learn more about the museum and make a donation to help their renovations at
https://t.co/OZOEW4f3af"
58,2022-02-01 16:41:27+00:00,1488553090382905344,Volunteers last weekend ready to go canvassing for Bailey for Congress! We also registered some voters. https://t.co/HgvpSxDoII
59,2022-01-31 14:58:17+00:00,1488164740945915904,"Some 21 candidates who dispute Biden’s victory are running for secretary of state in 18 states, according to States United Action, a nonpartisan group tracking races for secretary of state throughout the country. Work harder, Dems!-KCB
https://t.co/8aKB38iFzK"
60,2022-01-31 14:52:34+00:00,1488163302442160129,"Last week Trump criticized bipartisan effort to fix Electoral Count Act. He wants to use it again to manipulate elections. Dems must not waste time and shouldn't hold the fix hostage to anything. Don't use it as bargaining chip, Dems. -KCB"
61,2022-01-31 14:49:20+00:00,1488162489904807936,"Trump now says he may pardon the 1/6 rioters if he is re-elected. Says they're being treated ""unfairly"". We need to everything possible to keep this man and his minions out of power. Focus, Dems, Focus! -KCB"
62,2022-01-28 21:28:34+00:00,1487175792635305985,"It’s the last weekend to register to vote! Can you help us reach new voters in CD5?

We hope to see you at our Kaufman County Voter Registration Rally tomorrow, Saturday, January 29 at 10 am!

https://t.co/Z00qh3XUB6"
63,2022-01-28 19:54:29+00:00,1487152116171001859,"@jhetertainment Yes, I hear that a lot! And, yes, I will do my best to unseat him. Thanks for your interest."
64,2022-01-28 19:01:42+00:00,1487138835771363338,"RT @txchristabelle: Hey TX 5, do not count Kathleen out just because of redistricting, there is plenty of people unhappy with Lance. Give h…"
65,2022-01-26 22:06:07+00:00,1486460469057630212,Another GREAT Endorsement! https://t.co/apMM85xNKx
66,2022-01-26 20:27:03+00:00,1486435538030796805,"Trumpians are trying to replace elections officials with those who claim that 2020 election was a fraud. In GA, MI, and MN, Trumpians vie for sec of state &amp; fundraising in those states is 2+ times higher than it was by the same point in either of last two election cycles.-KCB"
67,2022-01-23 22:22:37+00:00,1485377459046465537,Just posted a photo https://t.co/inLJTfha9q
68,2022-01-22 16:45:57+00:00,1484930342989414402,We'll be in Athens today at 3 pm! Check out this article in the @athensdailyrevi for more information about Kathleen's campaign and today's Meet and Greet. #BuildingWithBailey https://t.co/laqe1xTm20
69,2022-01-22 16:43:56+00:00,1484929836107939840,"RT @EJGreene51: If you are in the Athens area, drop by and listen to Kathleen. She is what TX05 needs......"
70,2022-01-22 02:07:40+00:00,1484709317295157252,"We're heading east tomorrow! Join us in Henderson Co for our next Meet &amp; Greet on Saturday, January 22 at 3 pm. Come get to know Kathleen and her campaign in CD5 as well as other local Democrats running for office! Sign up for more details here: https://t.co/bDtebBOCfF"
71,2022-01-22 00:05:35+00:00,1484678594727141378,Intrepid souls gathered on the outdoor patio of Intrinsic brewpub in Garland on a COLD night. More joined from Facebook. Bit by bit we are working this race for congressional district 5! https://t.co/ATcVvEDmSO
72,2022-01-21 23:10:29+00:00,1484664726852415497,"SCOTUS decision on xfer of Trump documents to House Cmte on 1/6 is important not only because it will help reveal the truth, but also the decision was 8-1, showing that importance of Congress investigative powers outweigh Trump confidentiality.-KCB"
73,2022-01-21 14:52:27+00:00,1484539392081293313,https://t.co/QVjJrWWfjF
74,2022-01-17 16:06:22+00:00,1483108441849745409,"This #MLKDay we reflect on the legacy of Martin Luther King Jr. and his fight for justice. As we celebrate his life today, we must renew our commitment to deliver voting rights legislation and reignite the dream of a better America. 
https://t.co/uw63BHv41i"
75,2022-01-13 23:49:26+00:00,1481775426154471425,"Another great endorsement! Thank you, Charlie! https://t.co/MppoZTxjMu"
76,2022-01-13 14:37:39+00:00,1481636566175039488,"On Tues Sen Ted Cruz promoted conspiracy theory blaming FBI provocateurs for the 1/6 assault on capitol. He didn't provide rationale or evidence for the false claims. He also equated the 1/6 rioters to Black Lives Matter protesters. Remember this, Voters.-KCB"
77,2022-01-12 17:43:21+00:00,1481320910825078794,"Hey, everyone, I just wanted to let you know about an article that’s just been released. You may find it of interest.https://t.co/BYsacO50W5"
78,2022-01-06 22:00:35+00:00,1479211316955029510,"Late New Year's eve, first report of TX election audit was released. (Ordered by Abbot after Trump demanded it.) It found no indication of fraud or out-of-ordinary discrepancies. We need to keep talking about the fact that our election process worked.
https://t.co/m6F3sd7DIX"
79,2021-12-31 12:37:38+00:00,1476895321078865923,"Been deeply upset about the threat to Roe v Wade; trying to understand why people want to make women have babies when they don't want to. Read article by Nikki Giovanni who says ""women are becoming the new slaves, women are the new Blacks.""
https://t.co/B4Y4qPXKy9"
80,2021-12-30 18:38:14+00:00,1476623679065051137,Policy Passions https://t.co/WwSTn5iB7s via @YouTube
81,2021-12-30 15:09:33+00:00,1476571163400753160,@qedigiv @Currying_Favor Nope. But the reasoning is what I find faulty. People are confused by multiple changes in policy without solid explanations.
82,2021-12-30 15:06:40+00:00,1476570437081604097,"Inflation isn't transitory and BBB doesn’t have the votes  to pass. So let's retool key pieces of BBB to make them permanent, like ACA, rather than a hodgepodge of temporary programs. Would enable us all to see what's going on too.-KCB"
83,2021-12-30 15:03:54+00:00,1476569744060956673,"In 2021 Chinese regulations wiped $1trn off the collective market capitalisation of some of the world’s largest internet firms, including Alibaba and Tencent. Tech regulation requires great care &amp; unbridled hostility to tech is dangerous.-KCB"
84,2021-12-30 14:59:08+00:00,1476568542380232706,"CDC cut isolation period for Covid to 5 days &amp; no mention of also requiring a neg test. Dr. Walensky,  CDC director, told CNN the guidance “had a lot to do with what we thought people would be able to tolerate.” What happened to science being the guide?-KCB"
85,2021-12-27 18:18:58+00:00,1475531666940649475,"Folks, this report shows how severe the Trumpists' challenges are to our voting infrastructure and processes via backdoor tactics. 32 new laws across 17 states that politicize elections. Everyone, get informed! Vote!
https://t.co/1Ki08krZph"
86,2021-12-24 23:38:40+00:00,1474524961737949185,https://t.co/poaNJw7Q37
87,2021-12-24 20:32:59+00:00,1474478232745484292,"Good outcome: Labor settlement with Amazon, which will contact workers to notify them of greater flexibility to organize in its buildings. Also, now easier &amp; faster for the N.L.R.B., to sue Amazon if it believes the company violated terms.-KCB
https://t.co/uQbMPTvcib"
88,2021-12-24 20:23:15+00:00,1474475781413871623,Biden supports filibuster carve out for voting rights. I do too. _KCB https://t.co/S1G25gmzCN via @ABC
89,2021-12-24 20:18:03+00:00,1474474473202069518,@EJGreene51 Thank you!
90,2021-12-24 20:17:29+00:00,1474474331967262734,"Pillar of Shame removed from Hong Kong Univ in the dark. It depicts bodies piled atop each other to symbolize lives lost in military crackdown on pro-democracy protesters in Beijing’s Tiananmen Square on June 4, 1989. SYMBOLS MATTER. Don't forget that.https://t.co/tsswMltgqf"
91,2021-12-24 18:33:27+00:00,1474448149548875784,Christmas message from a leaf! https://t.co/GYnMB8pDFx
92,2021-12-23 22:28:17+00:00,1474144860802330631,Campaigning in Terrell Texas: Christmas Parade Float https://t.co/hjiuEpqGmz via @YouTube
93,2021-12-23 02:35:07+00:00,1473844589748535296,@YuckyPumpkins Manchin supports the Voting Rights Act (sponsored by Klobuchar and 47 others).
94,2021-12-21 17:50:27+00:00,1473350163473346560,"A reason I love Dem Party is that tent is big enough for Sanders AND Manchin. If I were in charge (yeah, I know I'm not), I'd focus all energy on getting voting rights act passed. We need a win on that for Democracy's sake."
95,2021-12-20 15:52:31+00:00,1472958098293854211,"China bans Facebook &amp; Twitter, but pays people to create fake accounts to manipulate foreign users of the platforms. This isn't just propaganda, it is shaping the ""reality"" of Western audiences. See NYT article for more.https://t.co/IGeFLZMw38"
96,2021-12-20 15:23:35+00:00,1472950817116274694,Another great endorsement! https://t.co/pp0CXu5DVM
97,2021-12-19 15:27:23+00:00,1472589386663538697,"Filibuster should be changed or ended. Norm Ornstein suggests making minority provide 41 votes to continue debate instead making the majority find 60 to stop it. Maybe. For sure minority should actually be present and debate the measure they object to. 
What do you think?"
98,2021-12-17 16:05:21+00:00,1471874163644289038,"Thanks for your support, Joel!

We do deserve better. This race will take all of us standing together. Sign up to join our team at
https://t.co/hhRfzfMVsC https://t.co/WG127pMPS5"
