,Created at,User ID,Text
0,2022-06-19 21:21:55+00:00,1538633198753693696,"Happy Fathers Day to all the fathers, grandfathers, great grandfathers, father-figures, fill-in dads, step-dads and good guys out there who step in and up for a child.  No matter shape, size or configuration of a family —positive male-role models matter.  #fathersday #fatherhood https://t.co/BnrY2jkPUI"
1,2022-06-16 10:30:00+00:00,1537381974393987078,Congratulations @MayraFlores2022 — May you never stop fighting for the #americandream &amp; always serve your constituents well! https://t.co/fRWolR6Hai
2,2022-06-11 01:19:51+00:00,1535431583716495361,Well said!! https://t.co/HIoYuYAdsE
3,2022-05-14 22:57:12+00:00,1525611215157972992,@BishForCongress Tragic.   So sorry for your loss &amp; condolences to your entire family
4,2021-11-13 22:28:26+00:00,1459649384874975235,"RT @CTSenateGOP: 10,968 shots fired in Bridgeport so far this year, more than double the 5,094 in all of 2020. 

In New Haven, shots fired…"
5,2021-11-02 13:11:47+00:00,1455523029065338887,Todays #electionday — please grab a friend or neighbor and get to the polls!!!   Help be the change you want to see!  Best of luck to all the fine candidates!!  #votevotevote #ctvote #ctgop #makethechangetoday #redwave. https://t.co/m2gnW3QgSG
6,2021-11-02 13:09:49+00:00,1455522537367121922,We will all be watching this closely!  #fightvoterfraud https://t.co/5hKCeR0AuO
7,2021-10-29 02:09:37+00:00,1453906838534164480,Great to see many at #PrescottBushAwards.  Huge congrats &amp; thank you to great patriot @alexplitsas for tireless efforts - saving  &amp; returning home countless stranded Americans in Afghanistan since the disgraceful withdrawal #ctgop #AfghanistanDisaster https://t.co/Wv5aLT8DZI
8,2021-10-12 22:41:51+00:00,1448056348969771016,"RT @RepTKlarides: To all my LGBTQ+ friends, I’m proud of you for who you are. Always.

#NationalComingOutDay https://t.co/wf7dsiln3D"
9,2021-09-22 20:16:43+00:00,1440772064298766346,"@independent_072 Dexter, charmed, Alf, baywatch, taxi…"
10,2021-09-14 03:19:33+00:00,1437616984708034561,"Of all the hypocrites… showing up at @metgalafashion_ in this @AOC ?  You know a single tickets $35k, right?   Who paid for yours? The US taxpayer? https://t.co/Xm3cko4utb"
11,2021-09-12 16:31:21+00:00,1437091472524840965,Simply amazing https://t.co/6NTVx7CTkt
12,2021-09-11 14:32:32+00:00,1436699183055085572,"On this somber #Sept11 anniversary, for those who are able, we  #remeberthefallen &amp; we bear witness to the tragedies which irreparably changed out lives &amp; nation forever.   May they never recur. May Gd bless America eternally #NeverForget911 https://t.co/2o42YN4ofg"
13,2021-09-06 21:34:28+00:00,1434993428501352449,"L’shana Tovah Tikketeivu.  May you &amp; yours be inscribed another year for blessings in the book of life!    Happy New Year - Sweetness, apples and honey to all! #roshhashana #applesandhoney #roundchallah"
14,2021-08-30 01:38:06+00:00,1432155637560102920,Spectacular humanitarian efforts by ⁦@alexplitsas⁩ to assist in extracting many from #kabul !! https://t.co/jwNaN1Gfjs
15,2021-08-26 22:46:49+00:00,1431025368216051721,"We pray for comfort for the grieving, healing for the wounded, rescue for those in danger, and safety for our military forces &amp; all Americans in harm’s way in #Kabul. May Gd bless the USA.    This didn’t have to happen #AfghanistanCrisis"
16,2021-08-25 01:52:55+00:00,1430347424552427521,Let’s hear it for #Connecticut     CNN finally reporting what the rest of us know to be true!  @ryanfazio @CTGOP https://t.co/tlKiRSCkuO
17,2021-08-22 07:59:30+00:00,1429352515448066048,"In the calm before the storm, waiting for #HenriHurricane to make landfall— reminder to stay safe out there — and to please check on elderly &amp; infirm neighbors.  #beachlife #MotherNature #Henri"
18,2021-08-19 03:04:56+00:00,1428191220854046731,"Lack of leadership, absenteeism, failure to safeguard national interests at home and abroad &amp; pandering all point to a resounding failure of @POTUS and @VP  to appropriately represent America.   Thinking out loud here:  let’s emulate Cali &amp; can we have a recall vote please?"
19,2021-08-18 10:53:54+00:00,1427946851936964609,"Congratulations ⁦@ryanfazio⁩ on special election win &amp; all who contributed time &amp; effort. May this be the start of a return to balance, pragmatism &amp; sensible governance throughout CT!!! #votelikeitmatters ⁦@CTGOP⁩ ⁦⁦@GreenwichRTC⁩  https://t.co/o0EBByHcFa"
20,2021-08-16 01:10:38+00:00,1427075294838525957,Where’s the leadership?   Is this for real? https://t.co/kijLSxzp4E
21,2021-08-15 23:44:21+00:00,1427053578406014983,"Nearing 20th anniversary of 9-11, recalling the legacy of valiant heroic efforts by Americans in uniform and civilians alike in our darkest hour and the yrs since— incised to see Biden watch fall of Afghanistan to Taliban forces like a bystander. #LeadershipMatters #outrageous"
22,2021-07-27 11:39:13+00:00,1419985724112265216,Highly disturbing and not altogether unexpected.  Wonder if current lax administration will be as permissive here as on our southern border.  We need #chinapolicynow !! https://t.co/Bz5AgOEElS
23,2021-07-21 19:53:28+00:00,1417935781323231234,CT routinely among the 5th highest death rate in nation from opioid abuse.   A $26B settlement to address root cause issues is a game-changer.    Let’s ensure CT law-makers don’t blow this opportunity to break the cycle of addiction!  #breakthecycle  https://t.co/V7MncGMlsu
24,2021-07-21 19:29:08+00:00,1417929657115152386,This guy … @SenGeorgeLogan .. one of my best buds from the campaign trail last year announced his run for #ct05 congressional race today!  Please join me in giving him your full support in this important race !!! #ctgop #2022Elections #RedTide https://t.co/wy9C9FdzRR
25,2021-07-21 17:15:55+00:00,1417896131254800387,RT @RepLeeZeldin: Voter ID should be enacted in ALL 50 states! RT if you agree!
26,2021-07-19 21:39:55+00:00,1417237793726738433,"RT @EliseStefanik: “Imagine Republican lawmakers fled a state, flew maskless on a private jet while celebrating with beer rather than votin…"
27,2021-07-17 19:34:28+00:00,1416481446676647939,Wonderful to beat the heat at state senate kickoff for @ryanfazio in aug 14th’s special election —tremendous turnout today is surely a sign of good things to come!!  @CTGOP @bobforgovernor @fcamillo @tonyhwang @RepTKlarides @RepFiorello https://t.co/KQifPNdOLo
28,2021-07-04 23:23:47+00:00,1411828113969926146,"Happy Independence Day 🇺🇸!       Recognizing we all owe so much to this great nation.  To life, liberty and the pursuit of happiness — long may she reign, America the Beautiful. #4thofjuly2021"
29,2021-06-20 17:57:15+00:00,1406672510473719809,"Happy #FathersDay2021 to all the fathers, grandfathers and male role models out there.   Time to light up the grill and enjoy a perfect day!!"
30,2021-05-11 19:27:22+00:00,1392199674103308298,"RT @EliseStefanik: The United States stands with Israel. 

Joe Biden’s silence is deafening and inexcusable."
31,2021-05-09 14:19:25+00:00,1391397399134883840,Happy #MothersDay Day to all the ladies who woke up early to clean up the midnight-snacked kitchen and put out the ingredients so our kids can make us breakfast but then they decide to sleep in so...it’s another Sunday but we wouldn’t trade it for the world!!! ❌⭕️❌⭕️
32,2021-03-24 13:32:08+00:00,1374715657850392581,"RT @RepTKlarides: Hate is hate, and now more than ever we need to stand up to intolerance and stand arm and arm with our AAPI neighbors. #s…"
33,2021-03-09 02:18:20+00:00,1369110274096168961,On #InternationalWomensDay  we celebrate the achievements made by women around the world &amp; honor the trailblazers whose actions and ideas opened doors &amp; changed the world.   For the progress made in our lifetimes and our daughters futures — may we always move forward! #girlpower https://t.co/gkiO8ImDAt
34,2021-03-03 22:38:11+00:00,1367242930264580096,Agreed https://t.co/mafhp5R0FP
35,2021-03-01 21:55:04+00:00,1366507303554408451,"Tues 11:30am participating in a living history moment to commemorate #WomensHistoryMonth.  Reaching across the aisle to introduce @RepDWStweets as she speaks of women who have guided and inspired her in lifelong advocacy for women’s issues. Join us!
https://t.co/eSpKeMuw8K"
36,2021-02-26 22:38:17+00:00,1365431018329669635,Chag sameach !!
37,2021-02-23 04:31:52+00:00,1364070446430322688,Congratulations @SusanHatfield https://t.co/9KJooOO0Ta
38,2021-02-23 04:27:10+00:00,1364069265658241025,After highest priority at-risk &amp; front line workers had access to doses— for next phase of rollout- a speedy and simple plan to ensure max #s receive vaccines while Prioritizing educators - yes- here @GovNedLamont’ K.I.S.S. plans make sense &amp; deserve credit #OpenSchoolsNow #COVAX https://t.co/X1C1jspVsK
39,2021-02-22 01:35:14+00:00,1363663608362770432,"@Thorongil16 Seymour Chester.      First cousin to the infamous Seymour Butts of Springfield, Mass."
40,2021-02-18 16:58:03+00:00,1362446292752998403,"Enjoyed speaking with @MattCaronTV on @FOX61News today.  We owe it to our most vulnerable seniors and their families to ensure appropriate protections, accountability and transparency standards were met throughout this horrific pandemic."
41,2021-02-18 01:30:18+00:00,1362212816564998151,https://t.co/mRmd5r1Q4v
42,2021-02-18 01:04:39+00:00,1362206361342328832,I’ve called for @AGWilliamTong to investigate  @GovNedLamont and his senior staff    ~70% of CT covid fatalities occurred in nursing homes - or was it more?— Independent of politics — many many people died —- &amp; their families deserve the simple respect of truth.
43,2021-02-13 18:00:11+00:00,1360649988980801537,"My question is... if. #KINGNED has essentially copied everything Cuomo does throughout the pandemic but three days later—- has @GovNedLamont done the same? Why hasn’t @rosadelauro called for an investigation?

https://t.co/UTLCzjfJdz"
44,2021-02-13 17:31:24+00:00,1360642744494997506,Unrestricted use of bailout money?  What could possibly go wrong?  #kingned #fiscalresponsibility #Connecticut https://t.co/iplEDTH3Ny
45,2021-02-12 05:16:52+00:00,1360095506236604417,"RT @EliseStefanik: Governor Cuomo, the secretary to the governor, and his senior team must be prosecuted immediately – both by the attorney…"
46,2021-02-11 14:03:02+00:00,1359865531432591360,"Morning chuckle!!   
https://t.co/Bf0baR8Xj6"
47,2021-02-11 04:16:20+00:00,1359717882125549569,Showing great leadership - kudos ⁦@GovRaimondo⁩    Children need in-person education — opportunity to learn alongside their peers! ⁦@MayorElicker⁩ ⁦@NedLamont⁩ it’s well past time to open up new haven &amp; hoops back too #letthemlearn #kids  https://t.co/SjDk21e2vP
48,2021-02-10 12:27:00+00:00,1359478977732239368,💯 ...when @rosadelauro was hiding in her basement &amp; wouldn’t debate...we had the a pizza debates! @VinniePenn 🍕 — cheesy? Perhaps..but super-fun time for community esp. those w/o electricity for days this summer @UnitedIllum @ModernPizza @pepespizzeria @sallysapizza #PizzaDay https://t.co/4wYSm76oRc https://t.co/aFWndFCDHj
49,2021-02-09 23:28:23+00:00,1359283031966687235,This is failure through &amp; through.  The teachers unions —-who represent those whose jobs are to TEACH - to help educate our children  are literally creating a lost generation of educated American children — it is disgraceful. #OpenSchools #LetThemLearn https://t.co/ilQUqQKiCR
50,2021-02-09 13:49:32+00:00,1359137357275004930,Thank you to @HAMDENPOLICECT for averting what could have been an unspeakable tragedy for this toddler &amp; family.  We rely on #police daily and in moments like these let us all acknowledge the fine job they do.   @CT_STATE_POLICE @GLFOP #BlueLivesMatter https://t.co/UVxCXfmgjX
51,2021-02-07 19:21:43+00:00,1358496179412164614,@rosadelauro has certainly taken the squad under her wing ——teaching them all the ropes. #breakthecycle #endtheinsanity #itsjustwrong #ct3 #appletree https://t.co/1GUYGDUj17
52,2021-02-07 18:12:51+00:00,1358478850057986059,"Hoping that all residents, employees, visitors and emergency service responders are safe at the Grimes Center today. https://t.co/OP8HN0x3iW"
53,2021-02-06 23:56:09+00:00,1358202856021651458,@MattCaronTV @FOX61News So happy for her!  Let’s keep the hope flowing as we rollout more vaccines!
54,2021-02-06 17:55:05+00:00,1358111990154166272,"@SpeakerPelosi what’s good for the goose is good for the gander, is it not?  Pay the fine! https://t.co/T6YHqkyQBb"
55,2021-02-06 17:12:22+00:00,1358101241532846080,"It’s about time!!!  Time to clean house!!
@rosadelauro @ct3 https://t.co/oNhzSd9kZw"
56,2021-02-06 12:50:34+00:00,1358035354658439169,Condolences to the entire Kane family. https://t.co/xSOOJBpGZr
57,2021-02-06 12:40:14+00:00,1358032754269696001,"Spot on @colinmcenroe - and nailed it w the Saturday morning schaudenfrede, CT we need to do better!

https://t.co/AXWg2jTALY"
58,2021-02-05 22:05:24+00:00,1357812597869989888,Yup https://t.co/XCa3FHvWXX
59,2021-02-05 22:05:06+00:00,1357812522460528642,"Fantastic!      — and yes, I remember many a trip to Caldor’s.  Got our VHS player there... https://t.co/jjRasK1tGa"
60,2021-02-05 22:01:08+00:00,1357811520877584392,Godspeed Mr Plummer - an amazing actor and gifted CT resident. And condolences to his family. Watched the sound of music w my kids only last week  .via @NYTimes.  #soundofmusic  https://t.co/SFZ5V7kThz
61,2021-02-04 16:30:31+00:00,1357365931534606336,"While no amount of money can compensate for the tens of thousands of lives lost &amp; scourge upon our society caused by the opioid Epidemic,  let’s ensure funds are put to high schools health-ed, job training &amp; other correlated preventative measures.   #breakthecycle #opioidcrisis https://t.co/jo5FX3UcUz"
62,2021-02-04 15:52:01+00:00,1357356243514499074,"After a year of #kingned running the show and a horrific death toll among our nursing home residents—- CT reps.... care to follow suit?  @CTDems @rosadelauro @jahimes @GovNedLamont @SenBlumenthal @ChrisMurphyCT @jodilatina8 @T2Fox61 @ChazandAJ 

https://t.co/YKO25LtCyC"
63,2021-02-01 03:47:12+00:00,1356086673608761348,Asking for a friend— is it a sign of old age going to bed thinking about how to install electric heat under driveway  &amp; sidewalk rather than the 12”-18” snowfall itself?
64,2021-01-21 18:27:33+00:00,1352321953516965890,... day 2... https://t.co/3wxVPTf3jS
65,2021-01-20 20:29:16+00:00,1351990195667787776,Thank you to President &amp; Mrs Trump @POTUS for your four years of service.  Best wishes to President &amp; Dr Biden @JoeBiden &amp; to all Americans as we look ever forward.  May you serve our country well.
66,2021-01-20 00:30:29+00:00,1351688511703953409,"American energy independence is a national security issue, an employment issue, an economic issue and an environmental one.  Infrastructure matters in more ways than one. https://t.co/psl53Swx0m"
67,2021-01-17 15:55:22+00:00,1350834106523930626,Happy 99th birthday @BettyWhite You never cease to bring joy &amp; humor to every situation.  https://t.co/LXkpYWScea
68,2021-01-17 12:55:39+00:00,1350788875929661442,"Simply fantastic, uplifting, simple, anyone can participate on either the giving or receiving and a great solution for those who can’t help but always cook for 10, even if there’s only 3 home for dinner!  #lasagnalove #nojudgements https://t.co/VGwHiRcCcC"
69,2021-01-13 12:18:39+00:00,1349330012755947521,Wishing you nothing but the best⁩  in your future endeavors ⁦⁦@TheBigChezy⁩ .     ⁦@CTGOP⁩ ⁦@CTGOPChair⁩  https://t.co/0HJJhgtpXS
70,2021-01-06 23:42:28+00:00,1346965387007700994,Every American had the right to peaceful protest.   Never through violence nor looting.    As w riots this summer -those responsible for the abject mayhem unfolding in our Capitol need to stop &amp; should be held accountable— 🇺🇸 is better than this—
71,2021-01-06 23:20:41+00:00,1346959907162099712,"RT @RJC: Protesters must stop now.

We support peaceful protest, but storming the halls of Congress and the Capitol building is unacceptabl…"
72,2021-01-05 12:11:25+00:00,1346429092242071553,Well said!  #SaveConnecticut #EndtheInsanity https://t.co/1GC8kQiqIS
73,2021-01-03 20:04:35+00:00,1345823390289031168,"Congratulations to the newly sworn in &amp; historically diverse 117th Congress:  especially to the newly elected GOP women.  May you all serve our country and it’s the peoples well.  
https://t.co/mMUIcGpdkU"
74,2020-12-31 20:04:56+00:00,1344736318471995393,"As 2020 draws to a close, we reflect upon the lives lost and those fundamentally altered by the ravages of this past year.  We give thanks to all our essential workers and look towards a brighter tomorrow.  And may Gd bless America and all her peoples #HappyNewYear2021"
75,2020-12-29 14:17:41+00:00,1343924153108357120,@daddy_pylantrt https://t.co/rCHhm5EbpT
76,2020-12-29 13:36:04+00:00,1343913679117578243,What IF?  #TermLimits https://t.co/JzWiarwXyL
77,2020-12-21 22:42:54+00:00,1341152189557985283,If anyone’s looking for Saturn and Jupiter fully overlapping for first time in 800 Yrs tonight and only tonight... I’d recommend SkyView lite free app.. ½ hr after sunset.... should be visible w naked eye in most places.    #planetaryalignment #SaturnAndJupiter
78,2020-12-20 13:04:59+00:00,1340644367783112704,"Thank you #OperationWarpSpeed and all who are part of the development, facilitation, delivery and distribution of the vaccines!!   5.9million cases of the #Moderna vaccine rolling out today!!  #EndCovidEverywhere"
79,2020-12-19 22:05:07+00:00,1340417905977126915,My deepest condolences to the Dalio family on your tragic loss.   May his memory be a blessing. @RayDalio
80,2020-12-17 14:44:42+00:00,1339582298132459520,@RepDanCrenshaw is spot on https://t.co/Yk1dnIX7cF
81,2020-12-17 12:33:46+00:00,1339549345734115328,❄️ 2020 metaphors abound— shovel ourselves or ...1)ask permission before clearing; 2) wait for gov’t to do it for us but then 3) issue fines if we do it on our own while 4) issue fines if we don’t do it fast enough?  #Snowmaggedon2020 #evensnowcanbepolitic
82,2020-12-17 12:13:02+00:00,1339544129492180993,Let the ❄️ snow-shovel aerobics ⛄️ begin ! #SnowStorm2020
83,2020-12-17 01:45:28+00:00,1339386197458776064,"Amazing generosity and impact by ⁦@mackenziescott⁩ to smaller university, community colleges, and technical schools - particularly serving many who are often overlooked.  Kudos to you! https://t.co/sJ2CxnvOlj"
84,2020-12-14 18:33:20+00:00,1338552671238844422,Thank you to all who worked tirelessly on #OperationWarpSpeed such that #CovidVaccine is now rolling out!!  https://t.co/M3ULV5BpuV
85,2020-12-10 12:20:51+00:00,1337009380546523137,"Failed tax policy, failed fiscal policy and yet somehow the @CTDems magic wand is another tax?   No!    Anyone reminded of Laffer curve and that classic scene in Ferris Bueller’s Day Off —voodoo economics? https://t.co/nLwgCurutY"
86,2020-12-09 13:56:46+00:00,1336671132087410696,@NMalliotakis Quite simple to understand actually— profit margins     Broadway depends on packed house.  SNL. Doesn’t.  They can reduce audience size and prefilm select segments
87,2020-12-07 14:02:36+00:00,1335947824329068546,https://t.co/3Wb7MAybCg
88,2020-12-07 14:02:36+00:00,1335947823536336898,Take note— pretty strong condemnation of @NYGovCuomo and @BilldeBlasio hostile business environment and doesn’t bode well for future economy of Tri-state region and our people if @GoldmanSachs is contemplating a move to FL.  Wall Street packing up??.. c’mon man!
89,2020-12-07 13:49:18+00:00,1335944474413981701,"Joining @VinniePenn in a few minutes to discuss COVID, ct economy and more.  Tune in!!"
90,2020-12-06 22:38:16+00:00,1335715208564776971,"RT @kimKBaltimore: I see a lot of conservative activist/commentators, but very few brave enough to run for office. There is no such thing a…"
91,2020-12-02 00:59:23+00:00,1333938780210929668,@jodilatina8 @markdavisWTNH @WTNH Congratulations @jodilatina8 !  And best wishes on your retirement @markdavisWTNH !!
92,2020-11-26 13:58:02+00:00,1331960409847439368,"In a year which has brought so much, thankful now and always for our many blessings.  However you chose to commemorate today - old traditions &amp;/or new - Wishing you health &amp; happiness today and always. - Margaret.  #thanksgiving #givethanks #lovemeabird #gobblegobble https://t.co/ToPzleMBqT"
93,2020-11-20 14:24:23+00:00,1329792710950199298,@toddtalk Disgraceful lack of leadership
94,2020-11-13 12:02:56+00:00,1327220400170938371,"We can, should &amp; must do better.  The path is so clear - we need to change leadership in CT - ongoing 30+ Yrs of blue rule is simply NOT the solution.  @CTGOP https://t.co/jkhhZrt3M2"
95,2020-11-05 15:42:54+00:00,1324376655176019968,@Crazyguido70 @streetglide12 We did advertise in Spanish - both tv and radio and did a few interviews in Spanish.  I was in many  minority neighborhoods - sometimes things just don’t go the way they should.
96,2020-11-03 18:02:54+00:00,1323687109841031169,"Fantastic to see such strong turnout today——Quick “Bite &amp; tweet” after 9 polling stations, 4 tv interviews, 2 radio shows and a newspaper interview...  exit polls very strong but please if you haven’t already—- VOTE, VOTE, VOTE.  Polls close at 8pm. https://t.co/dyAm6ELYsj"
97,2020-11-03 03:24:05+00:00,1323465948913979393,Let’s bring it home #CT3!!!! #streicker2020 #ElectionDay @GOP @CTGOP #fliptheSeat #retireRosa https://t.co/YKuhJlsZJ8
98,2020-11-02 11:14:56+00:00,1323222053659561985,@RealAntKorsko @SusanHatfield @CTGOPChair @SenRobSampson @dominicforct @KimberleyHealy1 @tonyhwang @thejtlewis @Fay4Congress @Fishbein4ct @dougdubitsky @eric_berthel @HarryForCT @ryanfazio @ChapmanSusanL Sure thing!  Happy to.  Followed.
99,2020-11-01 02:01:12+00:00,1322720315999506433,@2020Hopperstad @jrojas9 So sorry for your loss
