,Created at,User ID,Text
93,2022-06-09 15:36:58+00:00,1534922508125749250,"RT @LtGovGray: Our ski areas have kept our economy going through this pandemic, and safely welcomed millions of skiers and riders to trails…"
94,2022-06-09 15:33:37+00:00,1534921665859264514,Tonight at 7pm! Tune in here: https://t.co/jf2OqNTR5W https://t.co/dmedcxcqaT
95,2022-06-09 01:10:15+00:00,1534704394469515264,"Thanks to everyone who came out this evening in Burlington. Vermonters want positive, issue-focused leaders, ready to bridge the divide and get things done. From workforce to housing, I’ll work with anyone to do what’s right for Vermont. I’m ready to get to work.

#VTPoli #MG4VT https://t.co/QGM8xjAETV"
96,2022-06-08 21:53:01+00:00,1534654757150892034,"Thank you, Joan Shannon, for your steadfast support. Serving the Burlington community for nearly two decades, Joan has always led with compassion and integrity. I'm honored to have earned her endorsement.

#VTPoli #MG4VT https://t.co/ODSBDGoEir"
97,2022-06-07 23:49:37+00:00,1534321714066341888,"57 years later, reproductive liberty is still under attack. 

If Roe falls, it’s likely that access to contraceptives is next. Conservative Justices are chipping away at established rights. In Congress, I’ll fight to protect safe &amp; accessible reproductive healthcare.

#VTPoli https://t.co/7bVttz3Ufo"
98,2022-06-07 22:03:47+00:00,1534295080399413248,"And l know I’m not alone in this battle; too many Vermonters face these same decisions. In Congress, I will fight for universal paid leave so no Vermonter is forced to choose between a paycheck and caring for someone they love."
99,2022-06-07 22:03:46+00:00,1534295076641419264,"This fight is personal to me. When my mother was struggling with MS, I used my vacation days and sick leave to care for her. But as days turned to weeks, my paid time off ran out. I wondered how I would afford rent and student loan payments. https://t.co/SLdSDVDl4k"
