,Created at,User ID,Text
87,2022-06-01 15:05:00+00:00,1532015362031640579,"#Pride: Democrats are honoring the love, courage, and beautiful diversity of the LGBTQ+ community as Republicans endanger their rights and safety in red states and federally.

FL is silencing LGBTQ+ students as TX is targeting trans kids. #Equality is the answer and our duty. -NP"
88,2022-06-01 03:21:22+00:00,1531838288599859202,"No better place to be than San Francisco’s Chinatown to round out our celebration of #AAPIHeritageMonth.

Our partnership continues to support workers, stop anti-AAPI hate and end gun violence. -NP https://t.co/NYGQFw6DtJ"
89,2022-06-01 01:40:00+00:00,1531812776611659776,"A combat veteran, pilot and officer in the Hawaii Air National Guard and US Air Force, Congressman Kai Kahele serves our country in several capacities.

On the Transportation and Infrastructure Committees, he delivers investments and good-paying jobs for #HI02. #AAPIHeritageMonth https://t.co/1UmVLduSDo"
90,2022-05-31 18:30:00+00:00,1531704563719454722,"Progressive Caucus Chair Pramila Jayapal is the first South Asian woman elected to Congress and a strong advocate for immigrants, health care, union jobs, climate action and the care economy. #WA07 #AAPIHeritageMonth https://t.co/E23Say6JyJ"
91,2022-05-31 15:30:00+00:00,1531659266364362752,"Hold on to hope. Amid the darkness from Uvalde to Ukraine, it would be easy to descend into apathy or despair. But we can’t.

Hope remains Democracy’s most powerful weapon against oppression, cynicism and hatred. 

Hold on to hope — and turn it into action. -NP #TuesdayMotivation"
92,2022-05-31 14:35:00+00:00,1531645423818903553,"Congressman Michael San Nicolas is Guam’s delegate in the House, where he serves on the Financial Services and Natural Resources Committees.

He champions the health and economic security of his neighbors and delivers vital resources and investments for Guam. #AAPIHistoryMonth https://t.co/Wsp2NVgKGi"
93,2022-05-31 01:15:00+00:00,1531444097075990528,"With eternal gratitude to America’s Gold Star Families, we will never forget the bravery, patriotism, and sacrifice of our heroes who gave their lives for our country.  May their sacrifice inspire us all. -NP #MemorialDay https://t.co/yxifT5h4s6"
94,2022-05-30 17:00:02+00:00,1531319537391370241,"On #MemorialDay, we honor servicemembers and Gold Star Families for their service and sacrifice to defend Democracy and defeat tyranny.

They helped make America the land of the free and home of the brave. We owe them the courage to live up to the ideals they died defending. -NP"
95,2022-05-29 19:37:35+00:00,1530996794997542918,"Be yourself. You are the authenticity that America needs.  Show people what is in your heart. That is the authenticity of you that no one can pass out on a piece of paper. 

There is nobody like you. You are the only you. Know your power and be ready. -NP https://t.co/C0ejQKT0Vx"
96,2022-05-29 01:00:01+00:00,1530715550560690178,"Congressman @RoKhanna is committed to modernizing America's workforce and expanding job creation in tech across our country.

He fights for health care, education, climate action, gun violence prevention, and an economy that works for everyone. #CA17 #AAPIHeritageMonth https://t.co/Z3qVO8Jmzn"
97,2022-05-28 22:35:00+00:00,1530679056307347457,"More baby formula has landed. Help is on the way.

#DemocratsDeliver and we won’t stop until our babies are fed. 
https://t.co/wZbzQ8df4L"
98,2022-05-28 19:00:14+00:00,1530625007969247234,"As the families in Buffalo and Uvalde are planning funerals instead of summer celebrations with their loved ones, we hold them in our hearts and commit to matching our outrage and heartbreak with concrete action.

We won't give up until the job is done. #EndGunViolenceNow"
99,2022-05-28 17:30:00+00:00,1530602300091158529,"Congresswoman Doris Matsui is a warrior for America's working families and a leading voice to #StopAsianHate and #EndGunViolence.

@Matsui4Congress delivers vital resources for Sacramento's key priorities: jobs, health care, flood protection and infrastructure. #AAPIHeritageMonth https://t.co/MHv7cy2KGR"
