,Created at,User ID,Text
0,2022-06-27 19:30:35+00:00,1541504281605537793,"Congratulations to California’s own @aprildverrett on your election as @SEIU Secretary-Treasurer. 

America’s working families need good paying jobs, dignity in home care, strong unions, and equity in the workplace — and will be well-served by your continued leadership. -NP https://t.co/KhnyAP5Dq3"
1,2022-06-27 16:30:01+00:00,1541458840260165635,"We heard it all weekend long — freedom and Democracy are on the ballot and voters are ready to turn anger into action.

Today’s #MondayMotivation: help grow our Democratic House.

Pick a Frontliner https://t.co/HGaVhN3EBc or Challenger https://t.co/nj3WkPBAaL and let’s organize!"
2,2022-06-26 23:26:47+00:00,1541201338440159232,"Thank you, San Francisco, for being a beacon of hope, light and #LGBTQIA freedom to the world. 

Love WILL keep us together! -NP #SFPride https://t.co/ulIu7lzS8F"
3,2022-06-26 21:07:19+00:00,1541166237731782656,"So exciting to celebrate freedom with the crowd at #SFPride. 

House Democrats are on the side of our #LGBTQIA community today and always.-NP https://t.co/FvpCwXgcTo"
4,2022-06-26 01:40:00+00:00,1540872472857235457,"Thank you #TeamPelosi VIPs – our amazing Volunteers In Politics – for kicking off #SFpride at our new headquarters and sharing your commitment to human rights, justice, and Democracy. Freedom is on the ballot. -NP https://t.co/9zPwo0zZFi"
5,2022-06-25 19:45:13+00:00,1540783188267728896,"When the GOP-led Supreme Court gutted the #VRA in 2013, they INVITED a flood of voter suppression, gerrymandering and big dark money that is allowing Republicans to target Black neighborhoods and dilute the voice of voters of color.

To save our Democracy — Dems must win anyway. https://t.co/geSE2K5Dqa"
6,2022-06-25 14:40:23+00:00,1540706475445829634,"Working to #EndGunViolence is our sacred obligation to America’s children. 

Thanks to the relentless advocacy of gun violence survivors turning pain into purpose, the Safer Communities Act is now law. It keeps guns from those who should not have them — and will save lives. -NP"
7,2022-06-24 19:50:00+00:00,1540422004670619649,"What this extremist Court did is deadly serious — for freedom in America.

Democrats are for freedom; Republicans are for freedom to force their views on others.

We're not letting it pass! We'll keep fighting Republican sabotage in Congress and we will win in November. -NP https://t.co/7mLTaIoPHP"
8,2022-06-24 15:50:42+00:00,1540361782656905216,"Because of Trump, Mitch McConnell, and the Republican-controlled Supreme Court, American women today have less freedom than their mothers.

The hypocrisy is raging; the harm is endless. Democrats cannot let this assault stand. We will organize and vote to restore our rights. -NP"
9,2022-06-24 04:00:31+00:00,1540183059563159562,"We take an oath to protect and defend people. That means government must make our communities safer.

The Supreme Court was wrong to reject precedent and increase the threat of gun violence in our communities — but thanks to survivors, Congress is acting to #EndGunViolence. -NP"
10,2022-06-23 22:44:23+00:00,1540103502155980805,"RT @Eshoo4Congress: Please join @TeamPelosi and me TONIGHT for a discussion of ARPA-H, Title IX, Veterans' Health, Mental Wellness, Domesti…"
11,2022-06-23 21:40:21+00:00,1540087389695234050,"TONIGHT – Thurs., June 23rd at 9PM ET: outraged by the Republican controlled Supreme Court's attacks on our Democracy and our freedoms? Join me and my special guest, @Eshoo4Congress, to talk about defending our rights and Building A Healthier America. -NP

https://t.co/9kLsJKuWfd https://t.co/INimtVEEnT"
12,2022-06-23 18:30:07+00:00,1540039515145904129,"While families mourn loved ones killed by gun violence, the Republican-led Supreme Court is enabling more tragedy by radically expanding our right to self-defense at home with a ruling allowing more guns in our public spaces. 

We must work to SAVE lives, not endanger them!"
13,2022-06-23 17:00:43+00:00,1540017017843073025,"House Democrats have taken action to enshrine our right to health care and gun violence prevention as federal law — and we’ll never stop fighting for a fairer, safer America. -NP"
14,2022-06-22 20:40:00+00:00,1539709812073562112,"#OlmsteadAt23 recognized the right of persons with disabilities to be cared for at home, not in institutions.

Building on the Affordable Care Act's pre-existing condition coverage and elimination of lifetime caps — Democrats will expand home care and invest in caregivers. -NP https://t.co/Cwhq1NGdzO"
15,2022-06-22 16:40:08+00:00,1539649446966722560,"Suicide* is the 2nd leading cause of death for children and young people.  Gun violence — the 1st.

Democrats will act: red flag laws and mental health services will help keep guns out of the hands of people who are threatening their own lives and others.

*For HELP: 800-273-TALK"
16,2022-06-21 22:00:00+00:00,1539367556955271168,"Vaccines have been an answer to our prayers as House Democrats worked with @JoeBiden to save lives with shots in the arms of the American people.

Vaccine approval for ages 6 months to 5 years helps us protect those most vulnerable — including infants. 

https://t.co/iegFRbocRT"
17,2022-06-21 16:30:00+00:00,1539284510788841472,"House Democrats are fighting inflation to bring down costs for working families by:

🔹Tackling supply chain breakdowns

🔹Investing in U.S. tech research, workforce development, manufacturing, and jobs

🔹And holding corporate price-gougers accountable

Will Republicans join us?"
18,2022-06-21 03:05:37+00:00,1539082079736061952,"Congratulations @Warriors on bringing victory 🏆and joy home to the Bay Area! 

Your talent and heart are matched by your dedication to put in the work, practice, recover from losses and injuries, support each other and win. You make #DubNation proud! https://t.co/tYtAergNay"
19,2022-06-20 20:00:16+00:00,1538975036668891144,"This is the excitement of winning a union and the power to write your story.

Congratulations to Apple workers organizing with @acoreunion @MachinistsUnion and making history. House Democrats passed the PRO Act because we believe every worker deserves a union and this moment. -NP https://t.co/0ly7hs3NnT"
20,2022-06-20 15:45:00+00:00,1538910797270769667,"Democrats offered plans to lower your costs and add jobs  — but House Republicans said NO to a $35 co-pay for insulin; NO to fighting price gouging by profitable oil companies and NO to the infrastructure law.   

To lower costs and add jobs, vote for Democrats! #MondayMotivation"
21,2022-06-19 19:00:00+00:00,1538597483143745537,"On #Juneteenth we mark the day enslaved Black Americans in TX finally heard of the Emancipation Proclamation —and recommit to the work of our civil rights heroes to pursue justice and in Lincoln’s words, “swell the chorus of the Union, touched by the better angels of our nature.” https://t.co/hFun86PDrx"
22,2022-06-19 15:30:00+00:00,1538544634502078464,"A blessed and happy #FathersDay to all fathers, grandfathers, and nurturing father figures across America!

To our servicemembers unable to celebrate with their loved ones today, our nation is grateful for your service and will always look out for you and your family. -NP https://t.co/jbuTRpi3kT"
23,2022-06-18 21:06:45+00:00,1538266994960609281,"The future of our Democratic majority and our democracy runs through @MikeLevin’s district. 

I’m proud to support a champion for climate, advocate for veterans and defender of a woman’s right to choose, Mike Levin. 

Please help Mike #HoldThe49th.-NP  
https://t.co/aA04LFVLju https://t.co/WKLZNBdwA1"
24,2022-06-18 17:16:44+00:00,1538209108280627201,"House Democrats leave no veteran behind.

That’s not rhetoric — it’s resources for those who defended our freedoms.

With Veterans Chair @MarkTakano, 100% of House Democrats said YES to care and justice for veterans exposed to #BurnPits and Agent Orange — 174 Republicans said NO. https://t.co/VexzDtLEVe"
25,2022-06-18 02:00:09+00:00,1537978442221617152,RT @DonnaFEdwards: 🚨🚨🚨 My opponent’s dark money SuperPAC is flooding #MD04 with more than a million in false-negative attacks against me in…
26,2022-06-18 01:50:41+00:00,1537976057780809729,"RT @JoelMartinRubin: These ads attacking @DonnaFEdwards are not just offensive but also ignorant of her views.

Middle East peace advocates…"
27,2022-06-17 21:30:00+00:00,1537910455884128258,"House Democrats took action to bring down prices at the pump and on groceries by fixing supply chain issues and protecting America's working families from price gouging and exploitation.

204 House Republicans decided to protect the exploiters —not families. Remember in November! https://t.co/VIGPd5n3fm"
28,2022-06-17 21:18:47+00:00,1537907635470553089,"RT @MikeLevin: Reminder that instead of supporting measures that would actually lower prices, many House Republicans are using the pain eve…"
29,2022-06-17 21:03:16+00:00,1537903730464501761,"RT @TomPerez: What a night, Bethesda!

I could not be more proud to have the support of @TeamPelosi in our campaign to #GetStuffDone for Ma…"
30,2022-06-17 18:05:00+00:00,1537858866179985411,"Seven years ago, a hate-fueled, armed terrorist massacred 9 cherished souls at Mother Emanuel Church in Charleston, SC.

As we mourn their stolen lives, we can best honor them by fighting extremism and saving lives with strengthened background checks to buy guns. -NP #DisharmHate https://t.co/72LRFRrbpt"
31,2022-06-17 14:15:00+00:00,1537800984922951680,"House Republicans spent the week yelling about high costs — then said NO to Democrats' plans to help:

🔹Reduce gas prices

🔹Lower grocery prices

🔹Strengthen food supply chains
 
🔹Help US farmers

🔹Boost meat industry competition

Vote for solutions — Vote for Democrats!"
32,2022-06-17 04:24:14+00:00,1537652313942151168,Congratulations @warriors — CHAMPIONS on and off the court! #DubNation https://t.co/g3JUMsvUw3
33,2022-06-16 21:58:12+00:00,1537555165628203008,"RT @CommChangeAct: ""We take an oath to protect and defend the constitution of the United States. We do that every day, but we never take th…"
34,2022-06-16 16:00:01+00:00,1537465027753410560,"We’re taking action to lower costs for working families.

Kitchen table issues have always been the heartbeat of the Democratic Party: how families are going to pay the bills, pay rent, pay for food, pay for education.

We’re here for the kitchen table not the boardroom table.-NP"
35,2022-06-16 15:16:51+00:00,1537454160995418112,"RT @TeamPelosi: We must do everything we can to stop veterans' suicides.

If you or a loved one needs help, please reach out and speak to s…"
36,2022-06-16 15:12:51+00:00,1537453157462294529,"We must do everything we can to stop veterans' suicides.

If you or a loved one needs help, please reach out and speak to someone:

Veterans Crisis Line 
https://t.co/54UIN4meDT

CALL 800-873-TALK (8255) and press 1 

TEXT 838255

For more information: https://t.co/hRxVxeZILT https://t.co/leozdH8BOV"
37,2022-06-16 04:25:39+00:00,1537290282340859906,"Every day, 17 veterans die by suicide - 12 use guns.

Veterans’ Affairs Chair @MarkTakano and I are determined to save lives with suicide prevention resources including emergency protection orders to help save the lives of those who defended ours. -NP https://t.co/QCLVa7r2gs"
38,2022-06-16 00:40:15+00:00,1537233559110332416,"RT @santiagomayer_: Dreamers are American in every way that counts. 

Thank you to @TeamPelosi for highlighting the value that immigrants b…"
39,2022-06-15 22:00:00+00:00,1537193229451284481,"Join me and my special guest Veterans' Affairs Chair @MarkTakano for our grassroots volunteer update on the work of House Democrats to serve our nation’s veterans and military families and on our continued celebration of #Pride and commitment to #Equality.
https://t.co/qgu2480VeZ https://t.co/9Q5vJfhFzu"
40,2022-06-15 17:00:01+00:00,1537117738325331969,"Democracy is on the ballot — but so are 100+ MAGA Republicans who disrespect the will of voters and back his Big Lie.

With our health, economic wellbeing and freedoms at stake, Democrats must organize to vote and win by margins that are too big to deny. https://t.co/DZTR8fsFUa"
41,2022-06-15 16:15:32+00:00,1537106543354777600,"RT @JamieforOregon: BIG NEWS: Our team has been named to the @dccc’s selective #RedtoBlue program this election cycle! 

We are building a…"
42,2022-06-14 23:00:01+00:00,1536845946058944514,"House Democrats are using every tool to bring down inflation. Democrats just took action to bring down costs for consumers, ease supply chain challenges and take on shipping cartels. 

Over the pandemic, they raised shipping rates by as much as 1000% for US factories and farmers."
43,2022-06-14 18:42:03+00:00,1536781028924088320,"I’ll say it again: 

No one’s political survival is more important than our children’s survival. 

Republican Senators cannot look away from the gun violence epidemic or block the House reforms. 

We all have a duty to pass lifesaving commonsense gun reforms that #ProtectOurKids! https://t.co/jq0xHDzsqo"
44,2022-06-14 14:38:13+00:00,1536719666227314689,RT @votevets: Countless members of the LGBTQ+ community have served our nation in uniform—swearing an oath to support and defend the Consti…
45,2022-06-13 21:00:00+00:00,1536453354779381760,"Gas prices are driving inflation as oil companies are raking in record profits from price gouging families.

We all see the link between their profits and prices — but when the House took bold action to #EndCorporateGreed, Democrats did it alone. 

Every House Republican said NO!"
46,2022-06-13 18:00:22+00:00,1536408150374506497,"America’s workers deserve good paying jobs with competitive wages and safe working conditions. That’s why we need strong unions and effective leaders like Liz Shuler at the helm of the @AFLCIO to help level the playing field.

Congratulations Madam President on your historic win. https://t.co/pXwsIFFr5r"
47,2022-06-13 01:41:28+00:00,1536161801532059648,"RT @equalityfl: Six years ago, hate walked into Pulse Nightclub in Orlando and opened fire. Forty-nine people, guilty of nothing more than…"
48,2022-06-12 21:10:00+00:00,1536093483001430016,"At the Summit of the Americas in CA, a powerful delegation of Democratic leaders and Caucus and Committee Chairs in Congress mirroring the region's diversity renewed and strengthened our alliances with strategic partners for prosperity, climate action and democratic reform.🌎 https://t.co/qGkQydqNcs"
49,2022-06-12 16:15:00+00:00,1536019244185526274,"Six years ago, a Latin Night celebration for Orlando’s LGBTQ+ community at #Pulse ended with a gun massacre that stole 49 precious lives. 

Pulse survivors have worked tirelessly to disarm hate and pass gun reforms in the House. Now the Senate must act. #HonorThemWithAction"
50,2022-06-11 22:35:46+00:00,1535752681305915395,RT @AndyKimNJ: This morning I got a text from a survivor who lost family to gun violence saying she was outside the Capitol. “Let me know w…
51,2022-06-11 22:04:21+00:00,1535744775537795073,"RT @lucymcbath: Thank you @TeamPelosi for hearing my story. 

Gun violence can only end once we all stand together."
52,2022-06-11 21:51:39+00:00,1535741578001760256,"RT @MikeLevin: I was honored to join an amazing group in Encinitas this morning, including students from @teamenoughca and many others from…"
53,2022-06-11 19:41:58+00:00,1535708940595613697,"RT @eve_levenson: 40k+ gathered on the mall on a rainy day for #MarchForOurLives. 450+ marches nationwide.

Our generation has &amp; will conti…"
54,2022-06-11 15:32:03+00:00,1535646049716551681,"In Washington, DC, and across our country, young people are marching for their lives — demanding Life, Liberty, and the Pursuit of Happiness.

Their courage lights our path to end gun violence and helped the House act this week — now Senators must do their part. #MarchForOurLives https://t.co/ck0szX0c9Z"
55,2022-06-11 02:18:44+00:00,1535446404113604609,"RT @santiagomayer_: .@TeamPelosi just spoke at UCLA — and she’s exactly right. 

Young people are the light that will guide our path out of…"
56,2022-06-11 00:59:58+00:00,1535426580952104962,"UCLA Graduates, amid darkness in our world, recall your motto: Let there be light! You are the light.

When I'm asked what gives me hope, I always say the same thing: Young people. I have hope in young people. Refusing to be silent. Taking to the street. Making change happen. -NP"
57,2022-06-10 15:00:01+00:00,1535275599593295872,"Mass shootings. Domestic violence. Daily suicides, including veterans and children. These are horrors we can prevent with red flag laws allowing firearms emergency protective orders. 

The House passed red flag laws. It’s time, Senators: #ProtectOurKids. https://t.co/dArvXrBIm1"
58,2022-06-09 23:25:00+00:00,1535040293216452608,"Thank you, San Francisco! I am grateful to everyone who voted, volunteered, and helped build our grassroots community. 

It is my honor to serve as your Democratic nominee and take your values to Congress. Onward to November, for the children and for our Democracy. -NP https://t.co/nMXtrbtSTc"
59,2022-06-09 19:10:00+00:00,1534976120285806596,"From Isla Vista to Uvalde, we’ve endured massacres by killers whose access to guns could have been stopped by red flag laws.

After Isla Vista, survivors and Gov. Jerry Brown passed red flag laws in CA. Today, @carbajalsalud and @lucymcbath led the way to pass them in the House. https://t.co/QgpDldUo4V"
60,2022-06-09 14:50:33+00:00,1534910828524318722,"Congresswoman @lucymcbath, Jordan's mom, turned agony into action when her beautiful boy was murdered in an act of armed racism. With her courageous leadership, the House took action and made progress on our mission to #EndGunViolence For The Children. -NP
https://t.co/JjrLbGqMdm"
61,2022-06-09 04:40:00+00:00,1534757177633583104,We would not have had our success in passing lifesaving gun policies this evening without Lucy McBath turning her promise to Jordan into purpose for all America’s children. She inspires us to #EndGunViolence. -NP https://t.co/RnQfkbGkoT
62,2022-06-08 17:45:00+00:00,1534592341830295557,"It’s not the video games. It’s not more people with violent tendencies. It’s the all-too-easy access to guns in America that makes firearms the #1 cause of death for our children over age 1. And it’s got to stop.

Today we act to make it stop; today we act to #EndGunViolence. -NP"
63,2022-06-08 15:00:00+00:00,1534550819122520065,"Where do gun violence survivors find hope after tragedy? How can parents cope with mourning their children and trying to spare others this pain?

Congresswoman @lucymcbath knows all too well. Tonight we’ll discuss the path to #EndGunViolence. Join us. -NP
https://t.co/cmwZU9kTP4 https://t.co/tscTHfLI91"
64,2022-06-07 23:30:00+00:00,1534316776321732608,"Courage is Hailee speaking out after losing both parents to gun violence. Courage is my colleague @lucymcbath turning her grief into action to save lives. Courage is Gabby Giffords, personified.

To my Republican Colleagues: taking action to keep kids safe — that’s just your job https://t.co/z1F9W7fC7Q"
65,2022-06-07 15:00:03+00:00,1534188444812922880,"Happy Election Day #CA11! Today is the last day to vote for the 2022 primary! 

Vote at your polling place, bring your ballot to any official drop box, or mail out your postmarked ballot today. -NP https://t.co/lEkXgRz10g"
66,2022-06-07 01:00:08+00:00,1533977071277555712,"RT @KarenBassLA: This is a city of hope. This is a city of dreams.

Tomorrow we take one step closer to making the future of Los Angeles br…"
67,2022-06-06 22:15:27+00:00,1533935628466933761,"My San Francisco public service began with the library commission. I returned to the library to cast my 2022 primary  ballot For The Children. 

I would be honored to have your vote for Congress. -NP #BeAVoter #CA11 https://t.co/choZH73VM0"
68,2022-06-06 15:35:00+00:00,1533834852063096834,"Gun violence survivors demand lifesaving actions — and the House will:
 
🔸Raise the age to buy semiautomatic rifles to 21

🔸Ban bump stock sales

🔸Outlaw ghost guns

🔸Add penalties for illegal straw purchases
 
🔸Require gun safe storage

Let's get it done! #MondayMotivation"
69,2022-06-05 23:50:27+00:00,1533597145697337344,"In the years that the gun lobby has claimed control of the Senate agenda and Republicans willing to block reforms, gun violence became the #1 cause of death for America's children.

I say to the Republican Senators: protect our children — not gunmakers’ profits. -NP https://t.co/bZIFqr0zk1"
70,2022-06-05 16:36:31+00:00,1533487944341852161,"Buffalo. Uvalde. Philadelphia. Chattanooga. Grieving families across America demand action on guns.

This week House Democrats will again take the lead, defeat the gun lobby and pass commonsense bills to help #EndGunViolence. This must be bipartisan: we must all protect our kids."
71,2022-06-04 21:00:01+00:00,1533191868233572354,"Today marks Day 100 of Putin's violation of Ukraine’s sovereignty and of his amoral and criminal brutality on Ukraine’s civilian population.

Today also marks 100 days of incalculable heroism from the Ukrainian people to defend their home and Democracy – writ large. #SlavaUkrani https://t.co/oLi6gH0aH3"
72,2022-06-04 15:35:16+00:00,1533110141674995713,"We #StandWithUvalde and grieve with the families and loved ones of the 19 little schoolchildren, their 2 teachers, and of all those stolen from us by gun violence.

No one’s political future is more important than our children’s future. Today we grieve; this week we will act. -NP"
73,2022-06-03 21:06:15+00:00,1532831049453080576,"A supermajority of Americans support background checks for guns. Demand is growing that Republicans in Congress reflect this broad consensus with common sense action to save our children's lives instead of bowing to the NRA.

#WearOrange to be seen, heard and help save lives."
74,2022-06-03 16:28:36+00:00,1532761174684467200,RT @TheDemocrats: Every single House Republican voted against a bill that would fight gas price gouging.
75,2022-06-03 15:40:52+00:00,1532749163221352449,"Another night of gun violence in America — followed by another day of Republican delay. Enough!

Our children demand a future! We #WearOrange now and will act next week to protect our kids and honor the lives that have been stolen from us by gun violence.
https://t.co/HqR9n7TIba"
76,2022-06-03 01:11:28+00:00,1532530371165822998,"Let's go, Warriors! Champions on and off the court. #Dubnation https://t.co/Y2gIpeNmbp"
77,2022-06-03 00:15:47+00:00,1532516360613416960,"“Enough.” – @JoeBiden

House Democrats agree, Mr. President, and we are advancing the common sense actions that you outlined tonight to protect our children and our communities.

We invite our Republican colleagues in the House and Senate to join us to #KeepKidsSafe. -NP"
78,2022-06-02 22:20:52+00:00,1532487439171964933,"Every Texas Democrat was a YES for background checks before the Uvalde tragedy. We welcome Republicans in Congress to change their hearts and votes.

It's not too late to do what's right to save lives with commonsense actions."
79,2022-06-02 16:30:00+00:00,1532399143024484356,"House Democrats are heartbroken about young people dying from gun violence — and are taking further action today to do something about it.

Nancy Pelosi and David Cicilline previewed the next steps to save lives and #KeepKidsSafe with a look back at the Pulse tragedy. -TeamPelosi https://t.co/iigBjPVECY"
80,2022-06-02 03:10:00+00:00,1532197813676871681,"Taking #pride in the LGBTQ+ community, clear-eyed on our fight for Equality and to protect children from #GunViolence, we're on the path to the life, liberty and pursuit of happiness our children deserve and communities demand.

The House is taking action.
https://t.co/nVMqrObPgX"
81,2022-06-01 22:05:00+00:00,1532121057741754369,"To the survivors of gun violence, we are not going to stop until the job is done. 

From the White House to the Capitol and to San Francisco City Hall, let all of us do everything we can for the survival of our children. -NP 

#DisarmHate🏳️‍🌈 #GunViolenceAwarenessDay🧡 https://t.co/IzAIwsIkXC"
82,2022-06-01 20:20:41+00:00,1532094807266533377,"TODAY: Join me and Congressman David Cicilline, Chair of the Congressional LGBTQ+ Equality Caucus and Judiciary Committee member, to kick off our celebration of #PrideMonth and highlight House Democrats' work to #DisarmHate and keep our children safe.

https://t.co/Ht2kMJwvZ6 https://t.co/0kqCB0NyRf"
83,2022-06-01 19:06:14+00:00,1532076071541100544,"RT @davidcicilline: This #PRIDE Month, as we celebrate the LGBTQ+ community, our victories, and every LGBTQ+ American, across the country w…"
84,2022-06-01 17:58:11+00:00,1532058947137310721,"Democrats know that unions built the middle class and provide the most effective solutions to poverty. We need more workers with good paying union jobs that feed families, create economic opportunity and secure retirement. We don't agonize - we organize and unionize. #UnionStrong"
85,2022-06-01 17:55:49+00:00,1532058349771972608,"Democrats support every worker’s right to organize. 

From Amazon and Starbucks workers to the striking @UAW Case/New Holland workers, organizers are standing up to companies who can well afford to pay their people. Over 100 Starbucks have voted to be #UnionStrong just this year!"
86,2022-06-01 17:48:33+00:00,1532056522427072524,"Across the country, from California to New York, workers are fighting for unions, higher pay and safe working conditions with a new energy.

San Francisco and Los Angeles public employees, Stanford nurses and Richmond refinery workers have all won victories recently. #UnionStrong"
