,Created at,User ID,Text
95,2021-11-30 19:46:16+00:00,1465769164249960451,"....which will facilitate global manufacturing of the vaccines. Further, by one estimate, the U.S. gave Moderna about $2.5 billion and scientific researchers who helped Moderna develop and commercialize its vaccine. cont...."
96,2021-11-30 19:43:56+00:00,1465768578909708288,"I support Pres. Biden’s goal of global vaccinations against COVID and asking the nations meeting as part of the WTO to waive intellectual property rights.... cont..
https://t.co/8Gdid50Eh5"
97,2021-11-23 15:57:12+00:00,1463174805570703374,"For 20+yrs I have been donating my legal expertise to the cause of voter protection- a government of the people, for the people, by the people. Send me to the US Senate to protect the rights of every American to vote &amp; have their vote counted! 
https://t.co/UtFPpPS5DQ"
98,2021-11-23 15:48:07+00:00,1463172517816934411,"Make no mistake, Ron Johnson is coming for our elections. He's motivated by power. He has consistently voted ""no"" to legislation that would protect voter's rights. He stands for dark money &amp; foreign interference in our elections. cont..

https://t.co/BcDvBwQry0"
99,2021-11-22 15:49:42+00:00,1462810529735577603,"The tragedy in Waukesha last night has left all of Wisconsin heartbroken. Our thoughts are with the dead, injured and their families."
