,Created at,User ID,Text
84,2022-03-31 01:30:07+00:00,1509342242506481671,"I’m honored to receive the endorsement of the Hunters Heritage Council, our state’s largest hunting‐rights org. I’m grateful for the trust placed in me to represent the interests of hunters &amp; look forward to working with the hunting community to resolve key conservation issues. https://t.co/9QJCllJdsl"
85,2022-03-30 16:30:06+00:00,1509206342355099657,"Stopping surging gas prices requires leaders willing to change course and champion commonsense measures. Instead of unleashing American energy production, far-left politicians like Kim Schrier continue to rely on hostile foreign nations for energy. #RestoreEnergyIndependence https://t.co/0i0svQ05UM"
86,2022-03-29 22:59:12+00:00,1508941874744238088,61% of voters agree that Democrats are out of touch with Americans. They know Democrats are catering to the far-left &amp; ignoring the day to day concerns of Americans like surging inflation &amp; rising crime. It’s time for a change in congressional leadership. https://t.co/S3MAaMM5LW
87,2022-03-29 02:30:28+00:00,1508632656317190144,I’m grateful to all those who came out to support my official campaign launches in Bellevue and Cle Elum on Friday and Saturday. A big thank you to all my supporters – now let’s get to work flipping the 8th this November! https://t.co/DCxUjzbPS0
88,2022-03-25 16:30:06+00:00,1507394402968289289,"This National Medal of Honor Day, let’s honor the example set by the most courageous service members in the United States military. The men and women who have risked everything for our nation deserve to have their stories remembered.
https://t.co/cEQbJ1GSzw"
89,2022-03-24 17:00:25+00:00,1507039644042633227,"The surge in gas prices could add $2,000 in annual costs to the typical household budget! That’s on top of the estimated $1,000 in added grocery costs due to inflation. Our national leaders must unleash American energy production – we cannot continue down the current path. https://t.co/QgcTGSQHpl"
90,2022-03-22 15:00:16+00:00,1506284632249098252,We cannot ignore the terrible costs of shutting down American energy production &amp; increasing our energy reliance on hostile foreign regimes. It's caused extreme financial pain here at home &amp; made the world a more dangerous place. It’s time to resecure #AmericanEnergyIndependence.
91,2022-03-21 21:18:28+00:00,1506017423690014726,Amazon made headlines with its decision to allow employees at the downtown Seattle office to work at another location due to high crime. It’s just one of the many consequences of the #defundthepolice agenda that Kim Schrier has yet to publicly condemn. https://t.co/pW99HORajX
92,2022-03-19 17:00:05+00:00,1505227620140597250,"73 police officers died in intentional killings in the line of duty in 2021. This is highest recorded by the FBI since 1995, excluding the 9/11 attacks. It’s never been more important to show our support for law enforcement. Sign my #BackTheBlue petition: https://t.co/932GUCQQDX"
93,2022-03-18 15:30:06+00:00,1504842587483643906,It’s time for you to give Joe Biden his report card. What grade would he receive from you? Click below and fill out his report card. https://t.co/nG8Lia5OVR
94,2022-03-17 18:00:16+00:00,1504517992415219712,"Gen Z is experiencing the worst mental health crisis of any generation. Last year, I sponsored legislation requiring King County to identify strategies to address mental health disorders in our youth. https://t.co/YXrPh26IM3"
95,2022-03-16 21:31:56+00:00,1504208872621457414,"Thanks to @TheDonlonReport for having me on to talk about my ""Re-Fund the Police"" initiative. Both @amazon and @PiroshkyBakery have recently temporarily closed downtown #Seattle locations due to out-of-control crime and gun violence. https://t.co/nc5ruMeIhI"
96,2022-03-15 16:00:44+00:00,1503763133739024391,"The price of gas in Washington reached an average of $4.73 per gallon last week, the fifth highest in the nation. It’s time to relieve the heavy financial burden placed on Washingtonians by unleashing our nation’s energy production capabilities and achieving energy independence. https://t.co/I7OK8F5Pq3"
97,2022-03-15 00:59:05+00:00,1503536227126898688,I’m honored to have the endorsement of former Congressman Doc Hastings. He trusts that I’ll take my conservative record of fighting against radical left policies to Congress. I hope you’ll join us for my campaign kickoff brunch in #CleElum on March 26. https://t.co/0k8OyvkeB5
98,2022-03-14 00:06:04+00:00,1503160495041400838,Families across our nation will continue suffering from the heartbreaking consequences of the #BidenBorderCrisis as long as national leaders continue failing to implement policies to curb the record amount of fentanyl pouring across our southern border. https://t.co/gEgcJxByXz
99,2022-03-12 20:00:09+00:00,1502736223407943680,Americans know the defund the police movement led to more violent crime rates -- and they know how to solve the problem. It’s time for leaders who will fight for public safety in Congress. I’m proud to have fought to re-fund the police and I’ll continue to #BackTheBlue https://t.co/hr4Yibgdzg
