,Created at,User ID,Text
0,2022-06-26 18:00:09+00:00,1541119138575310849,Biden refuses to accept responsibility for rising inflation. Biden recently insisted that “inflation is worse everywhere but here.” But that’s not true. Implementing solutions to inflation requires leaders willing to accept responsibility and face reality. https://t.co/tpiS74zuNG
1,2022-06-25 23:00:26+00:00,1540832319321346051,It’s an honor to have the endorsement of former Congressman and King County Sheriff Dave Reichert and have him leading as chair of this campaign. #FlipThe8th https://t.co/SrDAnEOJZx
2,2022-06-25 20:00:06+00:00,1540786933496008704,The 8th congressional district ranks as one of the top four races that will determine whether a #redwave happens in 2022. We can #FlipThe8th this November. But it’s going to take hard work. Will you sign up to volunteer today? https://t.co/zbnVcdvXeR
3,2022-06-24 19:00:19+00:00,1540409503585370119,"Democrats’ spending sparked runaway inflation. Now Americans face the consequences of rising interest rates. A rate hike from 3% to 6% on a 30-year fixed mortgage for a home priced at $500,000 will cost the avg buyer $256,000 more over the life of the loan
https://t.co/NXJsGjei4B"
4,2022-06-23 22:13:27+00:00,1540095718312099841,"With the support of far-left politicians like Kim Schrier, the Biden Administration has overseen the largest increase in gas prices ever recorded. Calculate how much more you will pay for your summer road trip compared to last year. https://t.co/zjavIUNmfr"
5,2022-06-23 01:01:00+00:00,1539775496619171840,"Earlier this year, a reporter asked Biden what he is doing about gas prices. Biden said, “Can’t do much right now. Russia’s responsible.” Biden went on to cancel 3 oil &amp; gas lease sales. Putin’s war on Ukraine exacerbated a problem that Biden created &amp; made worse. #FlipThe8th https://t.co/OkciIpMoq3"
6,2022-06-20 16:00:30+00:00,1538914700813008897,"Kim Schrier accepted $5,000 from socialist AOC’s PAC. Schrier wants voters to believe she's a moderate. But she’s among a handful of candidates, including socialists primarying incumbent Dems, to have received a contribution from AOC in the last 2 years. https://t.co/h4ZVQ4IWus"
7,2022-06-20 01:31:20+00:00,1538695967083487239,"On #Juneteenth, Americans celebrate the emancipation of slaves. We remember the horrors of slavery and honor those who fought for its abolition. Today reminds us of the dearness of our freedom, made even more precious by the sacrifices made to see freedom extended to all. https://t.co/mK0U1ZyUr4"
8,2022-06-19 15:31:58+00:00,1538545129874661377,The most important role in my life is being a father to my beautiful children. Happy Father’s Day! https://t.co/QIf3q23dw1
9,2022-06-17 17:00:30+00:00,1537842634810880001,"A border security consultant: “Border agents are not getting the support they need from the federal government to stop the flow of fentanyl, which is killing thousands of Americans.” Congress must re-direct funding toward hiring &amp; retaining border agents. https://t.co/9A5bRcO1ta"
10,2022-06-16 15:30:10+00:00,1537457514693943299,"I had a great time at the Maple Valley Parade last weekend. It was opportunity to speak with voters – the best part of being on the campaign trail! If there’s one common feeling among voters, it’s that our nation is on the wrong track. I’m running to change that. #FlipThe8th https://t.co/URmpi8T6zz"
11,2022-06-15 21:00:12+00:00,1537178180595105792,"Inflation numbers came in worse than expected by experts. Americans now face 8.6% inflation with goods like fuel up 107% and groceries up 11.9%. With over 60% of Americans now living paycheck to paycheck, we cannot afford the left's incompetent leadership. https://t.co/3jIn5diNcd"
12,2022-06-14 23:00:07+00:00,1536845970956333061,"On this day in 1777, the United States adopted the design of our first national flag. Today let’s commemorate the symbol our flag has become of freedom and liberty around the world. #NationalFlagDay https://t.co/FdnUAC8bvi"
13,2022-06-14 15:45:06+00:00,1536736495171784705,"It was an honor to recently speak at WSRP's Freedom Rally. I enjoy every opportunity to chat with voters. From inflation to rising gas prices, families are struggling. It’s never been more important to eliminate wasteful spending &amp; unleash American energy production. #FlipThe8th https://t.co/f634DZ7NS0"
14,2022-06-12 19:00:07+00:00,1536060799344689152,Voters will begin to receive their ballots in the mail in one month. Will you help me reach more voters by signing up to volunteer on my campaign? https://t.co/zbnVcdvXeR
15,2022-06-11 20:00:06+00:00,1535713505097162755,"Last week, WACOPS endorsed my campaign for the same reason as law enforcement leaders like Kittitas County Sheriff Clay Myers. They know I am the candidate that will fight for law enforcement in Congress. Will you join them in endorsing my campaign today? https://t.co/AfntTLJWuv"
16,2022-06-10 19:00:27+00:00,1535336107163910145,"Inflation reached 8.6% in May. Despite its continued acceleration, House Dems like Kim Schrier are still passing spending hikes. Just this week, Schrier voted to sneak in a 9% increase over current spending for FY 2023 in an unrelated bill. A WaPo reporter breaks down the impact: https://t.co/bEVhMTDM6g"
17,2022-06-10 16:00:40+00:00,1535290860723634178,"During the last year, Border Patrol hired 200 less agents than those who retired or resigned. The shortage of personnel poses a serious challenge to the security of our nation. Our national leaders must re-prioritize funding toward recruiting and retaining border patrol agents. https://t.co/1WTmGSMpxy"
18,2022-06-08 00:00:08+00:00,1534324360080764928,"KPQ News in Central WA conducted a straw poll for the 8th primary. Continuing my winning streak, I won with 60% of the vote. Skyrocketing gas prices deliver an outsized blow to rural communities. Voters need a change – and I’m honored to have their trust to deliver in Congress. https://t.co/W2LQKD3zVV"
19,2022-06-07 20:36:26+00:00,1534273096483590145,"I had a wonderful time attending a meeting hosted by the Chelan County GOP last weekend. To everyone who attended, I’m grateful that you took the time to come out. It was a pleasure meeting you all! https://t.co/rcan8UroeG"
20,2022-06-05 20:59:37+00:00,1533554156430151681,Team Dunn was out in force at the Duvall Days Festival this weekend! Thank you to everyone who volunteered to make the event a success! https://t.co/0ZMMgGau9l
21,2022-06-05 19:00:06+00:00,1533524079776616449,We are two months away from the August 2nd primary. This race is heating up – and I need all the help that I can get. Will you consider volunteering on my campaign today? https://t.co/zbnVcdvXeR
22,2022-06-03 20:18:38+00:00,1532819065974272001,"With gas prices soaring, the Biden Admin is canceling domestic oil-lease sales. At the same time, they are turning to a hostile foreign dictator with a record of serious human rights violations for oil. Our national leaders are failing American families. https://t.co/PSpayrlI1w"
23,2022-06-02 22:49:10+00:00,1532494562215841807,"This is grave example of the fact that horrible policies, like defunding and disparaging the police, lead to horrific consequences.  It’s time for leaders to put public safety above partisan rhetoric and re-fund our police.

https://t.co/mSAEOEtPkl"
24,2022-06-01 18:19:36+00:00,1532064337061220353,"I’m grateful for the support of law enforcement officers &amp; WACOPS. As a King County Councilmember, I’ve pushed to RE-fund our brave men and women who keep us safe. As a Congressman, I’ll take that same approach to DC &amp; fight attempts to undermine them.  https://t.co/QiZfPoisd2"
25,2022-05-31 23:07:22+00:00,1531774366530383873,The crime wave doesn’t just impact cities like  Seattle. Suburban communities also suffer the results of anti-law enforcement policies. It’s time for Congress to prioritize funding specifically for hiring police officers to account for personnel shortages. https://t.co/A3wlNiiWJz
26,2022-05-30 16:00:47+00:00,1531304626179514369,"On #MemorialDay, we honor the men and women who made the ultimate sacrifice in service to our country and in defense of the freedoms that define our nation. We are the home of the free because of the brave. Today and every day, let’s honor our heroes. https://t.co/Ybfadn3Uda"
27,2022-05-29 22:15:39+00:00,1531036574498009088,"Congress must act to stop the purchase of American farms by the Chinese government. The purchase of American farmland by foreign entities is alarming for our food security, but hasn't received the attention it deserves. Here’s a report from a local outlet. https://t.co/Km95yfch8S"
28,2022-05-28 19:00:12+00:00,1530625000742567937,"I’m celebrating my birthday today with friends &amp; family. During the last few months, their support has made all the difference in my run for Congress. Can I count on your support today? I hope you’ll consider helping #FlipThe8th by signing up today! https://t.co/zbnVcdvXeR"
29,2022-05-27 20:03:03+00:00,1530278428972294146,"The best part of being on the campaign trail is meeting voters, touring small businesses, and hearing about the issues that impact them. Thank you to everyone in Chelan who took the time to meet with me the other day. I’m honored to have your support! https://t.co/EQk0mPtynG"
30,2022-05-23 16:00:40+00:00,1528767879730057216,"May is #MilitaryAppreciationMonth. With just over one week left, please join me in honoring those who serve and sacrifice for our country. Our men and women in uniform deserve our gratitude for their courage in protecting us and safeguarding our nation’s values. https://t.co/BvRGw3i7xK"
31,2022-05-22 19:00:08+00:00,1528450656071213057,This race is heating up. We can #FlipThe8th from blue to red this November. But we need help. Please consider signing up to volunteer today! https://t.co/zbnVcdvXeR
32,2022-05-21 20:00:05+00:00,1528103356710932480,Most Americans agree – it’s time to implement bans or tighter restrictions on Members of Congress trading stocks. Congress must act to eliminate the possibility of financial conflicts-of-interest. #stockmarket #commonsense
33,2022-05-19 15:30:06+00:00,1527310638477103104,"As inflation continues to rise, 2/3rds of Americans live paycheck to paycheck. We cannot continue down the path of reckless spending; we must cut government waste. American families cannot afford 2 more years of uncontrolled inflation &amp; skyrocketing costs. https://t.co/gd3k9rorBG"
34,2022-05-18 18:07:39+00:00,1526987898876198912,"Nearly 108,000 Americans died from a drug overdose in 2021, up 15% from the already record-breaking number of deaths in 2020. As deadly fentanyl continues to pour across our unsecured border, Congress must act to ensure our border patrol have the resources they need fight back. https://t.co/0mvJim8Tdi"
35,2022-05-17 22:21:12+00:00,1526689316113612802,"Our nation is facing a baby formula shortage. This isn't a crisis that suddenly happened – it’s months in the making. Yet, the Biden Administration has been unacceptably slow to take commonsense action like easing regulations to help import safe formulas. https://t.co/eZT0Ys2OJc"
36,2022-05-16 16:30:05+00:00,1526238569949437953,"Last month, the WA Department of Health reported 1,134 residents died from fentanyl overdoses in 2021. Overall deaths from fentanyl increased 845% in the past 5 yrs. We must secure our borders &amp; fight against the illicit drugs flooding our communities. https://t.co/e28wsiAxi1"
37,2022-05-15 19:00:08+00:00,1525913942215696384,The race to #FlipThe8th is heating up – and my team will need all the help that we can get. Will you consider signing up to volunteer on my campaign? https://t.co/zbnVcdNy6p
38,2022-05-14 20:00:05+00:00,1525566642083831810,"Wages have increased 5.5% but inflation is at 8.5%. No matter how the Biden Admin &amp; supporters like Kim Schrier attempt to spin the numbers, real wages are down. American families are hurting. We need leaders who are serious about stopping inflation-causing spending. #FlipThe8th"
39,2022-05-13 23:00:05+00:00,1525249550868430849,"There’s still time to show your support for our police officers. Order your free “Re-fund the Police” sticker and display it proudly! 
https://t.co/aaK39vHApP"
40,2022-05-13 17:00:41+00:00,1525159105148735488,The Biden Administration and supporters like Kim Schrier did a great disservice to American families when they insisted that inflation was “temporary” last year. Let’s hold them accountable this November. #FlipThe8th https://t.co/PraeU98Bsm
41,2022-05-12 17:08:07+00:00,1524798588840198151,"I recently won a straw poll of primary voters! It’s a great privilege to see such a convincing demonstration of enthusiastic grassroots support. Our message of re-funding the police, reducing inflation and restoring energy independence is resonating on both sides of the Cascades. https://t.co/p4KFhnYfJr"
42,2022-05-11 16:00:38+00:00,1524419216073441280,The avg price for a gallon of gas is $5.02 in King County. It’s over $4.80 in both Kittitas &amp; Chelan counties. Gas prices are unaffordable &amp; the steady increase is unsustainable. We must unleash the power of American energy production &amp; return our nation to energy independence. https://t.co/H4g6yIgki4
43,2022-05-10 20:46:35+00:00,1524128791941070848,"This morning, Americans woke up to surging gas prices &amp; a President blaming others for runaway inflation. It's a damaging example of refusing to take responsibility that far-left politicians like Kim Schrier follow, while Americans suffer the consequences. https://t.co/3nRxooovZB"
44,2022-05-10 15:00:14+00:00,1524041628599660544,May is Asian Pacific American Heritage Month and this year’s theme is “Advancing Leaders Through Collaboration.” Take a moment to recognize the incredible contribution of Asian Americans to our nation today. https://t.co/65FzV1Azdz
45,2022-05-09 15:30:07+00:00,1523686762333286403,"Kim Schrier wants to distance herself from Biden’s failed handling of the #bordercrisis. The problem? She voted for his policies. Securing our border requires sending all-talk-no-action politicians like Schrier into retirement this November. #FlipThe8th 
https://t.co/4YPNqddTHH"
46,2022-05-08 17:00:25+00:00,1523347099190165505,My mother is my hero and inspiration. Happy Mother’s Day! https://t.co/T6f6X4AjdB
47,2022-05-07 21:00:05+00:00,1523045026301104128,"Our police officers need a public show of support, so I’m giving away free “Re-fund the Police” stickers! Sign up to get yours and display it proudly! https://t.co/YIh6b8gsuI"
48,2022-05-07 17:00:19+00:00,1522984687479705600,"I’m so incredibly honored to have the support of so many friends who have faithfully served Kittitas County over the years. #WA08
https://t.co/Mxn86oOXTe"
49,2022-05-06 16:00:44+00:00,1522607301550657536,"Together, Biden and Kim Schrier have led us straight toward painful inflation and unprecedented gas costs – and they aren’t in a hurry to change course. https://t.co/mVnLTEJ1Ig"
50,2022-05-05 19:12:41+00:00,1522293221707198466,"Yesterday, Janet Yellen finally admitted that Biden’s spending drove inflation. American households are losing thousands of dollars a year due to inflation caused by out-of-control gov spending. We need leaders who are serious about bringing down the cost of living. #FlipThe8th https://t.co/4H7KeHWPAn"
51,2022-05-04 19:35:24+00:00,1521936551109959683,"Kim Schrier released a poll asking voters what they want Congress to prioritize. Unbelievably, she left out skyrocketing inflation and rising gas prices. Schrier is out-of-touch – and it’s no wonder she supports even more inflation-causing spending. https://t.co/93FhTw8Bar"
52,2022-05-03 23:48:27+00:00,1521637843063521281,"The economy is contracting &amp; costs are going up. Americans are dealing with a GDP of -1.4% &amp; an inflation rate of 8.5%. In 15 months, far-left policies destroyed hopes of economic recovery following pandemic lockdowns. We cannot afford 2 more yrs of failed leadership. #FlipThe8th"
53,2022-05-02 16:30:05+00:00,1521165138082119682,"Customs &amp; Border Protection estimate more than 300,000 known “gotaways” at our southern border since the beginning of FY 2022. The estimate for FY 2021 is 400,000. Our border agents are overworked &amp; overwhelmed– repealing Title 42 only makes matters worse. https://t.co/I0DHjlFWJj"
54,2022-05-01 20:00:04+00:00,1520855593900462081,"Will you add your name to my growing list of supporters? As a member of the King County Council, I’ve consistently stood against reckless spending and higher taxes. I’ll continue my commitment to responsible budgeting as a Member of Congress. #FlipThe8th https://t.co/ZujkUFZGcu"
55,2022-04-30 21:00:04+00:00,1520508306262999040,"When given the opportunity in 2021, Kim Schrier voted AGAINST a motion to condemn the radical ‘Defund the Police’ movement. With crime rates reaching record highs due to anti-law enforcement legislation, voters cannot trust Schrier to #backtheblue. https://t.co/uXxDoIFEFA"
56,2022-04-29 15:00:15+00:00,1520055367832678400,I’m ready to hold the line against more reckless spending as a member of Congress. People don’t have to wonder how I’ll vote in Congress. They know I have a proven record of consistently voting against tax increases and reckless spending. #FlipThe8th
57,2022-04-28 17:00:24+00:00,1519723216029327360,"Referring to her party’s unprecedented spending, Kim Schrier admitted she “knew that there was a possibility that this could lead to inflation” last June. Unbelievably, Schrier still supports trillions more in spending. #TBT https://t.co/m8AA1F9HjP"
58,2022-04-27 19:30:07+00:00,1519398507077148678,"Taxpayers deserve full transparency on how government spends their money. As a King County Councilmember, I’ve championed transparency by pushing measures that task the Assessor’s Office with sending property owners a complete breakdown of county spending. https://t.co/VhoClAOdoN"
59,2022-04-25 16:00:33+00:00,1518620991412445185,Far-left politicians in D.C. appear determined to ignore the biggest challenges facing Americans. Perhaps the least-recognized challenge – China buying U.S. farmland – may have serious food security implications in the future. Congress must act now. https://t.co/CLi22tOEUg
60,2022-04-24 19:00:06+00:00,1518303788792258561,Fatal overdoses among US teens is increasing at alarming rates as a result of deadly fentanyl-laced counterfeit pills. Our national leaders cannot continue ignoring the #opiodcrisis. We must act to educate our youth &amp; stem fentanyl crossing our borders. https://t.co/lJSV7kClSS
61,2022-04-23 19:00:10+00:00,1517941416114245632,"It’s the duty of elected officials to champion public safety. Last week, I called for a summit to bring together everyone responsible &amp; effected by our failed regional justice system to resolve our differences &amp; restore public safety. We must act. https://t.co/3Y1p0vz1JL"
62,2022-04-22 21:00:09+00:00,1517609223147896832,"Kim Schrier has yet to publicly condemn the “defund the police” movement. But she has backed legislation that makes law enforcement officers’ jobs more difficult. With crime rates surging in King County, voters cannot trust Schrier to prioritize public safety. #FlipThe8th https://t.co/kA1l57x4JN"
63,2022-04-22 15:30:09+00:00,1517526176134275073,Technological innovations – spurred by the free market – offer more effective solutions to environmental challenges than government can ever hope to force. #EarthDay https://t.co/tiZVbTWHqW
64,2022-04-21 22:00:08+00:00,1517261933124202497,"Unprecedented spending backed by out-of-touch politicians like Biden and Kim Schrier caused the highest inflation in a generation. Though working families are now struggling to make ends meet, Biden and Schrier are pushing for even more trillions in spending. #FlipThe8th https://t.co/oBF6fWiEpS"
65,2022-04-21 00:04:17+00:00,1516930787140067329,"Biden is planning to end Title 42 with no plan to handle the expected surge at the border, worsening the out-of-control #bordercrisis. Given her 100% voting record with Biden, it’s unlikely Kim Schrier will do anything to actually reverse this terrible decision, but she should."
66,2022-04-19 19:00:25+00:00,1516491928254169090,I really enjoyed attending the Kittitas County GOP’s spring gala the other week at the beautiful Sweetwater Ranch in Ellensburg. It’s always great to be in a room full of people ready to #FlipThe8th – especially with friends like Senator Judy Warnick! https://t.co/qnyNKKy26I
67,2022-04-18 16:00:28+00:00,1516084253481656325,There’s no better day than #TaxDay to review how government is spending your hard-earned dollars. Billions of taxpayer dollars go to waste every year on absurd projects and senseless expenses. Americans deserve more commonsense leaders willing to #stopthewaste. https://t.co/1gN3P4peXt
68,2022-04-17 15:00:14+00:00,1515706707158179844,"Wishing everyone an Easter filled with hope, peace, and renewal. Many blessings to you and your family! #HappyEaster https://t.co/ro8uFFyqEh"
69,2022-04-16 19:00:08+00:00,1515404692796456972,"I’m running for Congress to relieve the burdens faced by everyday Americans, like crippling inflation triggered by reckless spending, rising crime caused by de-funding our police, &amp; a largely ignored opioid crisis made worse by unsecured borders. https://t.co/bv4ayMt24Y"
70,2022-04-15 14:00:21+00:00,1514966864388055041,Chag Pesach Sameach! (Happy Passover Holidays!) https://t.co/9g18OCQ1BS
71,2022-04-14 16:00:31+00:00,1514634717533986817,"Unprecedented spending sparked the highest inflation in a generation. Despite the pain felt by millions of Americans, Democrats in Congress are attempting to revive their latest trillion-dollar spending bill. Americans cannot afford 2 more years of reckless, far-left policies. https://t.co/OWYHnHQ4A5"
72,2022-04-14 00:27:38+00:00,1514399946673463300,It shouldn’t come as a surprise that failure to enforce the law results in higher crime rates and – in the case of fare evasion on Sound Transit – unsustainable costs. Elected officials have a duty to uphold the rule of law. Fox News report: https://t.co/UHHoJeUKJl https://t.co/z1jFqJgfG9
73,2022-04-13 16:00:43+00:00,1514272377605140486,Inflation is wiping out wage growth &amp; burdening American families at painful levels. Yet far-left politicians in D.C. are renewing their push for trillions more in inflation-causing spending. We cannot afford 2 more years of out-of-touch leadership. #FlipThe8th https://t.co/dTRmFpvVcU
74,2022-04-12 15:30:07+00:00,1513902291824300037,"As the DEA warns of a “nationwide spike” in fentanyl-related overdoses, it’s worth noting that our national leaders refuse to #secureourborder. Congress must act to give overwhelmed Border Control agents the tools they need to help fight the #opiodcrisis. https://t.co/1HNCL543pm"
75,2022-04-11 17:36:24+00:00,1513571681268387850,The Seattle Public Safety Index reached a new low last week as the violent crime rate continues to rise and police officers continue to leave the Seattle Police Department. It’s long past time to stop the far-left’s anti-law enforcement agenda and re-fund the police. https://t.co/rGoZFeWurB
76,2022-04-08 15:30:09+00:00,1512452746355556352,"Despite attempts by some politicians to downplay the crisis, 85% of voters are concerned about rising crime. And they should be – irresponsible, anti-law enforcement policies pushed by far-left politicians caused the crime surge. We need leaders who will #BackTheBlue in Congress. https://t.co/1K435E23IY"
77,2022-04-06 19:00:20+00:00,1511780865155682316,Fentanyl poisoning is the leading cause of death for Americans aged 18-45 years old. Congress must act now to give law enforcement the tools they need to fight this tragic epidemic facing communities across our nation. #OpiodCrisis
78,2022-04-05 16:00:31+00:00,1511373225883750401,The 50-year-old man accused of killing Everett Police Officer Dan Rocha had at least 18 felonies &amp; 51 previous arrests on his record. This horrific killing serves as yet another painful reminder that we must end soft-on-crime approaches to law enforcement. https://t.co/Xc8L3p67yV
79,2022-04-03 18:00:10+00:00,1510678560553545730,Runaway #inflation is due to reckless spending supported by D.C. politicians like Kim Schrier. Regaining economic security requires a complete change of leadership. We cannot trust the same politicians who got us into this mess to lead us out. #FlipThe8th
80,2022-04-02 23:30:06+00:00,1510399202324529159,"A former state legislator, Congressman, and WSDOT Secretary, Sid Morrison faithfully served the people of Eastern Washington for decades. I was honored to have him attend my recent official campaign launch in Cle Elum last Saturday. https://t.co/ZQCVjwbc6a"
81,2022-04-02 19:00:06+00:00,1510331257229565955,"April is National Volunteer Month. Flipping the 8th from blue to red requires the support of volunteers like you. Will you consider volunteering your time on my campaign?
https://t.co/zbnVcdvXeR"
82,2022-04-01 18:30:08+00:00,1509961326378065921,"Record-high gas prices may feel like a #AprilFoolsDay joke – but it’s not. Last week, the average cost of gas in King County reached $4.93/gallon. That’s unsustainable. Let’s send leaders to Congress who will #restoreenergyindependence by unleashing American energy production. https://t.co/2y9J8Yx7ay"
83,2022-03-31 23:30:05+00:00,1509674423590309891,A special thank you to former Congressman Doc Hastings for his endorsement of my campaign. I was honored to have him introduce me at my official campaign launch in Cle Elum. He set an example of dedicated service to his constituents &amp; I hope to follow it as a Member of Congress. https://t.co/Y4llCgo3tz
