,Created at,User ID,Text
0,2022-06-16 13:00:05+00:00,1537419744730415106,"The more tweets I read, the more I realize my family is normal. 
Just sayin', the world has gone over the edge. Thankful for the life God has allowed me to live so far. 
It has been a rather peaceful, calm and pleasant life."
1,2022-06-16 12:53:54+00:00,1537418186294841344,"@KandissTaylor Don't you just love people who thinks a woman ask a question because she is looking for an answer? 
Women never ask a question that they don't already know the answer to...
Sarcasm is good though &amp; personally I like this approach."
2,2022-06-16 00:23:30+00:00,1537229344665309184,"@BrianKempGA @burtjonesforga GA Republicans are only working hard to cover their crime ring.

AUDIT THE PRIMARIES
HAND COUNT EVERY VOTE IN EVERY COUNTY

THERE IS NO WAY GA VOTED FOR THIS LOSER"
3,2022-06-16 00:22:14+00:00,1537229022731460613,RT @JackPosobiec: BREAKING: Bannon announces he will subpoena Nancy Pelosi and Adam Schiff to testify at his trial
4,2022-06-16 00:21:48+00:00,1537228917416742912,"@GeorgiaLogCabin He has gotten by with hiding his own, why not move on to hide other crimes within the family?

When there is no justice, crime increases, yet still nothing gets done."
5,2022-06-16 00:19:56+00:00,1537228446027288576,"@Emma89572703 Exactly why my oncologist told me not to get the vaccine.

I ended up with my cancer going out of remission without the vaccine anyway.

Either way, I trust GOD more than &gt; trust medicine. HE gave me life &amp; HE is the only one who will take my life.

I am a winner either way!"
6,2022-06-16 00:17:46+00:00,1537227901027831808,"The US DOLLAR is the biggest ponzi scheme.

Just saying, FACTS MATTER https://t.co/HFvIA2ffHC"
7,2022-06-15 23:21:10+00:00,1537213657800552450,"The Biden year's will be remembered by

#TAMPONGATE https://t.co/A5WbH0ZKI5"
8,2022-06-15 23:18:58+00:00,1537213104492204032,"The year of #TAMPONGATE
#MONKEYPOX
#BABYFORMULASHORTAGE 
Say high
#gasprices creating the
#stockmarketcrash 

PROUD TO BE AMERICAN, embarrassed by our government 
#FJB"
9,2022-06-15 03:37:18+00:00,1536915725658497030,@PapiTrumpo Happy birthday to my favorite President
10,2022-06-15 03:33:59+00:00,1536914890417479686,RT @catturd2: Yuuuge happy birthday to President Donald J. Trump.
11,2022-06-15 03:31:26+00:00,1536914249678831616,RT @realTonaldDru14: @drdavidsamadi LGTBQpox
12,2022-06-15 03:27:44+00:00,1536913319851962368,"They must only have a 1st place is the worst place prize.
God knows Joe Biden only got 1 supporter. They fly that 1 supporter in &amp; Joe thinks he is meeting someone new, in a new place every single week.

Just sayin', ain't nobody in America stupid enough 2 support Joe.

#FJB https://t.co/nAqRjltz9c"
13,2022-06-15 03:11:20+00:00,1536909193042612225,"Sounds like a beginning of those Red Flag 🚩 gun laws already being out to use against political opponents or opposing parties.

Yep, just what we need to have a more secure, fair and fraud free election...

Especially, in GA 😂🤣 https://t.co/q0x26CHibS"
14,2022-06-13 22:06:50+00:00,1536470172613021696,"RT @realTonaldDru14: @RBReich The only coup was orchestrated by Leftists beginning 1/21/17. Brennan, Clapper, Comey, McCabe, Clinton &amp; at l…"
15,2022-06-12 17:45:08+00:00,1536041925903585280,"@RDByGodMercer Beautiful place, sure wish I was there"
16,2022-06-10 00:17:36+00:00,1535053529936691214,"@realLizUSA Unfortunately, nothing is being done by the GOP. The RINO'S have completely destroyed the GOP.

We can't even get fair primaries in GA. 

Too bad this is how it ends...
Our Country had so much potential. Now we reap what was has been sown."
17,2022-06-10 00:13:01+00:00,1535052378805764104,"Schumar meant the same thing he meant when Schumar threatened Trump with the same words...

Look what the GOP is still allowing the left to get by with! https://t.co/zQdlFVqCAl"
18,2022-06-10 00:01:11+00:00,1535049398182354946,"Actually there was 149 house Republicans that voted for RED FLAG GUN LAWS &amp; DRAFTING WOMEN.

I HAVE THE LIST, YOU CAN'T GET BY WITH LYING TO US ANYMORE

@GOP WE WILL NOT FORGET HOW YOU COMPLIED TO TAKE AWAY OUR 2A RIGHTS &amp; DRAFT OUR DAUGHTERS! https://t.co/4WuMGFLeFh"
19,2022-06-09 23:57:02+00:00,1535048357164482591,"RT @Jentezen: The storm isn’t meant to destroy you, it’s meant to show you who God is. #OvercomingBook https://t.co/VEq4DodXSh"
20,2022-06-09 23:55:55+00:00,1535048074120548352,"I would rather see a prime time hearing that gets to the truth of COVID-19 origins, Dr. Fauci, CDC, the WHO &amp; all the people who were killed from the lies told &amp; proper medications being withheld from WE THE PEOPLE https://t.co/7o9fkFUqIu"
21,2022-06-08 20:58:03+00:00,1534640923786629120,"What a difference this world would be, if WE as a nation cared more about GOD'S PLAN &amp; directions, than we did about ""pop culture, politics &amp; popularity"".

Just my thoughts, GOD HAS A BETTER PLAN https://t.co/LHqeKUCp7n"
22,2022-06-08 20:55:59+00:00,1534640403231625218,"I believe we all forget, at some point and time, exactly where our lives were when GOD made a difference &amp; set us on a new path. https://t.co/Z1eqdykNRj"
23,2022-06-08 20:53:44+00:00,1534639839982678016,"@KandissTaylor Not sure how far you are, don't think it is too far, go to Folly Beach if you have the time. It is kind of secluded. They have a neat little community, independent shops and restaurants, on it's own little ""island"".

Just a very peaceful place. One of my favorite get aways"
24,2022-06-07 18:23:48+00:00,1534239718929444864,"It worked when everyone lied and told everyone how great General Flynn was...

It resulted in the coup of a duly elected president &amp; seems to be working to bring about the NWO plans with the democrats.

Did u forget Flynn is a Democrat?
nah, you just hope we forgot. https://t.co/zpIVMS5BXi"
25,2022-06-07 18:17:04+00:00,1534238025806274560,"Pelosi, Flynn and the anonymous group, now known as antifa.

Just sayin', https://t.co/DgUgUal3Iu"
26,2022-06-07 18:15:41+00:00,1534237676441772032,Speak TRUTH anyway https://t.co/DlVPZhUQER
27,2022-06-06 23:43:41+00:00,1533957832676089857,RT @KandissTaylor: Hand count the paper.
28,2022-06-04 03:31:02+00:00,1532927884599234560,"RT @PastorJohnHagee: When we see evil, we should call it what it is and not blink. There is only one God, and there is only one way to Him;…"
29,2022-06-03 13:13:30+00:00,1532712078732980224,"@GARepAssembly BTW WHERE ARE THE CERTIFICATIONS ON THESE MACHINES?

FORENSIC AUDIT THE TABULATORS AND ALSO FIND OUT WHY THERE WAS A SOFTWARE UPDATE, OR 4 SCRIPT CHANGES ON MAY 20TH, DURING EARLY VOTING.

THEN GET THE RECERTIFICATIONS, FROM MAY 20TH-MAY 23RD AS THAT IS STATE LAW. UPDATES=RECERTS"
30,2022-06-03 13:10:02+00:00,1532711203939659777,"@GARepAssembly There are a lot of discrepancies.

EVERY county should do a hand recount, with observers present and video taken.

As a GA VOTER, I am PISSED at this continued cheating and I am advocating and pushing a complete BOYCOTT IN THE FALL!

WHO CARES AT THIS POINT?

NOT THE GOP RINO'S"
31,2022-06-03 13:05:41+00:00,1532710112338403329,"Because he is getting kickbacks from the money being sent to Ukraine.

Give me 10% of 80 billion, I would think the economy was great too. https://t.co/c9t2oQm2u2"
32,2022-06-03 13:04:37+00:00,1532709842267172864,"@alexbruesewitz Last year there were 149 House Republicans that voted with the Democrats on Red Flag Gun Laws and drafting women.

List is in my tweets from the vote.

They better not vote with them this time"
33,2022-06-03 13:03:00+00:00,1532709437164560386,"We should have less vaccine and virus tracking &amp; more ballot tracking, software tracking with auto shut down if anything other than voting takes place after a machine is certified before the election

4 changes to the scripts on GA's voting machines, 05/20/22 during early voting"
34,2022-06-03 01:02:24+00:00,1532528091410464769,"This is an easy fix...

PARENTS DO NOT DONATE TO ANY POLITICAL CAMPAIGN, FOR EITHER SIDE.

INSTEAD SET UP A LOCAL FUND IN YOUR COMMUNITY TO FEED SCHOOL KIDS &amp; DONATE TO THAT. 

STOP THE ABSURDITY OF BOTH POLITICAL PARTIES &amp; TAKE CARE OF YOUR OWN COMMUNITY NEEDS. https://t.co/mlVfCOH1eP"
35,2022-06-01 23:12:46+00:00,1532138110875848704,RT @KandissTaylor: Stop mutilating children!
36,2022-05-28 03:51:47+00:00,1530396392250028032,"@KandissTaylor It's just getting started. My motto, ""never let them see you sweat"". 

God's got this!"
37,2022-05-26 06:04:02+00:00,1529704894520868864,"@GovKemp should be disqualified for human rights abuses, money laundering and child trafficking...

Not running for Gov of GA again.

I WILL NOT DISHONOR VETERANS BY VOTING IN GA'S RIGGED ELECTIONS

UNTIL WE THE PEOPLE BOYCOTT VOTING, GA WILL NEVER FIX IT'S RIGGED ELECTION SYSTEM"
38,2022-05-24 18:11:40+00:00,1529163235105984514,"@GovKemp will not only be voted out today, he will see that the people of GA WILL NEVER FORGET HOW HORRIBLE OF A GOVERNOR HE WAS &amp; HAS BEEN. HE BELONGS IN JAIL!

REMEMBER THIS IS WHO TRUMP GAVE US
BEFORE VOTING FOR DAVID PURDUE...ANOTHER KEMP RINO

VOTE @KandissTaylor for GA GOV https://t.co/jjC6NuAwik"
39,2022-05-24 18:04:10+00:00,1529161346666770432,"@austyle70 @monicaonairtalk @GovKemp I haven't dropped out, MY CANCER IS NO LONGER IN REMISSION.

WE WILL WATCH KEMP GO TO JAIL FOR ALL HIS CRIMES!

JUST WAIT N SEE"
40,2022-05-24 05:26:43+00:00,1528970730183983104,"Drain the swamp in GA, Limp Kemp got to go https://t.co/SSw1mjMHxN"
41,2022-05-24 05:06:54+00:00,1528965741579579392,"@NickAdamsinUSA I think the democrats did that in the 1970's when Carter started the Department of Education.

Wouldn't it be better to just close down the Department of Education then education wouldn't be political."
42,2022-05-24 04:54:51+00:00,1528962709055803392,"RT @PastorJohnHagee: Hope in God is faith looking at the promises of the Lord, knowing with absolute assurance that what God as done in the…"
43,2022-05-24 04:51:20+00:00,1528961826230345728,"As I have been saying for months...
No incumbents and prior RINO swamp. They need to go https://t.co/BSuDUQ6smD"
44,2022-05-24 02:45:46+00:00,1528930224062070785,"@austyle70 @monicaonairtalk @GovKemp Real maturity, such graphical imagery from a supposed vet. Guess you only uphold your oath to those that agree with you. Very sad for any veteran to be prove such"
45,2022-05-23 23:34:48+00:00,1528882166557356033,"The only thing I have ever agreed with David Purdue on:
MSM LIES &amp; INTERFERES WITH ELECTIONS.

GA'S NEXT GOVERNOR IS @KandissTaylor https://t.co/UPapyO1hod"
46,2022-05-23 23:31:18+00:00,1528881285044744197,@RedState I heard @GovKemp is at the helm. He is just waiting for David Purdue and Stacey Abrams to tell him what to do next.
47,2022-05-23 23:30:15+00:00,1528881023328477184,"@wsbtv Absolutely false.

WSB has done nothing but discriminate against the 1st Female Republican running for Governor. You must be in on the 2020 overthrow of a duly elected President.

VOTE FOR @KandissTaylor &amp; drain the swamp in GA for good!"
48,2022-05-23 23:26:17+00:00,1528880023905521664,"Neither does:
@GovKemp 
@burtjonesforga 
@GaRepublicans 

They helped Stacey Abrams, Soros, the CCP and Biden steal GA.

It's time for GA to drain the SWAMP OF RINO'S &amp; VOTE FOR @KandissTaylor https://t.co/z8IgX83vHC"
49,2022-05-23 23:23:19+00:00,1528879275197157376,"People see it!!

What people couldn't do, before now, is make Governors like @GovKemp do their job and decertify a stolen election.

Believe me, GA is changing that now with their vote, by voting for @KandissTaylor https://t.co/Wd9H9yVRYY"
50,2022-05-23 23:21:13+00:00,1528878748279316480,"Then thank @GovKemp for giving Stacey Abrams his cojones and cowering down to her. 

If Limp Kemp would've took back his cojones and stopped the steal in GA, TRUMP would still be in the WH where he belongs https://t.co/4f6j6HTc7b"
51,2022-05-23 23:19:01+00:00,1528878196065611777,"@CLambKY Don't challenge them...

Just sayin', they may just prove to you how much worse they can create division"
52,2022-05-23 23:17:30+00:00,1528877812802654209,"@Zaiken64 @mailabull @monicaonairtalk @GovKemp Exactly!

My vote is for @KandissTaylor"
53,2022-05-23 23:16:33+00:00,1528877572632748033,"@austyle70 @monicaonairtalk @GovKemp Nor should you, apparently"
54,2022-05-23 23:15:48+00:00,1528877383352082432,"@monicaonairtalk @GovKemp Both are puppets of the CCP, Soros and Hillary"
55,2022-05-23 23:14:54+00:00,1528877157455253504,RT @KandissTaylor: https://t.co/3LjBvtXktK
56,2022-05-23 23:14:02+00:00,1528876940379049984,"RT @KandissTaylor: Vote Tuesday, May 24th! Get out the vote today ❤️ https://t.co/rcEXSsk0nc"
57,2022-05-23 23:11:00+00:00,1528876177535950848,"@MurphyAJC Brian Kemp cheated, he can't beat Stacey Abrams.

Only @KandissTaylor can beat Stacey. 

Why do you think Limp Kemp bowed down to a consent decree? Stacey Abrams has the goods on Brian Kemp &amp; David Purdue"
58,2022-05-23 23:07:57+00:00,1528875410292981760,"@ajc Limp Kemp must've offered the police some incentive to make him look good before election day.

Just sayin', 2 years of increasing crime rates and today all of a sudden the police are catching all these criminals. 🤣😂"
59,2022-05-23 23:05:49+00:00,1528874874546098185,@DanielTurnerPTF @alexbruesewitz https://t.co/LsNQ2Wh0Td
60,2022-05-23 22:59:55+00:00,1528873386608304135,"Can the Flynn family speak truth, at all?

Just askin', If I knew where the bodies were buried, I wouldn't have waited this long to bring the cabal down.

Just sayin', IT TOOK YEARS TO BURY THAT MANY PEOPLE, WHY WAIT SO LONG TO PROTECT &amp; SERVE WE THE PEOPLE? https://t.co/LQPAE7BmWb"
61,2022-05-23 22:55:05+00:00,1528872170134417411,@FoxNews @elliott_correia NOW DO TWITTER
62,2022-05-23 22:51:25+00:00,1528871247341305857,"@MilenaAmit @elliott_correia Unfortunately you speak truth.

If the Governors of Texas &amp; Arizona would do their job and look after WE THE PEOPLE, they would've stopped those tractor and trailers and confiscated the formula and dispersed it to AMERICANS 1ST"
63,2022-05-23 22:49:01+00:00,1528870645857140736,@MurphyAJC Kemp is only successful at being corrupt and helping the socialist overthrow our duly elected President
64,2022-05-23 22:47:37+00:00,1528870292713615365,"@realqueenAika @KandissTaylor Actually, it just proves that the man you are referring too is a GENIUS"
65,2022-05-23 22:03:05+00:00,1528859085415714816,"@GaRepublicans 

THE CASES TAKING PLACE FOR THESE ABUSED AND TRAFFICKED CHILDREN IN GA ARE YOUR FAULT!

YOU ALL ARE GUILTY

YOU ALLOWED FRAUD, CORRUPTION, CCP, CARTELS TO INCREASE CHILD TRAFFICKING IN GA.

YOU ALL SHOULD BE CHARGED FOR THE SAME CRIME AS THE PERPETRATORS!

GUILTY! https://t.co/Ht6ONYHzNf"
66,2022-05-23 21:59:24+00:00,1528858157878874112,"@BrianKempGA 
This is your fault.
Throughout your Governorship you protected the cartels, pedophiles and CCP.

GA's child trafficking increased 30% in your first 2 years.

YOU ARE THE SWAMP &amp; YOU SHOULD BE LOCKED UP FOR CHILD TRAFFICKING https://t.co/9oB2BTmuzS"
67,2022-05-23 21:56:20+00:00,1528857386777079808,"Both of these men left many veterans, prior police officers &amp; disabled people HOMELESS while covering for the HOUSING AUTHORITY ABUSES IN THE WEST GA AREA

STOP GIVING ILLEGALS HOUSING VOUCHERS THAT BELONG TO AMERICANS 1ST!

VOTE @KandissTaylor for Governor &amp; STOP RINO SOCIALISTS https://t.co/xxXQa4OIah"
68,2022-05-23 21:52:10+00:00,1528856339421618177,"@KandissTaylor Thank you Dr @KandissTaylor for fighting for GA, when the GOP RINO establishment sold us out!

This is our last chance for FREEDOM IN GA!"
69,2022-05-23 21:49:33+00:00,1528855678520991745,@JosephJFlynn1 Just like they indicted the people responsible for 09/11?
70,2022-05-23 21:46:22+00:00,1528854877903851521,GA'S NEXT GOVERNOR https://t.co/fmVux04hKE
71,2022-05-20 21:54:01+00:00,1527769641182851072,@elliott_correia @catturd2 Just like they did in the 2020 election
72,2022-05-20 21:44:56+00:00,1527767354423136257,"Can't they just go buy their own unleavened bread and grape juice, hire them a priest and fake communion like they fake loving this country!

Just askin', cause they are so good at acting. May be they should just start identifying as something other than Catholic https://t.co/KLvpoUmC9A"
73,2022-05-20 21:42:07+00:00,1527766644973481984,"At this rate we might outa wait a few more hours &amp; then:

LOCK 'EM ALL UP! https://t.co/sy96n18SpQ"
74,2022-05-20 21:39:53+00:00,1527766083838414848,LOCK HER UP! https://t.co/dBypB2vnRa
75,2022-05-20 21:38:29+00:00,1527765732959739906,RT @SenTedCruz: President Biden doesn’t want you to see this chart! https://t.co/vdaEf3dsiI
76,2022-05-20 21:38:21+00:00,1527765697543032832,"@SenTedCruz Thanks, definitely worth sharing"
77,2022-05-20 21:26:58+00:00,1527762831700938752,"@Pjlecy @elonmusk @Shem_Infinite Absolutely absurd thinking.
It isn't a persons task to prove something based on an allegation.

It is the person who made the allegations, responsibility to prove what they say.

THIS IS STILL AMERICA

INNOCENT UNTIL PROVEN GUILTY.

What the heck is wrong with people? ABSURDITY"
78,2022-05-20 03:39:34+00:00,1527494210911232005,"The same people that claim it is disenfranchisement to require a state issued photo ID to VOTE, are the same people that want to INFRINGE upon YOUR RIGHT to buy &amp; own a gun.

Complete hypocrisy! https://t.co/DwflQmDYoF"
79,2022-05-20 03:27:04+00:00,1527491066374418433,"@democatsanddogs @KandissTaylor Because they never stop and ask GOD.

Just sayin'"
80,2022-05-18 22:36:11+00:00,1527055474629156864,@monsters_a_gogo Hope that means forever gone
81,2022-05-18 22:33:40+00:00,1527054841800949760,"@FOX5Atlanta Easy fix to resolve these crimes...

USE GEO TRACKING LIKE THE FBI DID FOR THE JANUARY 6TH PROTESTERS.

YOU KNOW, KIND OF LIKE THE MOVIE 2000 MULES, IT SHOWS WHO WAS IN THAT AREA AT THAT TIME...THEN TRACK THEM DOWN.

HOW COME OUR POLICE HAVEN'T FIGURED THIS TECHNOLOGY OUT YET?"
82,2022-05-18 22:25:14+00:00,1527052720577859584,"@1Mirror1978 @wordwhisperer The Simian monkey virus is what the scientists used to create HIV/AIDS

Kind if weird, but it is truth"
83,2022-05-18 01:57:41+00:00,1526743796561727489,RT @KandissTaylor: I won’t bend my knee to anyone but Jesus. Good luck to the establishment. I don’t believe in luck 🙃 https://t.co/KXxCOr7…
84,2022-05-15 03:29:32+00:00,1525679750240419842,"RT @KandissTaylor: UPDATE ON May 22nd RALLY THE VOTE: 

Pastor Todd Coconato will be flying in to bring us the WORD and open in prayer on S…"
85,2022-05-15 03:23:39+00:00,1525678267612680194,RT @KandissTaylor: Jesus is King. He can do WHATEVER He wants!
86,2022-05-14 12:04:36+00:00,1525446979765035009,"RT @KandissTaylor: Save, Share, and spread this flyer far and wide! Don’t miss prayer, worship, and a patriotic rally on May 22nd! https://…"
87,2022-05-13 15:40:22+00:00,1525138891833065474,"Does that also include the underhanded manipulations of corporations, business owners and other candidates who spend months undermining &amp; infiltrating other people's campaigns? https://t.co/So1OFIZUn6"
88,2022-05-12 20:11:26+00:00,1524844720857436168,"If American's were truly tired of their government, they would:

1.) Divest in all stocks, bonds, mutual funds, 401k's etc... IMMEDIATELY 
2.) After divesting, they would buy physical gold, silver, precious metals.
3.) Last close every bank account you have

END OF THE CABAL https://t.co/3dHJhe6b0y"
89,2022-05-11 16:46:46+00:00,1524430827018330112,"Probably the same 149 Republicans that voted for Red Flag gun laws and to send your daughters to war via drafts. 

Just sayin', VOTE THE RINO'S OUT OF OFFICE!

THEY HATE AMERICA AND THEY HATE YOU https://t.co/gvj2Jczbs6"
90,2022-05-11 16:42:10+00:00,1524429671445962753,"Could that be the reason I have said repeatedly to file an extension. You have 7 years to file...

Stop paying your taxes and see how far the government gets with a 7 year delay of  tax $'s from millions of Americans.

Invest, draw interest on the money yourself. Wait it out! https://t.co/cCI6HeOPmJ"
91,2022-05-10 19:21:26+00:00,1524107362772013056,"For the 1 millionth time, 

In GA DONNA BRAZIL &amp; STACEY ABRAMS GAVE THE WORD

C'MON man, pay attention. I been speaking truth since day 1.

DONNA BRAZIL &amp; STACEY ABRAMS ALSO RESPONSIBLE FOR SETH RICH'S DEMISE AS WELL.

THE THINGS I KNOW WOULD SCARE YOU https://t.co/4CuStyP1iG"
92,2022-05-10 19:17:58+00:00,1524106490310643712,"THIS IS WHAT THE RINO'S ARE MORE CONCERNED WITH...

THAT THEIR 50 SPAM MAILS A DAY AIN'T REACHING YOU 

THEIR DONATIONS ARE SLOW &amp; LOW...😂🤣😂

AS THE USA GOES TO 💩 THEY STILL NEED YOUR 💰 SO WHY AIN'T YOU GETTING THEIR EMAILS?

😂😁🤣😂 https://t.co/5uxvM5By5C"
93,2022-05-10 19:14:08+00:00,1524105525083865088,"RT @danielledsouzag: If you’re in political office or in the media and are silent about 2000 Mules, that tells me all I need to know!"
94,2022-05-10 19:12:58+00:00,1524105233089007616,"All these lawyers running for representatives or senators...cause they ""love"" the USA...

BS...you running for self inflation.

If you loved your country YOU WOULD BE RUNNING FOR AG OR DA AND PROSECUTE THESE CRIMINALS

But ok keep trying go convince me how much you love the USA https://t.co/XmTuUkbvJB"
95,2022-05-10 19:10:47+00:00,1524104683383451649,RT @DineshDSouza: They don’t need to storm my house. We’re happy to give them everything we have. The question is whether they will do anyt…
96,2022-05-10 19:10:10+00:00,1524104526621421568,"From the RINO'S TOO

CAN'T LEAVE OUT THE RINO'S https://t.co/q4npOUGHDD"
97,2022-05-05 21:43:44+00:00,1522331232834621440,"RT @PastorJohnHagee: It's time for those in authority in our homes, church, schools, and within our government, to close the gates of rebel…"
98,2022-05-05 21:43:15+00:00,1522331113779351554,"I haven't missed a thing this world has to offer.

Me &amp; JESUS ALL THE WAY, EVERY DAY!

LET OTHERS GO ON AND DO WHAT THEY CHOOSE. 

TOO GOD I WILL STAY TRUE! https://t.co/BhaWFFekpG"
