,Created at,User ID,Text
0,2020-06-30 16:46:58+00:00,1278007130616819712,Today is Election Day!! Make sure you vote by 7 pm and let's continue our work for the communities and families throughout the Third District. https://t.co/2TLIvR1RFN
1,2020-06-29 21:34:58+00:00,1277717220244635648,"Thank you, President Trump, for your continued support! I look forward to our work as we secure our American values and continue the fight for all in the Third District. #copolitics #MAGA https://t.co/uyeygXnyT2"
2,2020-05-18 22:07:11+00:00,1262505038087196673,"Colorado business could see a rise in unemployment insurance premiums, adding additional hardship to many of our small businesses that are struggling to get by. We must support our small businesses!  https://t.co/myYqfn79Jj"
3,2020-05-13 19:11:04+00:00,1260648776328335362,"Trump’s support of candidates will help our party take back the House of Representatives and I am proud to have the endorsement of President Trump as well. 

https://t.co/vedMiemCeO"
4,2020-05-12 17:37:08+00:00,1260262746953617408,China’s monopoly on rare earth minerals is a serious national security risk for U.S. interests and shows that burdensome regulation inhibits our ability to create jobs and secure domestic mineral production.  https://t.co/aObOu50emP
5,2020-05-02 14:59:05+00:00,1256599095780802560,Thank you Doug! https://t.co/XpTvAOEBTs
6,2019-12-20 22:28:45+00:00,1208152284963758080,Thank you you Mr. President! Looking forward to continuing our work together to make Colorado and our country stronger! #FourMoreYears https://t.co/QjyZ3pjpBg
7,2018-11-07 03:39:28+00:00,1060013841906454528,"The 3rd District has been my home all of my life, and I'm honored to have earned the opportunity to continue representing Colorado in the United States Congress. https://t.co/oKeqjNJPac"
8,2018-11-03 19:29:26+00:00,1058803357177892864,"SCOTT TIPTON LOOKS OUT FOR VETERANS
Not only did Scott Tipton get me my lifesaving surgery, the efforts of Tipton and his staff got me a better surgeon to perform my needed surgery. Thank you Scott Tipton for valuing my life and God bless you #copolitics https://t.co/NUMneuD3qh"
9,2018-11-02 15:35:22+00:00,1058382061923270656,"BUSH'S CLAIMS ABOUT TIPTON'S RECORD ARE MISSLEADING
""Rep. Scott Tipton has been accused by his opponent of not supporting American veterans. The truth is that he has always been a strong supporter of our vets."" #copolitics https://t.co/NUMneuD3qh"
10,2018-11-01 23:32:41+00:00,1058139794746667009,"Always a great time being in Pueblo and thank you to everyone who came. I had a wonderful time meeting with supporters and friends. It's too late to mail your ballots, so please turn them in yourself at your nearest voting location. #copolitics https://t.co/jYfQkwB1Hj https://t.co/zaNLczMk1w"
11,2018-11-01 18:08:29+00:00,1058058207489224704,"Our country, our state and the 3rd Congressional District are seeing economic gains obtained due to pro-growth policies including tax reform, and I'm proud my votes have put more money into the pockets of hardworking Americans. #copolitics https://t.co/imOBCJezAG"
12,2018-10-30 17:58:33+00:00,1057330932137418752,"Your voice matters in this election, so please make it count and turn in your 2018 ballots. We have a strong economy that's working for our District and I will continue fight and ensure the improvements we've made continue to grow. #copolitics https://t.co/h3fmGqmWyH"
13,2018-10-21 18:06:41+00:00,1054071489220112384,"""The Colorado Farm Bureau presented Representative Scott Tipton with its Friend of Farm Bureau Award, recognizing him for his contributions to Colorado agriculture."" #copolitics https://t.co/j20jl6Vyzq"
14,2018-10-18 23:22:48+00:00,1053063879964557312,"I'm a lifelong resident of Colorado’s 3rd Congressional District and fight hard every day in Washington to put our fellow Coloradans back to work and improve the quality of life in the 3rd District. #copolitics 
https://t.co/AajujWq5Wh"
15,2018-10-17 20:00:48+00:00,1052650658250145792,"The Democratic Socialists of America “openly propose to do away with capitalism.” My liberal opponent, Diane Mitsch Bush, financed a leading socialist publication that espoused radical beliefs just like this. Watch our new ad: https://t.co/Ume3V1OSVB    #copolitics"
16,2018-10-08 22:40:23+00:00,1049429326989484032,Thank you to everyone who came to the Pueblo Debate. We had another opportunity to hear from my opponent whose policy ideas will take us backwards. I will never stop fighting for a better future. #copolitics https://t.co/lXBGeWAe84
17,2018-10-06 01:57:56+00:00,1048391878360543232,Thanks for following along during tonight’s debate in Pueblo - visit us at https://t.co/zKGiZD7aZ7 to get involved and help the campaign #copolitics
18,2018-10-06 01:53:26+00:00,1048390747219582978,"RT @AnnaStaver: ""I don't know about you, but I'm getting awful tired of seeing dollars go to Denver to rebuild their highways."" @ScottRTipt…"
19,2018-10-06 01:32:22+00:00,1048385444679802880,"Tipton: We can be respectful as Americans, we can disagree, but we can be respectful and work our way through issues - Staff #copolitics"
20,2018-10-06 01:24:24+00:00,1048383438095409152,"Tipton: We need to stand up for our workers, our jobs, and our ability to grow our economy - Staff #copolitics"
21,2018-10-06 01:20:13+00:00,1048382384138215427,Tipton: The tax cuts are working and putting more money into the pockets of hardworking Coloradans - Staff #copolitics
22,2018-10-06 01:16:16+00:00,1048381391417667584,Tipton: It’s time for my opponent to actually explain how she plans to pay for her government takeover of healthcare - Staff #copolitics
23,2018-10-06 01:12:08+00:00,1048380350160719873,"Tipton: my opponent supports government run healthcare, consumers should have a choice, it shouldn’t be decided by the government - Staff #copolitics"
24,2018-10-06 01:04:14+00:00,1048378365730643968,"Tipton: One of the biggest issues we’ve faced is the opioid crisis affecting our district, we’ve held 37 roundtables on the crisis and passed legislation to help address the crisis - Staff #copolitics"
25,2018-10-06 00:55:08+00:00,1048376072155230208,It’s almost debate time in Pueblo! Follow along for updates during the debate and visit https://t.co/zKGiZD7aZ7 to learn more about Scott - Staff #copolitics
26,2018-10-03 20:23:10+00:00,1047582853737996290,"Liberal Diane Mitsch Bush is a career politician committed to hiking income taxes, property taxes, sales taxes, and business taxes. Watch our new ad #copolitics https://t.co/5BTfqHkH4J"
27,2018-09-18 23:48:21+00:00,1042198673570947072,"""Tipton, the Republican who represents Pueblo and the 3rd District, sent a letter to Interior Secretary Ryan Zinke in April reminding him the long-awaited pipeline is essential to Southeastern Colorado.""
https://t.co/2d2f5im4ag"
28,2018-09-18 20:37:33+00:00,1042150658726457344,"The United States Air Force celebrates its birthday today. Whenever the chance presents itself, please thank a veteran or active duty service member for their service. https://t.co/l6yM0eR8Xj"
29,2018-09-09 02:16:14+00:00,1038612009992904704,Thanks for following along during tonight's debate! Visit https://t.co/Ln63eSm6w5 to learn more #copolitics
30,2018-09-09 01:53:46+00:00,1038606358797410304,"Tipton: I support Jordan Cove, let's put Americans to work #copolitics"
31,2018-09-09 01:50:18+00:00,1038605484012404737,Tipton: I want to move the BLM out to Grand Junction so that the administrators are on-the-ground here in Colorado #copolitics
32,2018-09-09 01:48:39+00:00,1038605071167025152,"Tipton: Our farmers and ranchers are some of the best stewards of our public lands and, unlike my opponent, I support continued access to grazing for ranchers #copolitics"
33,2018-09-09 01:44:54+00:00,1038604124583948288,Tipton: Our immigration system is broken and we're working in the House to fix our broken system #copolitics
34,2018-09-09 01:35:23+00:00,1038601730554966018,"Tipton: We need affordability and accessibility in healthcare, and to protect those with pre-existing conditions #copolitics"
35,2018-09-09 01:27:30+00:00,1038599747555143682,Tipton in opening statement: We've focused on creating jobs and opportunity during my time in Congress - something we'll continue to stand for in the future #copolitics
36,2018-09-09 01:19:07+00:00,1038597637644017666,The Club 20 debate is kicking off in a few minutes - stay tuned for tweets from staff during the debate! #copolitics
37,2018-09-05 20:29:09+00:00,1037437500858355713,Craig Daily Press: Tipton Touts Progress During Campaign Visit to Craig https://t.co/z433Pgh1Og #copolitics
38,2018-09-01 00:23:38+00:00,1035684570350284800,"It was great seeing friends and supporters in Walden, and its always great when we have good conversations about the issues that matter to our communities. We're on the right track and I'll keep working hard to make sure we keep moving in the right direction. https://t.co/RRLXG6043A"
39,2018-08-30 23:05:09+00:00,1035302432706838528,It's always great to be in Craig and see friends and supporters. We had great conversations about the positive direction the 3rd district is going in and how we can keep the positive momentum going forward. https://t.co/Qr6mpbakfo
40,2018-08-30 22:58:42+00:00,1035300807976124416,"Craig Daily Press: Craig Manufacturers Visited by U.S. Rep. Scott Tipton
https://t.co/u0QXnNctMY"
41,2018-08-28 23:01:08+00:00,1034576644239847424,I had a great time in Pueblo and Pueblo West meeting with everyone all over town. The 3rd District is on the right path and we must protect the gains we've made against liberal policies that will take us backwards. https://t.co/TZ3C09pUxu
42,2018-06-25 18:32:27+00:00,1011316205947367424,EDUCATION FUNDING: Tipton’s Fix to Send More Money to Local Schools https://t.co/aaj4RFo4nC
43,2018-06-14 18:22:27+00:00,1007327421056585733,"""Western Colorado is home to vast natural resources that can and will power the economy through the 21st century and beyond if responsibly developed. It is the role... https://t.co/KF8Q4hFzXo"
44,2018-06-06 16:52:36+00:00,1004405709684072449,Tipton: Remembering the fallen and honoring their sacrifice beyond Memorial Day (column) https://t.co/vgKATBY1cA
45,2018-05-17 15:21:04+00:00,997134914851082243,Pueblo Chieftain: Rep. Scott Tipton wants President Donald Trump to press North Korea to release the USS Pueblo as part of any improvement in relations with that country. https://t.co/BB9VVmAlnj
46,2016-11-09 18:59:18+00:00,796426956875169811,A big thank you to everyone who came out and supported my campaign! https://t.co/HXTJrG2CSi
47,2016-11-08 23:02:03+00:00,796125660163043328,Today is election day! A reminder to everyone to turn in their ballots! Click on the link below to find a... https://t.co/RaeulCYEuD
48,2016-11-04 21:43:23+00:00,794656311191502850,There is too much at stake this election for anyone to sit on the sidelines. A reminder to everyone to turn in... https://t.co/si24xHpXB6
49,2016-11-04 00:28:33+00:00,794335491390894080,A reminder to all voters to get their ballots in! Ballots can no longer be received by mail so make sure you vote... https://t.co/evcp2Yav3T
50,2016-11-03 23:12:29+00:00,794316349032058887,A reminder to all voters to get their ballots in! Yesterday was the last day to vote by mail so make sure you... https://t.co/rXv68cXuPq
51,2016-11-02 21:45:30+00:00,793932067281182720,A reminder to all voters to get their ballots in! Yesterday was the last day to vote by mail so make sure you... https://t.co/2EQRqZyLnf
52,2016-10-31 21:39:38+00:00,793205817847709696,Gail Schwartz has refused to tell voters where she stands on Amendment 69. This costly measure could bankrupt our... https://t.co/N3Pm9Sw0c5
53,2016-10-24 21:32:23+00:00,790667278455046144,"""U.S. REP. Scott Tipton, R-Colo., is the clear choice for re-election to Colorado’s 3rd Congressional District... https://t.co/t33o46thOM"
54,2016-10-21 01:51:54+00:00,789283035464146944,"Scott: We need to create jobs, revive the entrepreneurial spirit, and give Coloradans the opportunity to live the American dream - Staff"
55,2016-10-21 01:37:48+00:00,789279485237432320,"Scott: The Affordable Care Act hasn't worked, we need something that works for the American people - Staff #copolitics"
56,2016-10-21 01:28:36+00:00,789277170564599812,Scott just called out Gail Schwartz for lying in this campaign and running a dishonest race -Staff #copolitics
57,2016-10-21 01:19:52+00:00,789274974892679168,Scott: My opponent has a track record of passing legislation that killed coal jobs and hurt families -Staff #copolitics
58,2016-10-21 01:14:28+00:00,789273616651132928,Scott: I have a proven track record of passing legislation with bipartisan support - Staff #copolitics
59,2016-10-21 01:09:49+00:00,789272445223964672,Scott: My opponent supported unconstitutional gun laws that resulted in the recall of state legislators -Staff #copolitics
60,2016-10-21 01:08:38+00:00,789272145964576768,Scott: Water is the lifeblood of the state of Colorado - Staff #copolitics
61,2016-10-21 01:07:49+00:00,789271941555236864,"In his opening statement, Scott identifies jobs, economy, and ObamaCare as three of the biggest issues in the campaign -Staff #copolitics"
62,2016-10-21 01:04:55+00:00,789271212811653120,Stay tuned throughout the night for updates on our debate in Pueblo - Staff #copolitics
63,2016-10-18 20:54:00+00:00,788483289585680384,I am honored to receive the Friend of Farm Bureau Award from the Colorado Farm Bureau. I look forward to... https://t.co/tFDrJWk7Un
64,2016-10-17 23:12:24+00:00,788155731669348356,"Whether it is finding common-sense financial regulation or protecting our forests and water, I will continue to... https://t.co/5TC8WnYFZ5"
65,2016-10-13 22:51:41+00:00,786700966452195330,"In many communities, a weak economy is the root of many of the problems families face. Federal regulations play a... https://t.co/6Yfa3DuGQ7"
66,2016-10-11 23:57:48+00:00,785992830074363904,"It has been a privilege working with my constituents on protecting over 100,000 acres of the Hermosa Creek... https://t.co/oeuu6o1v2m"
67,2016-10-10 22:35:42+00:00,785609783231512577,"""We cannot afford a cocooned climate change crusader in Congress, raising costs and killing jobs for hard-working... https://t.co/FL8rVKTeCx"
68,2016-10-07 20:55:10+00:00,784497316803772416,"Gail Schwartz has repeatedly defended Obamacare, saying that the system ""is working."" With rates set to rise 40%... https://t.co/hOKQEm7aEg"
69,2016-10-06 22:35:04+00:00,784160070863056901,"""Rep. Scott Tipton has shown he is dedicated to striking a balance that seeks to strengthen the economy in... https://t.co/0SpuuCJrFc"
70,2016-10-05 21:31:07+00:00,783781587980722176,"Gail Schwartz has said that the Obamacare system ""is working"". With rates set to rise 40% in some rural areas and... https://t.co/0HWRLK7X8S"
71,2016-10-03 23:50:52+00:00,783091983145238528,I am honored to represent a district that works so hard to make sure our veterans are taken care of when they... https://t.co/6bWHRURpz1
72,2016-09-26 21:14:26+00:00,780515900084539393,The short answer is Yes; Gail's policies directly led to a decline of coal production and employment in the coal... https://t.co/NkPhdO2BrT
73,2016-09-15 22:19:38+00:00,776546041940152320,It has been an honor to serve on the House Financial Services Committee.The CHOICE Act is one crucial step in... https://t.co/EcdkdJrNOJ
74,2016-09-13 00:35:18+00:00,775493021622210560,https://t.co/kPugJyEAf3
75,2016-09-12 21:48:15+00:00,775450979340726273,The Club 20 debate is always a great opportunity to highlight the key issues for this race. Thank you to everyone... https://t.co/QuyzALJlRn
76,2016-09-11 00:29:32+00:00,774766794548457473,Thanks for following along during tonight's debate - visit https://t.co/Ln63eSm6w5 to join the team #Club20 #copolitics - Team Tipton
77,2016-09-11 00:18:42+00:00,774764066866761728,Schwartz just refused to apologize to the coal workers who lost their jobs as a result of her policies #Club20 #copolitics - Team Tipton
78,2016-09-11 00:17:10+00:00,774763681154347008,Tipton to Schwartz: You didn't listen to your community when you voted to kill energy jobs #Club20 #copolitics - Team Tipton
79,2016-09-11 00:07:22+00:00,774761214287032320,Tipton: The Affordable Care Act is an oxymoron in action #Club20 #copolitics - Team Tipton
80,2016-09-11 00:05:05+00:00,774760639415803904,Tipton: Energy bills are up due to Gail Schwartz's policies #Club20 #copolitics - Team Tipton
81,2016-09-10 23:56:29+00:00,774758473732993024,Gail Schwartz is praising Congressman Tipton's work on healthy forests #Club20 #copolitics - Team Tipton
82,2016-09-10 23:55:37+00:00,774758258930102272,Tipton: We need to be proactive on good forest health #Club20 #copolitics - Team Tipton
83,2016-09-10 23:47:08+00:00,774756120690692096,Tipton: Let's put our people back to work and create American energy security #Club20 #copolitics - Team Tipton
84,2016-09-10 23:43:58+00:00,774755327375843328,Loud applause and excitement from the crowd following Scott's opening statement - Team Tipton #Club20 #copolitics
85,2016-09-08 23:15:04+00:00,774023277769523200,Why don't groups like Wild Earth Guardians et al. go to the parts of the world that truly do need to clean up... https://t.co/4kjLuIMks7
86,2016-09-08 18:51:25+00:00,773956928300945408,"The War on Coal has devastated communities like Delta County, CO. As State Senator, Gail Schwartz did not... https://t.co/2IwoEh53mf"
87,2016-09-07 01:45:13+00:00,773336287268966400,https://t.co/KdjzmpLJnF
88,2016-09-06 21:39:09+00:00,773274363889987585,"American steel is important to our economy, underpinning everything from transportation to manufacturing and... https://t.co/F7auJf1G2w"
89,2016-08-30 21:14:56+00:00,770731552632221696,"""I'm disappointed that the governor has decided to push regulations that will have a devastating impact on... https://t.co/qnukJ71ZdP"
90,2016-08-10 23:26:08+00:00,763516815158964224,Gail Schwartz and her radical environmental allies have destroyed Western Colorado communities like Craig and... https://t.co/XTp0nhtgF1
91,2016-08-09 19:08:12+00:00,763089515112239105,It has now been over one year since the disastrous Gold King mine spill. My fellow colleagues and I from Colorado... https://t.co/UUphohZp76
92,2016-08-05 21:23:58+00:00,761674129430884353,In contrast to my opponent’s misguided environmental agenda that cost Coloradoans millions of dollars in... https://t.co/YI9RmvP28u
93,2016-07-21 15:21:21+00:00,756147057358999552,"It should not be our president, but our local communities that recognize and designate land to preserve as a... https://t.co/vvpsf9aHWn"
94,2016-07-15 17:20:52+00:00,754002804767948800,https://t.co/omNSbGUF01
95,2016-07-15 16:47:49+00:00,753994490159915008,"Water Rights are the backbone of rural Colorado, providing the lifeblood for agriculture, tourism and our basic... https://t.co/0KNWyXCFQv"
96,2016-07-13 20:31:17+00:00,753325951493308417,It was a privilege to sit down with my constituents in Pueblo and Alamosa to discuss the Opioid crisis. Education... https://t.co/S8v3JoXL2S
97,2016-07-12 17:53:39+00:00,752923892008706048,I co-sponsored The Sage Grouse Protection and Conservation Act to avoid this kind of heavy-handed management from... https://t.co/6SO3fxA9KE
98,2016-07-08 19:47:43+00:00,751503047398789120,This is a good first step in addressing abandoned mine clean up. It should be followed with Good Samaritan... https://t.co/WRXE8Xc7nz
99,2016-07-07 16:16:23+00:00,751087476672913409,The heroin and opioid abuse epidemic has been spiraling out of control across rural Colorado and much of the rest... https://t.co/NMRPoMHnyG
