,Created at,User ID,Text
0,2022-06-28 21:22:59+00:00,1541894955936915459,"Ghislaine Maxwell should get LIFE in prison. 

20 years is an insult to the victims.

We need an IMMEDIATE investigation into the clients (perverts) that utilized the “services” of Maxwell &amp; Epstein."
1,2022-06-28 17:03:37+00:00,1541829684324974595,"CRT is being put into our military at a scary rate. We just found out that it is now even being taught at West Point.

We have the best fighting force in the world, but we are now doing all we can to divide them and weaken them.

Make it make sense."
2,2022-06-27 13:26:58+00:00,1541412775511166981,"The last thing Nancy Pelosi wants to deal with is a group of conservative Black and Latino Americans heading to Congress and standing up to her crazy agenda.

We’re going to give it to her, though. That will be her parting gift. Who’s with me?"
3,2022-06-25 18:03:44+00:00,1540757652547960833,"Democrats: States should be able to decide their own gun laws, even if they violate constitutional rights!

Also Democrats: States can't decide their own abortion laws, even if they aren't constitutional rights!

The law is the law; if you disagree with them, vote to change them."
4,2022-06-24 20:12:03+00:00,1540427555618045953,"Every young person needs to realize their actions have consequences and aborting their way out of it, isn't going to be the answer.

The Left has propagandized millions of young Americans into thinking that a human life is insignificant."
5,2022-06-24 14:24:42+00:00,1540340140857593859,"The law of the land in America is now LIFE! 

SCOTUS has saved millions of lives with this decision.

To God be the glory."
6,2022-06-24 12:31:36+00:00,1540311679480774656,"Now that we’ve secured this nomination for #VA03, it’s time to get a true conservative into Congress instead of do-nothing politician Bobby Scott.

I need to raise about $800k - $1.2 million to win. Can I count on your help?

Donate Here: https://t.co/gHse9XD0jD https://t.co/jResm3BZ1C"
7,2022-06-23 20:37:06+00:00,1540071472332525576,"The Supreme Court isn't forcing guns on states.

They are enforcing the US Constitution.

The Second Amendment is clear and the SCOTUS’s position is clear.

Every liberty-minded American should be celebrating today’s decision!"
8,2022-06-23 18:03:55+00:00,1540032922547326983,I’d like to take this time to thank my amazing and talented wife Jasmine. She has given me tremendous support and been a driving force of this campaign. I couldn’t have done this without her and I am so grateful to have her by my side as we push forward to November! https://t.co/zJPmTf8efb
9,2022-06-23 16:40:05+00:00,1540011825898868737,RT @LoudounCare: Virginia’s best hope! Vote Republican for Congress!! ❤️💪🏼🇺🇸 https://t.co/yX5LdsRawW
10,2022-06-22 20:29:40+00:00,1539707211139653632,Tune in LIVE @ 7pm to @kimKBaltimore’s Instagram where we’ll talk about what’s coming next in #VA03 https://t.co/VPtQzXCyMs
11,2022-06-22 18:01:36+00:00,1539669948431228928,RT @harry_taylor3: #VA03 is about to heat up. Looking forward to seeing @JenKiggans and @TerryNamkung  clean up Hampton Roads. This looks t…
12,2022-06-22 18:01:19+00:00,1539669879640301569,"RT @crsatuva: We’d also like to congratulate @yestoyesli, @Cline4Virginia, and @TerryNamkung. This is going to be a November to remember! h…"
13,2022-06-22 13:20:13+00:00,1539599137691340800,RT @PARISDENNARD: Black Republicans continue to win #GOP primaries! Congratulations to @TerryNamkung and @LeonBenjamin who won last night i…
14,2022-06-22 11:40:28+00:00,1539574034240782336,RT @ProjectVirginia: We have a nominee in the 3rd district - congratulations @TerryNamkung !
15,2022-06-22 11:40:10+00:00,1539573958240083968,RT @kimKBaltimore: @TerryNamkung Congratulations!
16,2022-06-22 11:40:05+00:00,1539573939562856448,RT @realBlakPac: @TerryNamkung Congratulations from @realBlakPac @angiewong @ygnyghtstorm @VFAForg   Veteran Patriot @VA_GOP @GOP @USHouse…
17,2022-06-22 11:40:00+00:00,1539573916380925953,"RT @America1stPact: Victory! Congrats @TerryNamkung you and your lovely wife have earned it, your team has earned it. Look out November! #V…"
18,2022-06-22 11:39:56+00:00,1539573902791192576,"RT @KLiamGray: Great work, @TerryNamkung!"
19,2022-06-22 11:39:51+00:00,1539573881652101121,"RT @LorenHubbardVA: Very proud to congratulate @TerryNamkung on his monumental win tonight!

Looking forward to taking back #VA03 with you…"
20,2022-06-22 11:39:11+00:00,1539573713640751104,"RT @KristinaKaramo: Congratulations @TerryNamkung, you will make a fantastic Congressman! #LeadRight  #VA03"
21,2022-06-22 04:27:09+00:00,1539464985528745985,"RT @WinsomeSears: Congratulations to Congressman @Cline4Virginia, Sen  @JenKiggans, @TerryNamkung, and Supervisor  Yesli Vega! #primaries #…"
22,2022-06-22 03:27:07+00:00,1539449880615305216,RT @angiewong: Congrats to @TerryNamkung for advancing to November’s General election https://t.co/1377j8uk2S
23,2022-06-22 02:59:24+00:00,1539442905198239745,RT @RichAndersonRPV: Congratulations to @TerryNamkung on his nomination tonight to carry the Republican party banner in the 3rd CD race. He…
24,2022-06-22 00:57:59+00:00,1539412349634879490,"RT @GOP: Huge win for @TerryNamkung in VA-03!  

He will help flip the House red in November! https://t.co/rWiFiYhlHV"
25,2022-06-22 00:44:31+00:00,1539408957919354880,I’m proud to declare victory in today’s Republican primary election in #VA03. Read our full press release below: https://t.co/hKVp543Lzm
26,2022-06-21 18:01:38+00:00,1539307571353247745,"Everyone, if you have yet to cast your vote today - you have FIVE MORE HOURS - the polls close at 7pm ET!

Do not miss your chance to change the direction this nation is going in!

Vote Terry Namkung!"
27,2022-06-20 20:59:58+00:00,1538990063010435072,"Here are some of the great organizations and patriots supporting us!

Will you join them tomorrow (June 21st) in voting for Terry Namkung to be the VA03 Republican nominee? https://t.co/8txKFtdoux"
28,2022-06-20 15:41:54+00:00,1538910019546136576,"Virginia, tomorrow is the day that we can begin to get our nation back on track.

Doors open at 6:00am - GO VOTE!

We have a nation to save! https://t.co/oscRaYeHAe"
29,2022-06-20 15:00:37+00:00,1538899627864469508,"America’s economy is literally coming apart at the seams.

Democrats are flooding the system with 3 MILLION ILLEGALS.

If you think it’s bad now, wait until your child can’t be seen efficiently at an emergency room because non-citizens are flooding that too."
30,2022-06-18 12:20:52+00:00,1538134649750396932,Twitter is still throttling my account.   @Twitter @TwitterSupport please stop doing that.  This is my actual account and you're suppressing my 1A rights!
31,2022-06-17 21:41:49+00:00,1537913430736183302,".@JoeBiden, you don’t need to fly to Saudi Arabia for oil!

Fly right to Middle America and reopen that Keystone Pipeline!

Fund AMERICAN energy and bring our gas prices DOWN!"
32,2022-06-17 20:50:45+00:00,1537900577346072579,"China launched a 3rd aircraft carrier, but our military leaders like Gen. Milley are busy spending time focusing on understanding “white rage” and ensuring that they’re properly woke.

The world is laughing at us… and they’re gearing up to defeat us.

Time to get smart."
33,2022-06-16 21:42:09+00:00,1537551125305610241,"We have the same oil companies we had under Trump.

Gas prices weren’t $6, $7 and $8 a gallon then.

What changed is control of the White House."
34,2022-06-16 14:08:38+00:00,1537436994254479363,"Every time someone goes and puts gas in their car, a new Republican voter is born!"
35,2022-06-15 22:44:45+00:00,1537204493208764416,"I hope you have all just taken notice of what happened with Mayra Flores's upset win in Texas's 34th District last night.

That same energy is coming to Virginia’s 3rd District.

There’s a red wave about to sweep this nation - are you ready?"
36,2022-06-14 20:11:38+00:00,1536803570279976961,"CNN showed some new polling last night that said Republicans have NEVER been in such a strong position to take back the House for over 80 years.

This is the time to flip districts like VA-03 - WE HAVE ONE WEEK LEFT!

Can I count on your support today?

https://t.co/gHse9XD0jD"
37,2022-06-14 19:16:09+00:00,1536789609782382593,God Bless America! https://t.co/Yc8KWiMieM
38,2022-06-14 17:30:56+00:00,1536763129702633473,"The same people who wanted citizens arrested for taking their kids to a playground during COVID now want those same citizens to take their kids to watch half-naked men dance around as drag queens.

Our country needs help."
39,2022-06-13 17:43:58+00:00,1536404021774364674,"The highest gas prices in history.

The highest food prices in history.

The highest inflation rate in history.

Joe Biden’s presidency is DEFINITELY breaking records for Americans, just ALL THE WRONG ONES!"
40,2022-06-13 13:21:38+00:00,1536338002611425280,"$94 to fill up my car this morning &amp; I wasn’t even on empty.

We can solve this by electing Republicans in November who actually WANT to fix the issue.

I’m running in VA-03 and I will work from DAY 1 to solve this issue for working families!

Help us win: https://t.co/gHse9XD0jD https://t.co/1u5rHxhrhg"
41,2022-06-11 15:23:11+00:00,1535643815146569728,"Unless Putin shut down the Keystone XL Pipeline and shut down all those oil leases in our nation, I’m not seeing how anyone but Joe Biden is to blame for our gas crisis."
42,2022-06-10 18:55:47+00:00,1535334933639593984,"🇺🇸 &gt; 🚩

Shall not be infringed.

Republicans who support Red Flag laws or restrictions, should be removed from office."
43,2022-06-09 18:56:33+00:00,1534972735444635660,If Biden had anywhere close to the scrutiny of the last administration his polling would be LESS THAN ZERO.
44,2022-06-09 13:56:23+00:00,1534897198118453248,"Twitter is playing games with my account as they do with yours.

I’m running for Virginia’s 3rd District and am the GOP frontrunner.

Can you all give this a RT so that we can try and circumvent this throttling they’ve got going on?"
45,2022-06-07 10:48:28+00:00,1534125131613802498,"Defending and prioritizing American family is the key to fixing so many of the issues in our nation.

A loving home will do more than any government program ever could."
46,2022-06-06 21:08:26+00:00,1533918764131045376,Never forget the sacrifice. https://t.co/n84zasYImQ
47,2022-06-06 17:51:54+00:00,1533869302864039936,"The Biden administration’s goal is to REMAKE AMERICA for future generations of socialist masses, not KEEP AMERICA FREE for the hard-working Americans who are living today.

That is why they hate the Constitution and won’t ever respect it."
48,2022-06-05 12:59:43+00:00,1533433386345418752,"Wage growth is not keeping up with the Biden’s inflation crisis.

How could it, when the whole plan seems to be BANKRUPTING AMERICA AND AMERICANS?"
49,2022-06-03 14:06:09+00:00,1532725328241729539,@JRMajewski Thank you Sir!
50,2022-06-03 11:34:00+00:00,1532687037186379780,"I never imagined I’d run for Congress. Now we are 18 days away from history being made in Virginia’s 3rd District.

Early voting is underway. Get out to the polls now!

If you want to help us win, donate to our campaign and keep this movement going: 

https://t.co/gHse9XD0jD https://t.co/zV2HgCsFVP"
51,2022-06-01 21:32:58+00:00,1532112997421809664,"The Sussman verdict comes as no surprise when you remember that NO MEMBER OF THE ELITE ever goes to jail or faces justice.

Time to remedy that in the next Congress. These people can’t get away with what they’ve done."
52,2022-06-01 16:12:36+00:00,1532032374955024384,"52 people were shot in the gun-free city of Chicago over Memorial Day weekend.

That’s ONE for every week of the year.

In Chicago, guns don’t kill people, Lori Lightfoot’s APATHY kills people."
53,2022-05-31 16:00:42+00:00,1531666990309556225,"Third world countries have baby formula but the richest country in the world doesn’t.

If you think this is an accident, you haven’t been paying attention."
54,2022-05-30 18:42:19+00:00,1531345274639208451,"Today we honor those who have fallen to support and defend the Constitution of the United States against all enemies, foreign and domestic.  Please pray for their families and honor them. https://t.co/QcO3LjNJYM"
55,2022-05-28 13:52:27+00:00,1530547554554941440,"We have a Democrat House.

We have a Democrat Senate.

We have a Democrat in the White House.

Our federal agencies are full of Democrat appointees.

There is no way to blame any of the current disaster in our nation on Republicans.

Stop trying. Start trying to fix it."
56,2022-05-26 18:22:00+00:00,1529890612048277524,"A newly-released FBI report details data which illustrates that armed citizens DO stop active shooters.

We're still following the science, right?"
57,2022-05-26 17:11:08+00:00,1529872776080904192,"I've been seeing a lot of Leftists asking why we need firearms.

Because it says so in the Bill of Rights and there's no such thing as the Bill of Needs."
58,2022-05-25 16:33:30+00:00,1529500920362455040,My heart goes out to those families reeling from the tragedy at Robb Elementary School. May God put his healing hand on you.
59,2022-05-24 18:35:22+00:00,1529169198567628800,"If we work together, Virginia can join the ranks of Florida and Texas in being conservative strongholds.

I believe we can come together to make this a reality, and that's why I'm running to flip VA-03!

Please contribute below to help make that happen!
https://t.co/gHse9XD0jD"
60,2022-05-23 17:38:00+00:00,1528792376927571968,"What started with @RepCleaver closing out a prayer with ""amen and awoman"" has now devolved into this:

Publishers have been caught changing Matthew 4:19 from ""I will make you fishers of men"" to ""fishers of persons.""

Why are we letting these people rewrite our religious texts?"
61,2022-05-23 13:41:30+00:00,1528732856977182720,"Census Bureau says it SIGNIFICANTLY miscounted population in more than 25% of states during the 2020 Census.

Undercounted in Red states like Arkansas, Florida, and Texas.

Over-counted in Blue states like Delaware, Hawaii, and New York.

Yeah. Seems like an ""accident"" to me."
62,2022-05-22 14:12:16+00:00,1528378214535553024,"Of the issues we face today, I believe protecting our children is the most important. 

We MUST do EVERYTHING we can to secure THEIR future.

That's why I'm running for Congress in VA-03!

Please RT and FOLLOW to help me grow my audience so I can fight for our children!"
63,2022-05-20 19:39:21+00:00,1527735751110234112,"NYT had to issue a correction on COVID death rates of children aged 5 to 11.

What was the correction?

They mixed up the word 'died' with 'diagnosed.'

Not 4,000 deaths — 4,000 diagnoses.

As if NYT had any credibility left."
64,2022-05-20 17:38:54+00:00,1527705437914767361,"To date, 135 teachers and aides in the U.S. are facing child sex crime charges in 2022.

When conservatives say we need to protect our children, THIS is what we're talking about."
65,2022-05-19 17:38:01+00:00,1527342826714849281,"A University in England stopped teaching sonnets because they're 'products of white western culture.'

Better get rid of your electricity and anything mass-printed too. Just to be safe.

The notion that POC can't appreciate art by anyone outside their race is racist."
66,2022-05-19 16:36:09+00:00,1527327260469911552,"GOP Senators have introduced legislation to block Biden's student loan forgiveness.

While I agree the debt should not be cancelled, this ignores the root of the issue which is the skyrocketing cost of college.

Also, I don't trust anything with @MittRomney's name on it."
67,2022-05-18 19:16:01+00:00,1527005102694858752,"Pro-Abortion extremists are threatening to murder Justices, storm the Court, and burn it down.

Mention this to a Democrat and they'll dodge the word 'insurrection' faster than George W. Bush dodged that shoe."
68,2022-05-18 18:05:51+00:00,1526987446579302400,"Ministry of Truth is gone until they repackage it elsewhere.

I bet in a year we'll have the Bureau of Alcohol, Tobacco, Firearms, Explosives, and Disinformation.

Big Government is gross."
69,2022-05-18 14:14:14+00:00,1526929155786416133,"BLM's tax documents reveal exactly how Marxist organizations run:

When you're on top you stay on top while the rest of the equals get to fight over the crumbs."
70,2022-05-18 11:40:01+00:00,1526890347485347842,In Washington I will always fight for our law enforcement to receive the training and support they need to keep us safe.
71,2022-05-18 11:40:01+00:00,1526890345782444034,This task force will be extremely beneficial to reducing crime in the 3rd Congressional District! We need to reduce crime in our district so that our children can grow up and be productive members of society. https://t.co/iOR8Sf0wnu
72,2022-05-18 03:54:33+00:00,1526773207298187264,RT @Villaverde4NC: Thanks to everyone in the @America1stPact for supporting me. God is good!
73,2022-05-16 18:10:00+00:00,1526263713845616641,"America is the greatest country on earth.

That's all. That's the tweet."
74,2022-05-16 15:03:10+00:00,1526216693126676480,"Why is the rock and roll magazine writing lies about mass shootings?

Aren't you guys supposed to embody the spirit of Antiestablishmentarianism?

Who on earth do you work for now? Who's paying you?"
75,2022-05-16 14:25:01+00:00,1526207094533373955,"Fauci says he'll leave the White House if Trump is wins in 2024.

So is Fauci trying to get Trump re-elected now? Because that's how I read this."
76,2022-05-15 18:01:49+00:00,1525899267033931780,"The days of Terry McAwful are over. 

The days of his leftist ally, my parental rights-hating opponent, are numbered.

@BobbyScott4VA3"
77,2022-05-14 22:52:01+00:00,1525609908443533312,"American greatness is defined by those who reach out, put in the work, and achieve their goals. 

Achievement isn’t conquered by those seeking a government handout."
78,2022-05-14 00:48:00+00:00,1525276708323987456,"Biden doesn’t even know where he is, let alone how to solve the issues HIS party caused. 

We were FAR better off two years ago."
79,2022-05-14 00:35:00+00:00,1525273437266137089,"Virginia spoke up in 2021. Virginians voted and united our voice to make a CHANGE!

Just wait to you see what we can do in 2022. Vote, and I’ll share your message across Washington!"
80,2022-05-13 21:45:46+00:00,1525230849641304065,"There isn’t a baby formula shortage at the border. 

Just saying."
81,2022-05-13 16:49:35+00:00,1525156314116239361,"They are trying to force you into a Green New Deal by destroying the energy production in our nation.

What President in their right mind would cancel Alaska’s oil and gas leases in the midst of a gas price crisis?"
82,2022-05-12 13:18:48+00:00,1524740877457018885,"Virginia Democrats learned the hard way that making moms angry was a VERY big mistake. 

Now they’re about to find that out on a NATIONAL scale.

November is going to be a RED tidal wave, with angry moms leading the way."
83,2022-05-12 10:28:00+00:00,1524697894565163009,"The Left passionately believes in Democracy - well, except when it comes to abortion, immigration, lockdowns, mandates, speech, censorship, religion, big tech, pandemics, and equity.

But aside from all that, they passionately believe in Democracy."
84,2022-05-10 20:51:50+00:00,1524130110902870016,"If the Left focused an ounce of their energy on the economy instead of abortion, and race baiting this country would be in a much better spot."
85,2022-05-10 12:50:34+00:00,1524008999607283712,"Given that baby formula neither comes from Ukraine or Russia, how will Biden blame this one on Putin?

The house of cards is falling for this administration."
86,2022-05-09 16:06:47+00:00,1523695990154604544,"“Birthing people"", pregnant men and abortions.

Is it me or is the Left just trying to ""cancel"" motherhood entirely?"
87,2022-05-08 23:40:53+00:00,1523447879452426241,"Our mission is to fly, fight and WIN! Congratulations again as OH-09 Republican Nominee! https://t.co/Geu6FsxTHO"
88,2022-05-08 23:00:28+00:00,1523437708978262016,@christisrisen9 Definitely! God bless!
89,2022-05-08 17:25:38+00:00,1523353444177760258,Wishing a beautiful Mother’s Day to all the wonderful women out there who have the honor of being moms &amp; especially to my own mother! God Bless! https://t.co/3flTPpke58
90,2022-05-07 23:15:20+00:00,1523079062192803840,"If you want to be a part of the Republican Revolution taking over this country right now, help me flip #VA03 by donating $20.22 today! 👇🏾 https://t.co/gHse9XD0jD"
91,2022-05-07 15:40:05+00:00,1522964494737149954,"Sunny Hostin said that being a black Republican is an “oxymoron.”

Well, I’m a Black Republican and I’m about to win a Congressional race out in Virginia’s 3rd district.

Where are the rest of our Black Republicans at?"
92,2022-05-06 23:45:32+00:00,1522724272887713792,"EARLY VOTING: went to all the voting areas in Chesapeake, Hampton,  Newport News, Portsmouth and Norfolk VA. After meeting my constituents I'm honored to be in the process of becoming the Next U. S. Congressman! https://t.co/II9u0o8Hx0"
93,2022-05-06 19:42:57+00:00,1522663227372486659,"Pro-choice supporters are protesting outside the homes of conservative judges in hopes of pressuring them to change their decision.

First, that's awful.

Second, notice how you don't see pro-life supporters protesting outside the homes of liberal judges?"
94,2022-05-06 13:19:30+00:00,1522566728701599746,RT @realBlakPac: @VA_GOP @gop early voting starts today. Vote @yestoyesli @Leon4Congress and Veteran Patriots @TerryNamkung @YoungKimCA tur…
95,2022-05-06 12:13:11+00:00,1522550037515063297,"Early Voting starts today!!

Don’t forget to get out and VOTE NAMKUNG!"
96,2022-05-05 19:16:01+00:00,1522294058693144581,"Joy Behar said that the elimination of Roe v. Wade is an attack on gay people.

Someone please get her and KBJ in Biology 101."
97,2022-05-05 17:38:01+00:00,1522269397200605185,"A Georgia high school announced that students must compete in athletic competitions aligning with the sex they were assigned at birth.

Tell that to someone in 1994 and they'd look at you like, ""Yeah...duh.""

Tell that to someone in 2022 and watch them rage."
98,2022-05-05 16:26:39+00:00,1522251439233552385,"A Florida art teacher got fired for discussing her sexuality with her students.

Weird.

Looks like we DID need that law, huh?"
99,2022-05-04 17:38:01+00:00,1521907009733414913,"20M unborn Black babies have been killed since 1973.

Abortion disproportionately affects Black communities."
