,Created at,User ID,Text
94,2022-04-27 00:01:00+00:00,1519104287133077511,"I’m working on a constitutional amendment to make it tougher for violent offenders to be released on bail.

Our focus should always be on helping victims of crime—not accommodating criminals through “bail reform”.

https://t.co/OQs4mGiEiW https://t.co/SeytbnqFiA"
95,2022-04-26 21:59:00+00:00,1519073584592814080,"It was a pleasure to be in Lucas County today to talk about the restoration of the historic Spitzer Building in downtown Toledo.

Soon, the building will return to its former glory and I am excited about the jobs that will be created in the near future! https://t.co/Zv0R3J1NSm"
96,2022-04-26 19:20:16+00:00,1519033637299265537,Seems like a well-run campaign… https://t.co/6GluuEaovb
97,2022-04-26 18:52:09+00:00,1519026564696092688,"I was thrilled to be in Wood County today for the ribbon cutting of the new MARCS Tower.

This critical investment that I helped secure will enhance public safety and improve communication for law enforcement and other first responders as they deal with emergency situations! https://t.co/SJfYvBdDjj"
98,2022-04-26 11:50:18+00:00,1518920400390004737,"One week to go!

Vote Theresa Gavarone for Congress now through May 3!

Donate: https://t.co/mShC3iKuLJ"
99,2022-04-25 19:20:13+00:00,1518671240151633920,The era of liberal Democrats censoring us conservatives on Twitter is taking its final breath. https://t.co/bFWfd7dSAD
