,Created at,User ID,Text
0,2022-06-28 00:12:22+00:00,1541575197135872001,"I was in Perrysburg Heights today for the groundbreaking of the Perrysburg Heights Community Center expansion that former Senator Gardner and I helped secure in a previous capital budget.

After, I was invited to go on an excellent tour of the BG Manor. https://t.co/VkMhjH9kii"
1,2022-06-26 17:23:26+00:00,1541109894815916033,"I greatly appreciated the opportunity to join with other pro-life leaders and speak at events in Bowling Green and Toledo celebrating the overturning of Roe v. Wade, a decision that has resulted in the deaths of millions of babies over the past 50 years. https://t.co/M2eT4ciKYd"
2,2022-06-25 18:41:00+00:00,1540767028075810817,"Last night I was at @OwensCC to present the Women’s Volleyball (third straight) and Basketball (first) teams with Ohio Senate resolutions for their national championship seasons!

Congratulations to the players, coaches and school for all of their incredible success! https://t.co/evd2s9GAME"
3,2022-06-25 13:13:00+00:00,1540684484256964609,"I was excited to be in Waterville yesterday for the grand re-opening of @kroger!

While there I presented a President’s Letter and was happy to celebrate the company donating $40,000 to @ConnectToMeals! https://t.co/3EyOHbGb5k"
4,2022-06-24 22:40:18+00:00,1540464862861688832,"The Heartbeat Bill that I was proud to co-sponsor is now law!

Thank you to @DaveYostOH for his quick action! https://t.co/PdnfqS82I2"
5,2022-06-24 15:52:48+00:00,1540362312808386560,My statement on today’s U.S. Supreme Court decision: https://t.co/Tc6Zyxh2qA
6,2022-06-24 00:14:31+00:00,1540126185111408640,"I am deeply disappointed that instead of working to address a weak economy, record-high gas prices, historic inflation, and increased violent crime, Joe Biden finds the time to complain about an egregious violation of the 2nd Amendment being (rightfully) ruled unconstitutional. https://t.co/3bugp2cTrY"
7,2022-06-22 22:17:32+00:00,1539734357954510849,"I appreciated the opportunity to speak at the Erie County Chamber of Commerce Annual Meeting tonight.

Since becoming Senator, I’ve helped bring nearly $4 million in Capital Budget funding to Erie County and I’ve worked hard to implement pro-business policies at the Statehouse! https://t.co/wQv6o6cyGB"
8,2022-06-20 23:54:21+00:00,1539033945102221312,"If you’re looking for reasons as to why our country is so sharply divided on nearly everything, may I suggest starting here?

God is good. God is real. https://t.co/4gpRlt57H5"
9,2022-06-19 15:48:55+00:00,1538549396761194498,"Happy Father’s Day to my Dad, Jim Charters!!! You’re always there when I need your advice, support, comfort, and a good laugh!!! I am so blessed to have you as my Dad! ❤️ https://t.co/ZS2kzLWcdA"
10,2022-06-18 13:17:00+00:00,1538148775935582214,I had an excellent time in Bowling Green yesterday for Firefly Nights! https://t.co/tVbtWcMos2
11,2022-06-17 12:18:00+00:00,1537771540158197762,"I had an excellent time in Port Clinton last night for the @GopOttawa Fish Fry!

Congrats to @jillies32 and her team on their work to make it another successful event! https://t.co/ZZXEG4ML0u"
12,2022-06-17 01:11:31+00:00,1537603814542409729,My statement on the news that @AmericanAir is leaving @TOLAirport: https://t.co/Wk4osBU8iS
13,2022-06-15 19:28:05+00:00,1537154998215360513,"Democrats have full control of the federal government.

Let’s check in on the economy today: https://t.co/aLDCh43BPh"
14,2022-06-14 15:45:48+00:00,1536736674150875136,"It was a joy to be in Northern Wood County for the groundbreaking of the new @RossfordSchools Multi-Use Building.

I had the opportunity to talk about the importance of this project and present a Senate Proclamation to the district’s leaders. https://t.co/cIyBfCELDy"
15,2022-06-14 00:17:09+00:00,1536502971260878848,"A productive day at the Statehouse!

As Chair of @OhioJCARR, I filmed ‘Cut Red Tape Ohio’, a program that will allow Ohioans to report burdensome state regulations.

And during today’s hearing, I thanked outgoing JCARR Attorney Ashley Frustaci for her 10 years of service! https://t.co/YkbmLGkujx"
16,2022-06-13 12:32:38+00:00,1536325670523002881,"Congratulations to the @NviewAthletics Baseball Team on their first State Championship!

Great job Wildcats! https://t.co/2VuttxAhJg"
17,2022-06-11 15:49:10+00:00,1535650354074996741,"As gas is now over $5 a gallon in Ohio, a friendly reminder that Joe Biden, a Democrat, is President and Democrats control the US House of Representatives and the US Senate. https://t.co/AV8IwHkR1c"
18,2022-06-10 22:20:53+00:00,1535386547402461184,"I was up bright and early to participate in the @chamber_bg update with Rep. Ghanbari and Chancellor Gardner.

I spoke about many of the 11 bills I’ve put into law this GA, recent capital budget $ I brought into my district and I was happy to answer questions from the attendees. https://t.co/5XEk6AlCFz"
19,2022-06-09 12:51:26+00:00,1534880852307582979,"Nan Whaley obviously would be an awful governor because she has terrible ideas.

But this is a good reminder that even with historic inflation and record-high gas prices, Democrats like her just can’t end their love affair with government spending.

https://t.co/RlddTCE1aC"
20,2022-06-08 12:16:02+00:00,1534509555102752768,"A Statehouse Rotunda full of past and present Ohio State Senators.

So much history within this incredible group of public servants.

A truly amazing day! https://t.co/DOI0oEHG2r"
21,2022-06-08 00:08:00+00:00,1534326338898866176,"I enjoyed attending the Ohio Senate Reunion today!

So many captivating stories from past members and I enjoyed catching up with some of my predecessors from SD 02, including Randy Gardner, Betty Montgomery, and Mark Wagoner (not pictured). https://t.co/6UVCBWg40d"
22,2022-06-07 15:53:00+00:00,1534201768648712192,"Gas prices don’t need be this high, but Biden is crippled by his ideology so here we are. https://t.co/j0PMV3C3ff"
23,2022-06-07 12:07:00+00:00,1534144893345488896,"As he’s seen first hand, the Democrat Party’s main platform is woke politics.

Republicans focus on the working men and women that make our country great.

Welcome to the GOP, Commissioner Shenigo!

https://t.co/8jXg6ck4QX"
24,2022-06-07 01:19:57+00:00,1533982057449369606,"Congratulations to @ErieOHGOP Chairman @CalebAStidham on his re-election after a 24-3 vote.

I was honored to be asked to swear him in for his new term.

The future of the Republican Party in Erie County is bright thanks to his leadership! https://t.co/zQYlUpPFpr"
25,2022-06-05 14:45:35+00:00,1533460026324574215,"I enjoyed being in Northwood for the first Senior Citizens Luncheon since 2019!

I addressed the crowd and walked around the room to talk to the attendees about issues important to them. https://t.co/16ckycBxa7"
26,2022-06-03 15:40:30+00:00,1532749070581784577,"We’re struggling with record-high gas prices, but those costs will increase even more if the federal government doesn’t reform the Renewable Fuel Standard (RFS) program.

My letter to the @WhiteHouse in support of Ohioans and the men &amp; women who work in Ohio’s refining industry: https://t.co/r9R6V6mHqC"
27,2022-06-03 12:11:00+00:00,1532696348528545793,"I was happy to introduce Justice Pat Fischer at his fundraiser for re-election in Erie County.

I can’t wait to help make Justice Fischer, along with new Chief Justice Kennedy, and Justice DeWine, part of the conservative majority on the Ohio Supreme Court this November! https://t.co/6OLwgRgUyV"
28,2022-06-02 16:26:20+00:00,1532398218226589698,"I was thrilled to play a leading role in bringing millions of dollars to Northwest and Northern Ohio to fund critical community projects!

Learn more: https://t.co/tzkSmMPwxB https://t.co/kgdBdol5Tr"
29,2022-05-31 23:28:16+00:00,1531779626275594242,"Proud to have legislation I co-sponsored pass out of committee to create a proposed constitutional amendment to come before voters to prohibit non-citizens from voting in Ohio’s elections!

Thanks to @JayEdwardsOhio, @CincySeitz and Sen. Bill Blessing for your efforts!"
30,2022-05-31 11:59:00+00:00,1531606165049704449,"Let’s be clear—a federal court had to clean up a constitutional crisis created by the liberal majority on the Ohio Supreme Court.

Thankfully, in November we can change that majority to one focused on interpreting the Constitution instead of legislating from the bench. https://t.co/3Sxz2nYQtD"
31,2022-05-30 23:31:00+00:00,1531417924480778241,"I was thrilled to be in Lake Township this morning to deliver a Memorial Day speech to a very patriotic and engaged crowd!

May the memories live on of the brave men and women who paid the ultimate sacrifice for our country and the freedoms we enjoy. https://t.co/czxfVXkOqu"
32,2022-05-30 17:33:00+00:00,1531327831002583041,"30 years, 3 children, and a lifetime of memories! I’m so happy to be on this journey with you! 

Happy Anniversary, Jim!!! https://t.co/ma3TnkxQuo"
33,2022-05-30 13:17:00+00:00,1531263406493138945,"On Friday at the Statehouse, I met with the family of fallen Navy Corpsman Maxton Soviak from Erie County.

In a private meeting I had the honor of presenting the Gold Star Family with the Ohio Military Medal of Distinction to honor his service to our country. https://t.co/2Cyy74kXKP"
34,2022-05-29 14:48:33+00:00,1530924060192002050,Congratulations to the @ToledoWalleye on their Western Conference Championship! https://t.co/eBZSOecXxB
35,2022-05-28 15:16:00+00:00,1530568578415484928,"I had the privilege of being at the Statehouse to participate in the 2022 Wreath Laying Ceremony to honor our fallen soldiers and Gold Star families.

Thanks to all who put this incredible event together to honor the men and women who gave the ultimate sacrifice for our country. https://t.co/cllfkWwD63"
36,2022-05-27 18:23:00+00:00,1530253250397495297,"Theresea Varrasso has been my Legislative Aide since 2019 and in that time has served as a valuable part of my team.

It’s a bittersweet moment for me today as she leaves my office to start the next chapter of her career.

Thanks for all you’ve done for me and my constituents! https://t.co/IyKChreukZ"
37,2022-05-26 20:17:00+00:00,1529919551328006144,"Thanks to my constituents from BOMA Toledo for coming down to the Statehouse yesterday to talk about their policy priorities this General Assembly! 

I learned a lot about what we are doing right to ensure we continue Ohio's success in commercial real estate and business! https://t.co/UUKVzyzqGP"
38,2022-05-26 14:57:00+00:00,1529839020750123008,"Congrats to Joe Salas for earning the Ohio Star of Life Award! 

Joe stopped by my office yesterday to talk about the needs of our EMS teams as they work to save lives in our community. He presented me with a challenge coin, which I'm looking forward to displaying in the office. https://t.co/nMnoD6tTIN"
39,2022-05-25 21:07:00+00:00,1529569746479468548,"Today, the Senate overwhelmingly passed my legislation to improve public safety!

Once approved by Ohio’s voters, SJR 5 will correct the Ohio Supreme Court’s mind-boggling decision and put the emphasis back on a core function of government—protecting its citizens from criminals. https://t.co/aNqq2tvgGk"
40,2022-05-25 11:34:00+00:00,1529425546446262273,"So far this week, my fellow Republicans in the Ohio legislature advanced legislation that will enhance public safety by making it tougher for violent offenders to get back on our streets and prevent non-citizens from voting in our elections.

Democrats…..voted against both."
41,2022-05-24 22:18:00+00:00,1529225226327797760,"The Supreme Court made a terrible decision that threatens the public safety of all Ohioans.

I’m smiling because today my work to right that wrong was overwhelmingly passed out of the Judiciary Committee.

I’m proud to stand with victims of crime and against violent offenders! https://t.co/250nt7Ib3N"
42,2022-05-24 17:56:00+00:00,1529159291839594496,"I delivered testimony on SB 320, my legislation to require a photo ID to vote in Ohio.

This is a policy supported by 80% of citizens that will improve the security and integrity of Ohio’s elections! https://t.co/wn8dXO5wsE"
43,2022-05-21 13:56:00+00:00,1528011730256658432,"Canada's Consul General Joe Comartin and I had a thorough conversation yesterday on the preservation of Line 5, the Gordie Howe Bridge, and trade between our two countries! 🇺🇲🇨🇦 https://t.co/nqLXQNAP5p"
44,2022-05-20 14:36:00+00:00,1527659409115123713,"Happy to have met with constituents and other advocates at the Right to Life Coalition of Ohio Pro-Life Day at the Statehouse. 

The pro-life movement is strong in our state! https://t.co/RoAxZsXppV"
45,2022-05-19 22:14:00+00:00,1527412280928849921,"I was happy to see Wood County's own Terry Burton this week! 

Terry was down with the Ohio Association of Election Officials to testify on a bill in my Local Government and Elections Committee. He's an exemplary public servant! https://t.co/p6E9S0jdFY"
46,2022-05-19 16:43:19+00:00,1527329063790313472,"It's always a wonderful day at the Statehouse when I get to meet with constituents! 

Yesterday, I talked to local dentists and then met with Mercy Health to discuss a current project they are working on.

We’re so lucky to have such great healthcare professionals in our area! https://t.co/RZVuYAHUZR"
47,2022-05-18 00:03:00+00:00,1526714936327516160,"Biden shuts down drilling, gas prices hit record highs.

Who would’ve thought? https://t.co/t9wXCgXxAF"
48,2022-05-17 21:19:08+00:00,1526673698178088964,"I appreciated Hamilton County Prosecutor @JosephTDeters coming to the Statehouse to testify on SJR 5, my legislation that will right the Ohio Supreme Court’s egregious wrong and keep violent offenders off of our streets! https://t.co/PbBKeRKmGK"
49,2022-05-17 17:49:39+00:00,1526620981078503427,"It’s #NationalPoliceWeek!

Thank you to members of law enforcement for all you do to keep our communities safe! https://t.co/tEpS3zO8Oc"
50,2022-05-17 15:25:54+00:00,1526584804489183232,"I was happy to address the Northeast Ohio Mayors and City Managers Association this morning.

I spoke about the importance of local government and my work in the legislature to preserve and protect our state’s gem, Lake Erie. https://t.co/J34LY5H06Q"
51,2022-05-16 23:57:59+00:00,1526351286467272710,I enjoyed the opportunity to speak virtually to students at @SCCSPanthers this morning before making the drive down to the Statehouse for a busy week! https://t.co/jzwA3Ui9NP
52,2022-05-16 12:44:00+00:00,1526181671917260801,"Regardless of how his failed tenure ends, our country will be better off when Anthony Fauci is no longer employed by the federal government. https://t.co/U2xZNFEc4A"
53,2022-05-13 00:47:20+00:00,1524914155664310280,"It was truly an honor to be the keynote speaker at the Peace Officers Memorial Day Ceremony in Ottawa County.

I had the opportunity to honor fallen officers, talk about the importance of law enforcement and speak about the work I’ve done in the legislature to support them. https://t.co/DaEL5ellik"
54,2022-05-11 23:54:28+00:00,1524538463042867205,"The Democrats in the US Senate couldn’t even get all of their members to vote for a radical piece of pro-abortion legislation.

But the filibuster is the problem? 🤔 https://t.co/MumSpU4RzY"
55,2022-05-11 21:08:09+00:00,1524496606933966853,"RT @SBAList: BREAKING: 49 Democratic senators just voted to force all 50 states to permit abortions for any reason, through all nine months…"
56,2022-05-11 13:46:18+00:00,1524385413229686784,😳 https://t.co/dnI5yzBM3H
57,2022-05-10 22:38:39+00:00,1524156993812025347,"Today, I testified on my proposed constitutional amendment to protect Ohioans from violent offenders.

The Ohio Supreme Court made an egregious error by taking away the ability of judges to consider public safety when making bail decisions.

My bill rights their obvious wrong. https://t.co/71wWXXXAzf"
58,2022-05-10 13:37:23+00:00,1524020778357903364,"I was in Lucas County last night to speak at @LucasDDAlert’s SALUTE (Self Advocates Lucas Toledo) meeting.

I was happy to talk about my communication disability legislation that was signed into law a few years ago, and answer questions from a very engaged group! https://t.co/0pmU14964W"
59,2022-05-09 23:44:31+00:00,1523811181160370177,"I loved being in Fulton County today for the ribbon cutting of the North Star BlueScope expansion.

This $700 million expansion will help bring more jobs to Northwest Ohio and I can’t wait to see the positive impact it will have on our communities! https://t.co/02zqBk2iPK"
60,2022-05-08 16:58:09+00:00,1523346528621932544,"Happy Mother’s Day to my mom - the person who inspires me every day with her unconditional love and support!!! I wouldn’t be who I am today without your guidance. I love you, Mom!!! https://t.co/unojQk1YQI"
61,2022-05-06 21:59:05+00:00,1522697486757941248,"""As the mother of two daughters, I am shocked and appalled at the report out of Cedar Point. Employers must strive to ensure their employees are safe on company property. My heart breaks for the victims who suffered through this senseless violence.""

https://t.co/TipumshSds"
62,2022-05-05 15:10:21+00:00,1522232236468277253,Happy to be in Lucas County this morning for the National Day of Prayer Breakfast! https://t.co/TwlJnnijqZ
63,2022-05-04 16:12:57+00:00,1521885603612213251,"THANK YOU to everyone for your support!

My statement: https://t.co/zo8IqmGvZE"
64,2022-05-03 17:18:03+00:00,1521539597033000960,"Jim and I voted!

Quick and easy!

Polls close at 7:30 tonight.

Get out and vote Theresa Gavarone for Congress!

Find your polling location: https://t.co/U0zXAsDBG9 https://t.co/9rrvoAruwV"
65,2022-05-03 13:12:21+00:00,1521477765614157824,"Polls are open until 7:30 PM.

Visit https://t.co/9sm6dVHvpG to find your polling location!"
66,2022-05-03 13:08:02+00:00,1521476679369211904,It’s time to get out and vote Theresa Gavarone for Congress! https://t.co/VK9ZQUZj24
67,2022-05-03 00:00:01+00:00,1521278368951451659,"Congressman Bob Latta has been a good friend for many years and I am so thankful to have his endorsement!

I look forward to working with him in Congress to fight back against the radical Biden-Pelosi agenda that has devastated our country! https://t.co/oxScfxc4tF"
68,2022-05-02 22:12:00+00:00,1521251183423213569,"Last day of door knocking!

I was happy to talk to voters across Erie County during our final push to win this primary election and take our country back from radical Democrats! https://t.co/3knx5aoURy"
69,2022-05-02 20:09:00+00:00,1521220229292072961,"One of my opponents is pushing a radical plan that will make it EASIER for violent offenders to be released from prison.

I’ve fought back by introducing my own plan to make it TOUGHER for people who threaten public safety to get back onto our streets. https://t.co/3e3FrGLj86"
70,2022-05-02 17:43:00+00:00,1521183487285514240,"I was so honored to be endorsed by local law enforcement, that I even sent a mailer highlighting their support!

While some people want to make it easier for criminals to get back on our streets, I've always stood with the law enforcement officers who keep us safe! https://t.co/nzvbSm4cBu"
71,2022-05-02 15:45:00+00:00,1521153791717896192,"I'm A rated by the @NRA and @BuckeyeFirearms because I have a long track record of fighting for the 2nd amendment.

That was on display recently when I sponsored Senate Bill 293, legislation to prohibit the government from requiring a fee or liability insurance to own a gun. https://t.co/aq9DNErfjG"
72,2022-05-02 13:34:00+00:00,1521120824412962817,"I support:

✅ Never Raising Income Taxes
✅ The US Term Limits Amendment
✅ Energy Independence

That is why I signed the @taxreformer, @USTermLimits, and @EmpoweringUSA pledges early in this campaign! https://t.co/IZe2DxWVQS"
73,2022-05-02 11:18:00+00:00,1521086599139758082,"I was thrilled to be on @WTOL11Toledo's ""Leading Edge"" with Jerry Anderson yesterday.

I spoke about about my campaign, the misleading ads my opponents have created and my successful work in the legislature.

Part 1: https://t.co/52Ik2VBSuq

Part 2: https://t.co/eimo4KSzxb https://t.co/gLdzDGaVD4"
74,2022-05-01 23:42:00+00:00,1520911444635574272,"I was busy during an absolutely gorgeous day in Ottawa County!

I attended the Ottawa County Women’s Republican Club BBQ, had lunch at Dianna’s Deli and knocked doors in Catawba Island and Port Clinton! https://t.co/u6OyIN8lXO"
75,2022-05-01 17:09:00+00:00,1520812542867566593,"If you want a pro-life leader in Congress, I’ve made your decision on Tuesday easy!

I’m a co-sponsor of the Heartbeat Bill and the ONLY candidate in the race to be endorsed by @ohiolife, the Right to Life Action Coalition of Ohio, and the @SBAList! https://t.co/jGEwwPxIMQ"
76,2022-05-01 13:32:00+00:00,1520757933486792705,"I’m proud to be the ONLY candidate in the race to receive the “Award for Conservative Excellence” by the @ACUConservative!

I’ll continue to fight for common sense, conservative solutions to our biggest problems when I get to Congress! https://t.co/xXPGI0e4nF"
77,2022-05-01 13:07:47+00:00,1520751840891219969,"Wow.

Marcy’s best friend yucking it up while Americans struggle to pay for everyday necessities. https://t.co/nMKvdDqoGW"
78,2022-04-30 23:40:36+00:00,1520548705392332800,"Took a little break from campaigning today to join my family to watch my son graduate from @bgsu!

So proud of you, Jimmy! https://t.co/0EBK9mLAyq"
79,2022-04-30 19:06:10+00:00,1520479642515345408,"I sponsored Senate Bill 320 to require a photo ID to vote in Ohio because:

✅ My constituents want it.
✅ I’m a leader in improving election integrity.
✅ It’s the right thing to do.

I’ll continue the fight for election integrity in Congress! https://t.co/F3wuYFGWrZ"
80,2022-04-30 13:33:04+00:00,1520395813456912384,A busy last few days of campaigning before Election Day on Tuesday begins now! https://t.co/ywnSOovAGD
81,2022-04-29 22:25:30+00:00,1520167419385372672,"Congratulations to my good friend, Congressman @latta4congress on receiving an endorsement from President Trump!

He’s a conservative leader for Northwest Ohio, and I am glad to see him get the recognition that he deserves! https://t.co/JofATEvhJL"
82,2022-04-29 19:21:30+00:00,1520121111689760768,"Today, the Theresa Gavarone for Congress campaign sent a cease and desist letter to four Toledo TV stations asking them to remove a false and defamatory attack ad paid for by the Craig Riedel campaign: https://t.co/9oVkck7gfm"
83,2022-04-29 16:01:45+00:00,1520070844264898560,"The vast majority of endorsements for my opponents come from people outside of OH-09.

Why? Because people who live here know that I am the ONLY candidate with a conservative track record of delivering for my constituents, and that I'll continue to do so in Congress. https://t.co/5HfPXad3u5"
84,2022-04-29 14:03:28+00:00,1520041078942019586,"Check out @craig_riedel’s approach to the commercials he approves.

I’m a proud supporter of President Trump. I’ve been honored to speak at rallies, be invited to attend an event of his at the White House, and be selected as a delegate for his 2020 campaign. https://t.co/kYmwHLaEri"
85,2022-04-29 12:05:00+00:00,1520011264654594050,"I ended last night in Ottawa County at the Genoa Top 20 Banquet.

The event recognizes the top academic achievers in each class at Genoa High School and I was happy to congratulate them in front of a massive crowd! https://t.co/rDh3rqAaQU"
86,2022-04-29 00:01:00+00:00,1519829062910365699,"I need your help in our final push to defeat Marcy Kaptur, win the House, and take back our country!

Please donate tonight!

https://t.co/kjIZ5t4Pa0"
87,2022-04-28 20:38:49+00:00,1519778184484511745,"The Biden administration wants to shut down Line 5 and Marcy Kaptur is helping them do it.

I look forward to joining Congressman Latta in DC to fight against the Biden plan that will kill hundreds of jobs and raise energy prices for the people of Northwest and Northern Ohio. https://t.co/GbO8wfYvoY"
88,2022-04-28 18:21:08+00:00,1519743534861062145,Yep. https://t.co/c7pWeBIRq7
89,2022-04-28 17:48:00+00:00,1519735194051248129,"Historic inflation, record-high gas prices, rising crime, a $30 trillion national debt, and now negative economic growth.

The Biden-Pelosi agenda, fully backed by Marcy Kaptur, is hurting all of us. https://t.co/GTMTfkFdFv"
90,2022-04-28 14:24:04+00:00,1519683874372132864,"I am the ONLY endorsed candidate for OH-09 by @ohiolife, the Right to Life Action Coalition of Ohio, and @SBAList because I am the ONLY pro-life leader in this race.

Here's my new radio commercial that is airing now through Election Day on Tuesday!

https://t.co/qnbT6Saroq"
91,2022-04-28 11:47:36+00:00,1519644497696722945,"Great news for the Republican Party!

I want Joe Biden to come to Northern and Northwest Ohio to spend as much time as possible with Marcy Kaptur this summer and fall. https://t.co/zBA5lEwfHH"
92,2022-04-28 00:31:42+00:00,1519474401871335426,"We’ll never be outworked!

I enjoyed being out today in Lucas County talking to voters about our campaign—the only one endorsed by pro-life groups—to defeat Marcy Kaptur! https://t.co/Oq8RcP62NW"
93,2022-04-27 11:38:40+00:00,1519279863248658433,"I ended yesterday in Fulton County at the 36th Annual CPC Spring Benefit and Silent Auction.

I am the only endorsed pro-life leader in the race and I was happy to attend to show support for the event that supports pregnancy centers in NW Ohio with countless like-minded people. https://t.co/JMdYwJyPuS"
