,Created at,User ID,Text
97,2022-02-26 01:00:19+00:00,1497375945484906496,"Lower Taxes Will Bring Back Chicago Business

Chicago sales taxes on residents are more than 25% higher than nearby cities such as Naperville or Wheaton, where rates are 7.75% and 8% respectively. 

We need to lower the sales tax so Chicagoans continue to shop in Chicago. https://t.co/M6xMMreoA1"
98,2022-02-24 23:15:02+00:00,1496987060086919169,"Together we can help reduce crime

The answer to reduce crime is far from clear-cut, but one cause of violence is disinvestment in our communities.

Investing in our communities and taking pride in them won’t stop crime, but it will certainly help.  
#DrWillieWilson, #Community https://t.co/A3smxVgp2h"
99,2022-02-24 01:00:18+00:00,1496651162858229762,"Covid Confusion

I am glad that Mayor Lightfoot agrees with me that it is time to lift the mask and vaccine passport mandates that have hurt our businesses. 

The Chicago mask mandate will end at the same time as the State of Illinois, on Feb. 28. https://t.co/4n0UUvoX5L"
