,Created at,User ID,Text
0,2022-06-25 22:00:20+00:00,1540817193037856768,"Lower income families spend approximately 77% of their income on necessities. Inflation is eroding the savings of many Americans. 

The cost of milk and eggs are up 11 percent and meat is up 13%, 

Help us to assist our citizens in this time of great need. 

#WillieWilson https://t.co/xGG0EX5yvo"
1,2022-06-23 22:00:39+00:00,1540092498332246016,"Mayor Lightfoot and Governor Pritzker still don't get it. They need to suspend the gas tax.

Chicagoans pay an average of $6 per gallon of regular. The highest in the State of Illinois.

Call upon our elected officials  to do the right thing.

#WillieWilson,#SuspendTheGasTax https://t.co/DO4l8RnXcD"
2,2022-06-23 00:55:02+00:00,1539773993800146949,"Our elected officials in Chicago have forgotten that they work for us, not the other way around. We do not work for them. 

I promise to always listen and regularly hold town hall meetings to listen. Your voice is what should be the guide and I want to hear it. 

#WillieWilson https://t.co/5TezTjdT2K"
3,2022-06-22 00:10:01+00:00,1539400278461620226,https://t.co/Y1fWXcAkxZ
4,2022-06-20 17:15:03+00:00,1538933459309182976,"Juneteenth represents our freedom and emancipation.

Yesterday, we celebrated the day that the last remaining enslaved African Americans  in the United States were freed.

Our work is not done, and we still have a long way to go.

#WillieWilson #Juneteenth https://t.co/nyvQ3rm3t4"
5,2022-06-17 22:00:48+00:00,1537918207809314822,"This Sunday, June 19th we will celebrate the Emancipation of African Americans.

Juneteenth marks our country’s second independence day. Our history has been marginalized and still remains unknown to many. 

We still have a long way to go. 

#Juneteenth,#WillieWilson https://t.co/j8CuGE9asE"
6,2022-06-17 18:30:22+00:00,1537865251605164032,https://t.co/SuAgf9qN89
7,2022-06-16 22:10:05+00:00,1537558156972331011,https://t.co/emB6Q5CE7L
8,2022-06-15 22:10:03+00:00,1537195759665307649,"Why it is important to temporarily suspend the gas tax:

In Illinois and Chicago  drivers  pay the second highest gas taxes in the nation. 

Call upon Mayor Lightfoot and Governor Pritzker to suspend the gas tax to save us all money at the pump.

#WillieWilson,#SuspendTheGasTax https://t.co/lFOwAvE2T8"
9,2022-06-14 22:05:03+00:00,1536832113022050304,"We need strong leadership to get the city back on track. Leadership is action. 

While everyone else talks about the city’s problems,  we are out in the community  working on them. As a example, during the Pandemic we gave away over 30 million masks in Chicagoland.
#WillieWilson https://t.co/05ZlKcX5P4"
10,2022-06-13 23:10:03+00:00,1536486083361374210,"This past weekend 26 people were shot and 6 of them were killed in Chicago.

It is incumbent on Mayor Lightfoot to use all of Chicago’s resources to curb this unnecessary gun violence.

Our elected leaders need to take action.

#WillieWilson,#GunControl,#ViolencePrevention https://t.co/0nfKLN4FsU"
11,2022-06-09 17:00:51+00:00,1534943619999838210,"There are those that talk about Chicago's problems and those that take action.  Mayor Lightfoot likes to talk about what she will do, yet things are worse than it was when she became Mayor.

We are doers. We help as many as we can and set an example for others to do the same. https://t.co/SU6OxJiT0R"
12,2022-06-08 23:05:06+00:00,1534672898727747584,https://t.co/9Vxpdzq8t2
13,2022-06-07 17:05:02+00:00,1534219896523051009,"Over the weekend,  33 people were shot in Chicago including a police officer, and 6 people died from the violence. This must stop.  

This affects all of us and the time to act and solve the problem is now.

#WillieWilson,#StopGunViolence,#CommuntySupport https://t.co/v2tDMdt1VA"
14,2022-06-03 01:20:12+00:00,1532532569660604440,"***Endorsement Alert***
The Italian American Police Association Endorses Dr. Willie Wilson Campaign for Mayor. #drwiliewilsonformayor #endorsement #thankyouforyoursupport https://t.co/9LikDT3WKM"
15,2022-06-03 01:11:58+00:00,1532530497171103747,"***Endorsement Alert***
The Italian American Police Association Endorses Dr. Willie Wilson Campaign for Mayor. #drwiliewilsonformayor #endorsement #thankyouforyoursupport https://t.co/XIf7TJzlap"
16,2022-06-02 22:00:19+00:00,1532482268513685530,https://t.co/KD9hwuZG0z
17,2022-06-02 15:00:14+00:00,1532376549621747712,"Please join us at tonight's town hall meeting so we can listen to your concerns and hopes for our community.

#WillieWilson,#TownHallMeeting,#Solutions https://t.co/enxg4GlbCC"
18,2022-06-01 22:05:03+00:00,1532121072027455488,"Our Mayor needs to work with private citizens not against them.  

Last week we spent $1 million helping many citizens with gas and groceries.  We also wanted to help the Seniors living in CHA housing, but we were denied access  to help those seniors in need.
#WillieWilson https://t.co/xyzJBRw9Gm"
19,2022-05-31 23:30:03+00:00,1531780073182973953,"In Chicago over Memorial Day Weekend,  52 people were shot and 9 died.

This has to stop. We need to work together to come up with solutions.  

See our Willie Wilson Facebook page for some of our solutions and to offer your input.

#WillieWilson,#StopGunViolence https://t.co/2YoSEljGHz"
20,2022-05-27 18:05:03+00:00,1530248732167573504,"Why We Gave Away $1 Million in Gas and Food This Week

Soaring inflation is causing pain on households throughout Illinois. Food and Gas prices are at an all time high. 

We can't help everyone, but we help who we can and set an example for others to do the same.

#WilllieWilson https://t.co/mFEnz0LNRa"
21,2022-05-26 00:00:36+00:00,1529613437243891713,"Here are the details and locations for tomorrow's gas giveaway. 

Like our Facebook Page to continue to get updates on our programs and solutions to help Chicagoans.

#WillieWilson,#GasGiveaway,#SuspendTheGasTax https://t.co/ur47f4lCJs"
22,2022-05-25 21:00:04+00:00,1529568003804868609,https://t.co/QPRSHWK7Gp
23,2022-05-25 00:10:03+00:00,1529253424491003915,"Here are the details and locations for tomorrow's food giveaway at The Cermak Fresh Market. The previous post has details for Pete's Market.

Like our Facebook Page to get updates on our programs and solutions to help Chicagoans.

#WillieWilson,#CermakFreshMarket,#FoodGiveaway https://t.co/eGGHWXJUA8"
24,2022-05-25 00:05:03+00:00,1529252165923049472,"Here are the details and for tomorrow's food giveaway at Pete's Market. The next post will have the details for the Cermak Fresh Market.

Like our Facebook Page to continue to get updates on our programs and solutions to help Chicagoans.

#WillieWilson,#PetesMarket,#FoodGiveaway https://t.co/1g0E8cEBMO"
25,2022-05-24 15:00:41+00:00,1529115172983517185,"Why is the current Mayor of Chicago not allowing private dollars to go to CHA seniors that really need food and gas? 

One has to question why she would deny our CHA Seniors supplies they need to live and function on.

#WillieWilson,#ChicagoSeniors,#CHAhousing https://t.co/wqBeWezPNa"
26,2022-05-23 22:47:52+00:00,1528870354923421697,"MEDIA STATEMENT

Wilson Kicks off $1 Million Donation to Assist Residents 
with Food at Cermak and Pete’s Fresh Markets

Wednesday, May 25, 2022, at 9am

READ MORE BELOW: https://t.co/EmFQoVOXeY"
27,2022-05-23 14:05:01+00:00,1528738777413439488,https://t.co/nD7x06eEvh
28,2022-05-21 16:35:57+00:00,1528051984539996160,"MEDIA STATEMENT
Wilson Alters Plan for Senior Giveaway at CHA Buildings 

Dr. Wilson is being denied access to CHA Senior buildings.  Every four months for several years, I have given to our seniors directly at CHA buildings and now I am being told that I cannot. READ MORE BELOW https://t.co/Bplad8ROEe"
29,2022-05-20 23:45:21+00:00,1527797659574145027,New Gas Giveaway and Food Giveaway! #drwilliewilsonfoundation #gasdiscount #foodcoupons #withGodtogether https://t.co/nKwxDjppa6
30,2022-05-20 16:01:00+00:00,1527680802565259267,"Join me tomorrow at noon as I congratulate the participants and winners of the Little Village Rotary Club ""Race For Peace"". 

The awards presentation will be at Mi Tierra Restaurant a 2528 S. Kedzie in Chicago. Good luck and thanks to all the runners.
#WillieWilson,#RaceForPeace https://t.co/Oh738uJXzz"
31,2022-05-20 00:45:09+00:00,1527450321571700745,"MEDIA ADVISORY
Wilson Announces Details of $1 Million Donation to Assist Seniors, and Illinois Residents with Gas and Food  Watch us FB LIVE  at 3 pm - tomorrow. #Foodhelp #gashelp #seniors #drwilliewilson https://t.co/vl3Mbmd042"
32,2022-05-19 23:05:03+00:00,1527425127855669248,"We all need to focus on rebuilding our communities. 

The uptick in carjackings, murder on the rise, crime out of control &amp; mental health is going unchecked. 

We must work together with to address and solve these problems.

#WillieWilson,#Rebuild,#ChicagoCommunities https://t.co/AVSI0HNYkZ"
33,2022-05-18 23:05:12+00:00,1527062776392425475,https://t.co/4oYAdxaXHQ
34,2022-05-17 22:05:02+00:00,1526685247328464896,"Leadership is about doing not talking. While every one else talks about the city’s problems, we are in the community working on them.  

Whether it is helping our seniors, our homeless, our churches or others in need, we are providing direct assistance.

#WillieWilson,#Leadership https://t.co/J6fNB5TAWr"
35,2022-05-16 23:05:02+00:00,1526337961859612672,"Back in March, we called upon Mayor Lightfoot and Governor Pritzker to suspend the gas tax.  So far, nothing has been done

Illinois drivers are still paying the second highest taxes on their gasoline in the nation. 

#WillieWilson,#SuspendTheGasTax,#GasPriceRelief https://t.co/bA8aDb6yae"
36,2022-05-13 17:00:31+00:00,1525159062140231681,"Please join us tomorrow, Saturday, May 14 at 2:00 pm and let us know how we can all work to make Chicago better.

The official invitation is below.
#WillieWilson,#TownHall,#MakingChicagoBetter https://t.co/8aUekYhnwL"
37,2022-05-12 23:00:06+00:00,1524887169889886217,https://t.co/Hx27p6pZQV
38,2022-05-11 23:00:19+00:00,1524524833886937088,"Lower Taxes Will Bring Back Chicago Business

The City of Chicago ranks No. 2 in the nation for high combined state and local sales tax rates. 

Higher sales taxes are driving consumers away from Chicago businesses into neighboring suburbs.
#WillieWilson,#LowerTaxes https://t.co/pn7FkTOMaa"
39,2022-05-11 17:00:48+00:00,1524434359373160449,"Dr. Wilson at PAPA (The Polish American Police Association) Annual Banquet last Friday at Eagle Banquets in Chicago.
#WillieWilson,#PolishAmericanPoliceAssociation,#WillieWilsonForMayor https://t.co/kbxprMO3Yt"
40,2022-05-10 11:00:20+00:00,1523981257436241921,"You are invited to watch My Live Press Conference this morning  at 10:00 am on my Facebook page. 

I will be speaking about religious freedom.
#WillieWilson, #ReligiousFreedom,#WillieWilsonForMayor https://t.co/v9pFD7u5ea"
41,2022-05-09 23:30:03+00:00,1523807540605300737,"Press Conference - Tomorrow at 10:00 am

We will urge Pastors to remember Mayor Lightfoot shut their Churches down and Issued Fines and Tickets

We  will tell the Clergy to Stand up for Religious Freedom https://t.co/6SgridGCxX"
42,2022-05-06 17:04:22+00:00,1522623315365568512,We're working on some things. #drwilliewilson #williewilsonformayor #signsandbanners https://t.co/pBJqKhfogq
43,2022-05-05 22:30:02+00:00,1522342887916294144,"When economic development is up, violence comes down.

Thousands of small businesses closed forever due to COVID.. 

We MUST help them rebuild through jobs,  grants and apprenticeships. We need to start by focusing on hardest hit communities.

#WillieWilson,#EconomicDevelopment https://t.co/1SDrOTq3XA"
44,2022-05-04 23:30:02+00:00,1521995596508372995,https://t.co/Ip1DEMzl3H
45,2022-05-04 01:06:34+00:00,1521657501976043520,"MEDIA ADVISORY

Wilson Urges Pastors to Remember Mayor Lightfoot Shut their Churches Down and Issued Fines and Tickets---Wilson Tells Clergy to Stand up for Religious Freedom https://t.co/pdTwe6EZjh"
46,2022-05-02 22:35:03+00:00,1521256985873764355,"Dr. Wilson celebrating Polish Flag Day with the Polish Highlanders at 4403 South Archer Avenue in Chicago this past Saturday.

#DrWillieWilson,#PolishHighlanders,#PolishFlagDay https://t.co/1eLAU1DiYX"
47,2022-04-30 18:00:46+00:00,1520463181688279040,"Listening is the Most Important Step

We will listen to every Chicago resident. We’ll work together to find out what the needs are and meet those needs for all of our unique neighbors and diverse groups. 

Inclusion is the key. Together is the way. 

#WillieWilson,#Listening https://t.co/OZ5B1RDs0c"
48,2022-04-29 22:54:09+00:00,1520174627934326786,"MEDIA ADVISORY

Wilson to Ride CTA Red Line in Wake of Attacks on the Train
and Promises to Bring Back Transit Police https://t.co/H8Kn8PjMfu"
49,2022-04-27 23:05:06+00:00,1519452606778720256,"Let’s Rebuild Chicago, Together

We all know what the problems are. It’s solutions we need.

We would like your input. If you have any suggestions on how to help us Rebuild Chicago Better, let us know. We are listening

#WillieWilson,#RebuildChicago,#WorkingTogether https://t.co/roZ7MH7Lfx"
50,2022-04-26 23:00:29+00:00,1519089056742846470,"Working together is the ONLY way we can rebuild what the pandemic took. 

The Chicago we know as the greatest city in the world has been harmed. 

We will continue to help with resources in EVERY way we humanly can.

 #DrWillieWilson, #RebuildingChicago, #Rebound, #Recover https://t.co/GL4Bru3cNa"
51,2022-04-26 22:50:38+00:00,1519086577963700226,"MEDIA ADVISORY

Wilson and Faith Leaders Endorse Attorney Richard Boykin for President of the Cook County Board—He is the Right Choice https://t.co/DumgAvJ8GC"
52,2022-04-25 23:00:14+00:00,1518726609037148161,"https://t.co/IdSMoOrI9X

#WillieWilson,#GasGiveaway"
53,2022-04-22 14:45:21+00:00,1517514903912960000,"FINAL GAS LIST:  Please note, the Dolton, Tinley Park, Broadview, and Country Club Hills Stations are no longer on the list. #Gasgiveaway, #updateongas #drwilliewilson https://t.co/VAwZMPdkOP"
54,2022-04-21 16:24:15+00:00,1517177402958528513,Latest  Update! The Mayor of Country Club Hills has chosen not to participate in this Gas Giveaway. We will continue to try and keep you all updated with the most current information. Thank you for your patience and understanding.  #update #drwilliewilson #gasgiveaway https://t.co/v1S9Rgl48z
55,2022-04-19 22:20:01+00:00,1516542161503891464,https://t.co/gySSJ5G7mj
56,2022-04-19 01:45:34+00:00,1516231498944462850,You are invited to watch My Live Press Conference tomorrow at 11:30am on my Facebook page. I am announcing if we will do another Gas Giveaway. #drwilliewilson #anothergasgiveaway? #willwedoitagain https://t.co/JLicoDSowf
57,2022-04-15 21:10:12+00:00,1515075036918464516,"MEDIA ADVISORY

Wilson to Announce Whether He Will Do Another Free Gas Giveaway

Dr. Wilson announced last month that he would decide within 30 days regarding a third gas giveaway. https://t.co/tuJbj69lNV"
58,2022-04-14 00:00:15+00:00,1514393054999949314,"Dr. Wille Wilson on Crime

#crime #rebuild #restore #williewilsonformayor #77communities https://t.co/gDJP0L74QC"
59,2022-04-13 22:52:47+00:00,1514376077489184769,"Willie Wilson on Taxes
#lowertaxes #rebuild #restore #williewilsonformayor https://t.co/Yn9jFPqDiI"
60,2022-04-13 21:42:16+00:00,1514358333662449665,"MEDIA STATEMENT

Wilson Knocks Mayor Lightfoot for Her Failures on Public Safety and COVID 19 and Demands Mayor Bring Back Transit Police https://t.co/Mkwz4bTzeu"
61,2022-04-13 21:00:16+00:00,1514347761919012875,"Dr. Willie Wilson on the North Side of Chicago. Listening to the community.

#DrWillieWilson,#IslamicCommunity,#ListeningToTheCommunity https://t.co/MA0eNIQ8OD"
62,2022-04-11 22:07:17+00:00,1513639852197269505,"MEDIA STATEMENT

Wilson Announces Campaign for Mayor of Chicago Flanked by Clergy, Business, and Ethnic Community Leaders, and Donates $5 Million to His Campaign Account

Today, I announced my candidacy for Mayor of Chicago. https://t.co/YoyKm6If5Z"
63,2022-04-11 11:20:32+00:00,1513477090254991364,"Watch My Live Press Conference today at 11:00am. It will be broadcast on all the local media.

I will be announcing whether or not I will be running for Mayor of Chicago.

#DrWillieWilson, #RebuildingChicagoTogether https://t.co/5RqoCjEmN2"
64,2022-04-09 14:05:02+00:00,1512793715001151503,"Watch My Live Press Conference at 11:00am on Monday. It will be broadcast on all the local media.

I will be announcing whether or not I will be running for Mayor of Chicago.

#DrWillieWilson, #RebuildingChicagoTogether https://t.co/OWn6KNYpMp"
65,2022-04-08 23:05:03+00:00,1512567226800525313,"We Are Asking Your Opinion:

What do you feel are the biggest issues facing Chicago today?

We would very much like to know your views, suggestions and solutions. Please let us know.

#WillieWilson,#IssuesFacingChicago,#ChicagoSolutions https://t.co/J6cTAJApLi"
66,2022-04-07 23:03:21+00:00,1512204411308843017,"Two thoughts on taxes:

Our Chicago and Cook County taxes are way too high and need to come down to support our residents.

The taxes collected must be spent wisely and distributed back into all 77 Chicago communities proportionally.

#DrWillieWilson,#ChicagoCommunities https://t.co/69n0aIONrF"
67,2022-04-06 23:00:23+00:00,1511841275137474567,"When economic development is up, violence comes down.

Thousands of small businesses closed due to COVID-19. We MUST help them rebuild and create new businesses through grants and support. .We need to start by focusing on hardest hit communities.
#WillieWilson,#EconomicGrowth https://t.co/sQYuWzZRgY"
68,2022-04-05 22:55:03+00:00,1511477546751348737,"Education means more employment. 

The more resources, skills and trades Chicagoans have, the stronger the city and local economy.

Opportunities for education will also help us erase gender &amp; racial inequality and reduce crime.

#DrWillieWilson,#ChicagoEducation,#ChicagoEconomy https://t.co/Xf0M6lwE5W"
69,2022-04-02 22:05:02+00:00,1510377797138718731,"We Need To Listen To Each Other

We all are forced to create a new post-pandemic normal. The only way to do that is...together! 

Listening and working hand-in-hand - with inclusion as the guiding light - to meet the unique needs of Chicago's diverse groups.

#DrWillieWilson https://t.co/lAA0kH1o6O"
70,2022-04-01 22:05:03+00:00,1510015409642160130,"This is why we donated the $1.2 million of gas:

We will never stand by and just talk.  We do things to help this city.

We should never  have to choose between getting gas to go to work and buying food for our families.

#WillieWilson, #GasGiveaway, #CommitmentToService https://t.co/Yy9eZqsIxs"
71,2022-03-31 21:56:29+00:00,1509650869591150599,"MEDIA STATEMENT

Wilson Knocks Mayor Lightfoot Plan to Deal with Soaring Gas Prices as Election Year Stunt That Does Not Go Far Enough https://t.co/qXDIr9VORJ"
72,2022-03-31 21:30:06+00:00,1509644228342824962,https://t.co/9yqNLOusWR
73,2022-03-31 21:29:37+00:00,1509644106128977938,https://t.co/vnNZsBs81A
74,2022-03-30 22:25:02+00:00,1509295664445988872,"Why it is important to temporarily suspend the gas tax:

In Illinois and Chicago  drivers  pay the second highest gas taxes in the nation. 

Call upon Mayor Lightfoot and Governor Pritzker to suspend the gas tax to save us all money at the pump.

#WillieWilson,#SuspendTheGasTax https://t.co/PpqYu74zHQ"
75,2022-03-29 19:16:03+00:00,1508885718566907910,"From the Personal Desk of Dr. Willie Wilson

Media Advisory
Wilson Announces Decisions on 
Whether He Will Run for Mayor of Chicago https://t.co/RCyPf6dO01"
76,2022-03-28 16:01:17+00:00,1508474314227601421,"We are doing our part, but gas prices are still way too high. We call upon Mayor Lightfoot and Governor Pritzker to immediately lower our gas taxes. #lowerthetax #drwilliewilson

https://t.co/j6a9HX6qr8"
77,2022-03-26 14:15:08+00:00,1507722826698084356,"We are committed to helping all of us to get through these tough times together.  
#drwilliewilson #togetherwecan #suspendgastax
https://t.co/lE59KFt7P2"
78,2022-03-25 17:00:24+00:00,1507402027139321865,"Behold, how good and how pleasant it is for brethren – Psalms 133:1
 When I left home to seek my fortune, my mama gave me some advice that I have learned is very sound. She said, Judge people by the way they treat you.
An excerpt from my book:  purchase at https://t.co/9a25iHpCtt https://t.co/2fhdohkgno"
79,2022-03-25 16:02:15+00:00,1507387393359421466,"MEDIA STATEMENT
Wilson Urges Federal, State, and Local Leaders to Suspend the Gas Tax to Help Provide Relief to Illinois Families
After donating $1.2 million in free gas to help thousands of families in Chicago and Cook County...READ MORE BELOW https://t.co/Ct5lNZb7tW"
80,2022-03-23 22:30:04+00:00,1506760217207492609,"Free Gas

To help ease the gas crunch, Dr. Willie Wilson will be giving away $1 million in Free Gas on tomorrow 3/24 from 7:00am until the $1million is exhausted.

For locations go to his Facebook page. Like it or share it to receive updates on Dr. Wilson's activities. https://t.co/2xvrookVCc"
81,2022-03-23 02:10:50+00:00,1506453385352212480,We've had to update the list. The current list is BROWN any other Color may not have the correct listings. Thank you for your patience. #drwilliewilson#gasgiveaway #driveupandgo #amazinggrace https://t.co/eI9F0nrv4h
82,2022-03-23 01:15:02+00:00,1506439345733050373,"Free Gas

To help ease the gas crunch, Dr. Willie Wilson will be giving away $1 million in Free Gas on March 24th from 7:00am until the $1million is exhausted.

For locations and details,go to his Facebook page. Like it or share it to receive updates on Dr. Wilson's activities. https://t.co/bJFypoHeuW"
83,2022-03-22 00:39:31+00:00,1506068019218464778,"Dr. Willie Wilson's Free Gas Giveaway  - Participating Gas Stations  - 
March 24th at 7:00am until  $1 million is exhausted
***Final VERSION*** https://t.co/6g3PMiZ5cs"
84,2022-03-21 15:29:23+00:00,1505929572222738441,"We've update the Gas Station locations for the Free Gas
#drwilliewilson #freegas #32422gas https://t.co/pGK30cMu8g"
85,2022-03-18 16:51:01+00:00,1504862953698430986,"MEDIA ADVISORY

Wilson Announces $1 Million Worth of Free Gas as Cook County Residents Experience the Highest Fuel Prices in 14 Years, 50 Participating Gas Stations Agree to Lower their Prices to Serve More Families, &amp; Invites Press, Elected Officials, &amp; Clergy to Pump Gas https://t.co/hQBNBlIqtK"
86,2022-03-16 22:20:02+00:00,1504220977357541382,https://t.co/1LulYW6fP8
87,2022-03-15 22:30:03+00:00,1503861108108632066,"This Thursday starting at 7:00 am we are donating $200,000 worth of gas to alleviate some of the pain that Chicagoans are experiencing because of the highest fuel prices in 14 years. 

See Willie Wilson's Facebook Post for full details and a list of participating gas stations. https://t.co/I079oBlMyo"
88,2022-03-15 16:06:47+00:00,1503764656090984448,"MEDIA ADVISORY

Wilson Donates $200,000 Worth of Gas as Chicagoans Experience the Highest Fuel Prices in 14 Years, &amp; Participating Gas Stations Lower their Prices to Serve More Vehicles

Thursday, March 17, 2022, at 8:30am (Free Gas Starts at 7:00am) #drwilliewilson #ificanhelp https://t.co/U67L0a5DqS"
89,2022-03-12 01:00:21+00:00,1502449382930722817,"We Need To Listen To Each Other

We all are forced to create a new post-pandemic normal. The only way to do that is...together! 

Listening and working hand-in-hand - with inclusion as the guiding light - to meet the needs of Chicago's diverse groups.

#DrWillieWilson,  #Rebound https://t.co/rHaAMsc6cl"
90,2022-03-09 23:05:02+00:00,1501695587820969990,"Chicago is tough. Tougher than anyplace in the country. 

The more resources, skills and trades Chicagoans have? The tougher they can be! 

Education means more employment. It will help us erase gender &amp; racial inequality and reduce crime.

 #DrWillieWilson, #CommitmentToService https://t.co/l0YZ1IhGTA"
91,2022-03-08 23:15:06+00:00,1501335732945920001,"Pandemic Winding Down?

The pandemic may be winding down, but the problems it created is what's left. 

We will continue to do our part with direct financial support of the at-risk homeless and our precious senior citizens. 

#DrWillieWilson, #CommitmentToService https://t.co/RpJQiZqXUg"
92,2022-03-05 23:30:03+00:00,1500252329500631044,"Why is it important to help our homeless?

The homeless are very much a part of our community and many of them are just like you and me. 

We don’t know all the how’s and why’s, we just know that people need our help. https://t.co/eDCeMWTSy3"
93,2022-03-04 14:01:55+00:00,1499746966426771456,"Asking Your Opinion

What do you feel are the biggest issues facing Chicago today?

We would very much like to know your views, suggestions and solutions. Please let us know. https://t.co/t6nAS2aLKf"
94,2022-03-01 23:00:31+00:00,1498795348361371649,"Education is our greatest asset. 

Education eliminates gender &amp; racial inequality, reduces poverty &amp; crime. Education must include trade training, apprenticeships &amp; involve unions to ensure all children have a bright future. https://t.co/AXcyzGwZR1"
95,2022-03-01 00:35:02+00:00,1498456742795042819,"The New Mask Rules - Explained

Mask mandates have been lifted across Illinois and Chicago.

You will still need masks in certain locations, i.e.  hospitals, public transit, prisons, Chicago Public Schools and at the discretion of any venue that requires it.
#DrWillieWilson https://t.co/eAG1p7UnCM"
96,2022-02-27 01:00:11+00:00,1497738296998481921,"One Way To Combat Inflation - Invest in Yourself

We can’t prevent inflation, but the best investment you can make to prepare for an uncertain economy is to invest in yourself. One that will increase your future earning power.

Get a quality education and quality training. https://t.co/h83ZabsMUf"
